user_input,retrieved_contexts,response,reference,context_recall,faithfulness,factual_correctness(mode=f1)
Which three hyperparameters were mostly considered for arrangement in training BERT-based models?,"['According to several studies, the proper arrangement of hyperparameters has a significant impact on the BERT-based model. Based on our reviewed papers, the three most considered hyperparameters for training models were learning rate, batch size, and the type of optimizer. Most of the studies also applied certain types of arrangement for these three hyperparameters. These kinds of arrangements practiced in several studies have provided valuable insight for future works in BERT-based models development and optimization. It is strongly advised to identify the purpose of the models’ development or', 'Finding the proper model frequently entails conducting empirical experiments and evaluation of a number of candidate models to decide which one performs best. To make an informed decision, it is important to comprehend the available collection of models, particular NLP tasks to handle, and the availability of training materials (corpus) in advance. RQ 2. What type of hyperparameters were mostly considered to be properly arranged in training the BERT-based models?', 'ing their performance. Learning rate, batch size, and the type of optimizer were the three most considered hyperparameters to be properly arranged in BERT-based model training. A number of factors should be considered when deciding on certain hyperparameter arrangements, including the employed hardware capacity, the size of datasets (corpus), the type of the NLP tasks, and the type of the intended model to be developed or optimized (i.e. generic-foundational or specific-customized models). Third, different types of metrics are normally employed for particular NLP tasks. The most widely used', 'Certain hyperparameters arrangement plays a crucial role in optimizing the training process and the resulting performance of deep learning models like BERT. The proper ar- rangement in setting the hyperparameters can have a notable effect on the training process and the resulting models’ performance on certain tasks. Learning rate, batch size, and the type of optimizer were the three most considered hyperparameters to be properly arranged in BERT-based model training. Understanding the utility and influence of each hyperpa- rameter is critical for achieving optimal results. Table 4 lists', 'med- ical, law/legal or others), and iii) the intended language to be applied (such as English or others). Second, certain types of hyperparameters arrangements is suggested for training the BERT-based models for improving their performance. Learning rate, batch size,']","According to the provided context, the three most considered hyperparameters for arrangement in training BERT-based models were:

1. Learning rate
2. Batch size
3. The type of optimizer","The three most considered hyperparameters were the learning rate, batch size, and the type of optimizer.",1.0,1.0,0.0
What are the main limitations of existing RAG systems that LightRAG seeks to address?,"['RAG generally refers to any system where a user query is used to retrieve relevant information from external data sources, whereupon this information is incorporated into the generation of a response to the query by an LLM (or other generative AI model, such as a multi-media model). The query and retrieved records populate a prompt template, which is then passed to the LLM (Ram et al., 2023). RAG is ideal when the total number of records in a data source is too large to include in a single prompt to the LLM, i.e. the amount of text in the data source exceeds the LLM’s context window.', 'surpassing many baselines built with larger LLMs. A comprehensive analysis is conducted to understand its scaling behavior and generalization capability. In the future, we intend to extend CoRAG to more challenging and economically valuable RAG tasks, advancing towards building', '9 Broader Impact This work offers several positive societal beneﬁts over previous work: the fact that it is more strongly grounded in real factual knowledge (in this case Wikipedia) makes it “hallucinate” less with generations that are more factual, and offers more control and interpretability. RAG could be employed in a wide variety of scenarios with direct beneﬁt to society, for example by endowing it with a medical index and asking it open-domain questions on that topic, or by helping people be more effective at their jobs.', 'With these advantages also come potential downsides: Wikipedia, or any potential external knowledge source, will probably never be entirely factual and completely devoid of bias. Since RAG can be employed as a language model, similar concerns as for GPT-2 [50] are valid here, although arguably to a lesser extent, including that it might be used to generate abuse, faked or misleading content in the news or on social media; to impersonate others; or to automate the production of spam/phishing content [54]. Advanced language models may also lead to the automation of various jobs in the coming', 'x,z,y1:i \x00 1Code to run experiments with RAG has been open-sourced as part of the HuggingFace Transform- ers Library [66] and can be found at https://github.com/huggingface/transformers/blob/master/ examples/rag/. An interactive demo of RAG models can be found at https://huggingface.co/rag/ 2 by ✓ that generates a current token based on a context of the previous i input x and a retrieved passage z. \x00 1 tokens y1:i \x00']",I don't know.,"Existing RAG systems rely on flat data representations and lack adequate contextual awareness, leading to fragmented answers that miss complex interdependencies.",1.0,0.0,0.0
What happens to downstream task performance when the NSP loss is removed and sequences are drawn from a single document?,"['Source: [43] When testing the training, it was concluded that removing the NSP function improves performance on subsequent tasks, which directly contradicts the original publication. Also, using sentences instead of segments degrades performance, presumably by removing the ability to make long-term generalizations.', 'the NSP loss and training with blocks of text from a sin- gle document (DOC-SENTENCES). We ﬁnd that this setting outperforms the originally published BERTBASE results and that removing the NSP loss matches or slightly improves downstream task performance, in contrast to Devlin et al. (2019). It is possible that the original BERT implementa- tion may only have removed the loss term while still retaining the SEGMENT-PAIR input format. We next compare training without', 'for- mats retain the NSP loss, but the latter uses sin- gle sentences. We ﬁnd that using individual sentences hurts performance on downstream tasks, which we hypothesize is because the model is not able to learn long-range dependencies.', 'The NSP loss was hypothesized to be an impor- tant factor in training the original BERT model. Devlin et al. (2019) observe that removing NSP hurts performance, with signiﬁcant performance degradation on QNLI, MNLI, and SQuAD 1.1. However, some recent work has questioned the necessity of the NSP loss (Lample and Conneau, 2019; Yang et al., 2019; Joshi et al., 2019). To better understand this discrepancy, we com- pare several alternative training formats:', 'SENTENCE-PAIR+NSP: Each input contains a pair of natural sentences, either sampled from a contiguous portion of one document or from separate documents. Since these inputs are sig- niﬁcantly shorter than 512 tokens, we increase the batch size so that the total number of tokens remains similar to SEGMENT-PAIR+NSP. Were- tain the NSP loss.']","According to the provided context, when the NSP loss is removed and sequences are drawn from a single document (DOC-SENTENCES), it is found that this setting outperforms the originally published BERTBASE results. Additionally, removing the NSP loss matches or slightly improves downstream task performance, in contrast to Devlin et al. (2019).","Removing the NSP loss under these conditions either matches or slightly improves downstream performance, which contrasts with the original BERT findings.",1.0,0.4,0.5
What transformations are applied to the output of each sub-layer in the encoder and decoder before moving to the next block?,"['3.1 Encoder and Decoder Stacks Encoder: The encoder is composed of a stack of N = 6 identical layers. Each layer has two sub-layers. The ﬁrst is a multi-head self-attention mechanism, and the second is a simple, position- 2 Figure 1: The Transformer - model architecture.', 'Decoder: The decoder is also composed of a stack of N = 6 identical layers. In addition to the two sub-layers in each encoder layer, the decoder inserts a third sub-layer, which performs multi-head attention over the output of the encoder stack. Similar to the encoder, we employ residual connections around each of the sub-layers, followed by layer normalization. We also modify the self-attention sub-layer in the decoder stack to prevent positions from attending to subsequent positions. This masking, combined with fact that the output embeddings are offset by one position, ensures that the', '3.3 Position-wise Feed-Forward Networks In addition to attention sub-layers, each of the layers in our encoder and decoder contains a fully connected feed-forward network, which is applied to each position separately and identically. This consists of two linear transformations with a ReLU activation in between. FFN(x) = max(0,xW1 + b1)W2 + b2 (2)', 'The Transformer follows this overall architecture using stacked self-attention and point-wise, fully connected layers for both the encoder and decoder, shown in the left and right halves of Figure 1, respectively.', 'The encoder contains self-attention layers. In a self-attention layer all of the keys, values and queries come from the same place, in this case, the output of the previous layer in the encoder. Each position in the encoder can attend to all positions in the previous layer of the encoder.']","According to the provided context, the output of each sub-layer in the encoder and decoder is passed through two transformations before moving to the next block:

1. Residual connections: The output of each sub-layer is added to the input of the sub-layer, which is a residual connection.
2. Layer normalization: The output of each sub-layer is normalized using layer normalization.

This is mentioned in the context of the encoder and decoder architecture in the paper ""Attention Is All You Need"".","A residual connection is added to the sub-layer's output, which is then followed by layer normalization.",0.5,0.16666666666666666,0.57
"What are the two primary components used to process the ""sentences"" and ""words"" in the TNT architecture?","['l = Zl−1 + MSA(LN(Zl−1)), l + MLP(LN(Z(cid:48) l)). This outer transformer block Tout is used for modeling relationships among sentence embeddings. In summary, the inputs and outputs of the TNT block include the visual word embeddings and sentence embeddings as shown in Fig. 1(b), so the TNT can be formulated as Yl,Zl = TNT(Yl−1,Zl−1).', 'Y i = [yi,1,yi,2,··· ,yi,m], yi,j = FC(Vec(xi,j)), (5) where yi,j ∈ Rc is the j-th word embedding, c is the dimension of word embedding, and Vec(·) is the vectorization operation. In TNT, we have two data ﬂows in which one ﬂow operates across the visual sentences and the other processes the visual words inside each sentence. For the word embeddings, we utilize a transformer block to explore the relation between visual words: Y (cid:48)i l = Y i l = Y (cid:48)i Y i l−1 + MSA(LN(Y i l + MLP(LN(Y (cid:48)i l−1)), l)). (1) (2) (3) (6) (7) 3', 'entire collection. In our paper, the focus is on studying the integration of lexical and neural approaches in the general case. Thus, our approach can be applied on top of any semantic model to further improve its performance. Furthermore, the approach we take in this paper', 'using a publicly available TREC collection, which demonstrates the effectiveness of our approach and sheds light on the different characteristics of the semantic approach, the lexical approach, and their combination.', 'visual sentence embedding after the projection of a linear layer. We build our TNT architecture by stacking the TNT blocks. Compared to the conventional vision transformers (ViT) which corrupts the local structure of the patch, our TNT can better preserve and model the local']","According to the provided context, specifically from Document(id='fc82175c-62d4-47ad-933c-0811b285e8b1'), the two primary components used to process the ""sentences"" and ""words"" in the TNT architecture are:

1. A transformer block to explore the relation between visual words.
2. A multi-layer perceptron (MLP) and a multi-head self-attention (MSA) mechanism.

These components are used in the following equations:

(1) Y (cid:48)i l = Y i l = Y (cid:48)i Y i l−1 + MSA(LN(Y i l + MLP(LN(Y (cid:48)i l−1)), l))

where Y (cid:48)i l is the output of the transformer block, Y i l is the output of the MLP and MSA mechanism, and Y i l−1 is the input to the transformer block.","The architecture uses a conventional (outer) transformer block for extracting features and attentions of visual sentences, and embeds a sub-transformer (inner) block for excavating features of visual words.",1.0,0.7142857142857143,0.17
What were the characteristics of the News articles dataset utilized in the evaluation?,"['News articles. A benchmark dataset comprised of news articles published from September 2013 to December 2023 in a range of categories, including entertainment, business, sports, technology, health, and science (Tang and Yang, 2024). The corpus is divided into 3197 × 600-token text chunks, with 100-token overlaps between chunks (∼1.7 million tokens).', 'News Articles Mean 1 55.52 58.8 62.08 63.6 71.76 74.72 79.2 79.44 79.6 51.92 53.68 57.76 52.16 55.12 58.64 46.88 54.64 55.76 60.16 62.08 64.96 70.56 69.12 67.2 39.68 40.96 50.24 41.04 49.52 50.96 42.24 50 49.52 51.68 42.72 51.36 49.84 49.52 52.88 42.4 44.8 52 44.32 51.44 50.4 45.2 46.64 48.32 48.32 41.44 45.2 44.88 45.6 46 47.6 48.48 49.28 47.2 48.8 48.8', 'tailored to complete particular jobs [26]. It collected vast amounts of data from the web, including tens of thousands of Wikipedia entries, posts on social media, and news items, and used that information to learn the relationships between sentences, words, and word components', '19 D Example Answer Comparison Table 5: Example question, answers, and LLM-generated assessments for the News article dataset. Question Which public are repeatedly mentioned across various entertainment articles? Graph RAG', 'On the other hand, different domain data sets have been used to evaluate the models; these range from review data for sentiment analysis tasks to transcripts and news for more traditional tasks, such as part of speech tagging. News data are the most common domain, presumably because they are easier to retrieve, and because their more formal register makes them more suited for tasks such as part of speech tagging, dependency parsing, and named entity recognition. Similarly, social media posts from Twitter are mostly used in tasks like sentiment analysis and identiﬁcation of offensive language.']","According to the provided context, the News articles dataset utilized in the evaluation was comprised of news articles published from September 2013 to December 2023 in a range of categories, including entertainment, business, sports, technology, health, and science. The corpus is divided into 3197 × 600-token text chunks, with 100-token overlaps between chunks (∼1.7 million tokens).","The dataset consisted of news articles from September 2013 to December 2023 across various categories, totaling roughly 1.7 million tokens divided into 3197 chunks.",1.0,1.0,0.73
How does G-RAG formulate the initial document embeddings used as node features in the graph neural network?,"['g positive documents. To highlight the advantages of the proposed G-RAG over state-of-the-art benchmarks, we conducted experiments across various embedding models with fine-tuning parameter in the next section.', '3.2.3 Representation Update Based on the above initial node and edge representations, we arrive at updating representations in the graph neural networks. Given a document graph G(V,E) with |V| = n, the input feature of node v ∈ Rd, and the initial representation of the edge between node v and u is given v ∈ V is denoted as x0 uv ∈ Rl with l = 2. Let N(v) denote the neighbor nodes of the node v ∈ V. The representation by e0 of node v ∈ V at layer ℓ can be derived from a GNN model given by: v = g(xℓ−1 xℓ v , (cid:91) f(xℓ−1 u ,eℓ−1 uv )),', '…… … ……… …… …Q&PAMRsfindconnectionsestablishGNNDocumentGraphReranker Figure 1: G-RAG uses two graphs for re-ranking documents: The Abstract Meaning Representation (AMR) graph is used as features for the document-level graph. Document graph is then used for document reranking.', 'Following Section 3.1, we construct a graph among the n = 100 retrieved documents denoted as Gq given the question q. We aim to exploit both the structural information and the AMR semantic information to rerank the retrieved documents. To integrate the semantic information of documents, the pre-trained language models such as BERT [6], and RoBERTa [23] are powerful tools to encode the document texts as node features in graph neural networks. Even though Wang et al. [42] integrate AMR information into LMs, it increases computational time and GPU memory usage. To address this, we proposed node', 'document graph Gq = {V,E} based on AMRs {Gqp1,··· ,Gqpn}. For each node vi ∈ V, it corresponds to the document pi. For vi,vj ∈ V, i ̸= j, if the corresponding AMR Gqpi and Gqpj have common nodes, there will be an undirected edge between vi and vj (with a slight abuse in notation) denoted as eij = (vi,vj) ∈ E. We remove isolated nodes in Gq. In the following, we will construct the graph neural networks based on the document graphs to predict whether the document is relevant to the question. Please refer to Appendix A for AMR graph statistics, i.e., the number of nodes and edges in AMR graphs,']","According to the provided context, the initial document embeddings used as node features in the graph neural network are formulated by encoding the document texts using pre-trained language models such as BERT [6] and RoBERTa [23].",The embedding for each document node is created by encoding the concatenation of the document's text and a sequence of words that represents the document's AMR information.,1.0,0.75,0.25
What tokenizer is used to encode the validation set during perplexity calculation?,"['For language generation experiments, we calculate the perplexity, in standard fashion like Radford et al. (2019), as follows: First, the entire validation set is concatenated using two linebreaks as separators and encoded using the default HuggingFace tokenizer of each model. Next, the sequence is split into non-overlapping segments of width 2048, the full context size of our models. These are sent through the model to collect the log-probabilities corresponding to the next token each. Their exponentiated average is the ﬁnal perplexity we report. For zero-shot tasks we follow the EleutherAI', 'Tokenizers A critical NLP-speciﬁc aspect of the library is the implementations of the tokenizers nec- essary to use each model. Tokenizer classes (each inheriting from a common base class) can either be instantiated from a corresponding pretrained model or can be conﬁgured manually. These classes store the vocabulary token-to-index map for their corre- sponding model and handle the encoding and de- coding of input sequences according to a model’s speciﬁc tokenization process. The tokenizers im- plemented are shown in Figure 2 (Right). Users can easily modify tokenizer with interfaces to add', 'Document Encoder. Our document encoder has a very similar architecture. We first segment a document 𝑑 into its constituent tokens𝑑1𝑑2...𝑑𝑚,towhichweprependBERT’sstarttoken[CLS]fol- lowed by our special token [D] that indicates a document sequence. Unlike queries, we do not append [mask] tokens to documents. Af- ter passing this input sequence through BERT and the subsequent linear layer, the document encoder filters out the embeddings corre- sponding to punctuation symbols, determined via a pre-defined list. This filtering is meant to reduce the number of embeddings per doc- ument, as we', 'Tokenizers can also implement additional useful features for the users. These range from token type indices in the case of sequence classiﬁcation to maximum length sequence truncating taking into account the added model-speciﬁc special tokens (most pretrained Transformer models have a maxi- mum sequence length). For training on very large datasets, Python-based', 'where We,Wd ∈ RD×S encode and decode token em- beddings in H = {hi} ∈ RN×D indepedently, and TEi denotes the optional timestamp embedding. Via the causal attention of the decoder-only Transformer, the autoregres- sively generated ˆsi+1 is obtained as the next token of si. Thus, we formulate the pre-training objective as follows: LMSE =']","According to the context, the tokenizer used to encode the validation set during perplexity calculation is the ""default HuggingFace tokenizer"" of each model.",The validation set is encoded using the default HuggingFace tokenizer specific to each model.,1.0,0.6666666666666666,1.0
What is the objective of the KL-divergence loss in soft-label distillation?,"['q,d− (cid:11) . (10) To examine the effectiveness of different distillation functions, Izacard et al. [102] perform an empirical comparison of the above loss functions, and they find that the KL-divergence loss leads to a better distillation performance than MSE loss and max-margin loss for the task of question answering. Further, the researchers empirically find that the Margin-MSE loss is more effective than the other options [89, 92], e.g., pointwise MSE loss.', '19] extends the distillation way by introducing a dynamic listwise distillation mechanism: both the retriever (student) and the reranker (teacher) are mutually updated and improved. Based on the KL-divergence loss (Equation (8)), the teacher model is also able to be adjusted according to the student model, yielding a better distillation performance.', '= 4,096) in-batch + hard-label distillation (bs = 4,096) in-batch + hard-label distillation + p-centric pretraining (bs = 4,096) soft-label distillation (bs = 96) soft-label distillation + joint retriever-reranker training (7 hard negs) (bs = 96) soft-label distillation + joint', 'Soft-label distillation. Instead of using hard labels, we can also approximate the outputs of the teacher network by tuning the student network. Formally, let r (t) q,d denote the relevance scores of textd w.r.t. to query q assigned by the teacher network and the student network, respec- tively. Next, we introduce several distillation functions. q,d and r (s) — MSE loss. This function directly minimizes the difference between the relevance scores be- tween the teacher and student using mean-squared error loss: MSE = 1 LKD 2 (cid:10) r (t) q,d (cid:9) (cid:9) −r (s) q,d q∈Q', 'Distillation for the student network. After training the teacher network, we utilize it to im- prove the student network. The basic idea is to run the well-trained teacher network on the unla- beled (or even labeled) data to produce pseudo relevance labels for training the student network. According to the types of the derived labels, we can categorize the distillation approaches into two major categories, namely, hard-label and soft-label distillation.']","According to the context, in soft-label distillation, the KL-divergence loss is used as a distillation function. The KL-divergence loss is defined as:

MSE = 1/LKD 2 (r (t) q,d (cid:9) (cid:9) −r (s) q,d) q∈Q

where r (t) q,d is the relevance score assigned by the teacher network and r (s) q,d is the relevance score assigned by the student network.

The objective of the KL-divergence loss in soft-label distillation is to directly minimize the difference between the relevance scores between the teacher and student using mean-squared error loss.",The KL-divergence loss aims to reduce the difference between the probability distributions of relevance scores generated by the teacher and student networks.,0.5,1.0,0.67
