user_input,retrieved_contexts,response,reference,context_recall,faithfulness,factual_correctness(mode=f1)
What two groups of variables form the bipartite graph in the GANsformer?,"['The section is structured as follows: we ﬁrst present a for- mulation of the Bipartite Transformer, a general-purpose generalization of the Transformer (section 3.1). Then, we provide an overview of how the transformer is incorporated into the generator and discriminator framework (section 3.2). We conclude by discussing the merits and distinctive proper- ties of the GANsformer, that set it apart from the traditional GAN and transformer networks (section 3.3). 3.1. The Bipartite Transformer', 'graph between two groups of variables (in the GAN case, latents and image features). In the following, we consider two forms of attention that could be computed over the bipartite graph – Simplex attention, and Duplex attention, depending on the direction in which information', 'Figure 2. We introduce the GANsformer network, that leverages a bipartite structure to allow long-range interactions, while evading the quadratic complexity standard transformers suffer from. We present two novel attention operations over the bipartite graph: simplex and duplex, the former permits communication in one direction, in the generative context – from the latents to the image features, while the latter enables both top-down and bottom up connections between these two variable groups.', 'We have introduced the GANsformer, a novel and efﬁcient bipartite transformer that combines top-down and bottom- up interactions, and explored it for the task of generative modeling, achieving strong quantitative and qualitative re- sults that attest for the model robustness and efﬁcacy. The GANsformer ﬁts within the general philosophy that aims to incorporate stronger inductive biases into neural networks to encourage desirable properties such as transparency, data- efﬁciency and compositionality – properties which are at the core of human intelligence, and serve as the basis for our capacity', 'The standard transformer network consists of alternating multi-head self-attention and feed-forward layers. We refer to each pair of self-attention and feed-forward layers as a transformer layer, such that a Transformer is considered to be a stack composed of several such layers. The Self- Attention operator considers all pairwise relations among the input elements, so to update each single element by attending to all the others. The Bipartite Transformer gener- alizes this formulation, featuring instead a bipartite graph between two groups of variables (in the GAN case, latents and image']","In the GANsformer, the bipartite graph is formed between two groups of variables: latents and image features.",The bipartite graph is formed between latents and image features.,1.0,1.0,0.67
"What neural network architecture forms the basis of the BERT model, and what versions of it were initially trained?","['4 Training Procedure Analysis This section explores and quantiﬁes which choices are important for successfully pretraining BERT models. We keep the model architecture ﬁxed.7 Speciﬁcally, we begin by training BERT models with the same conﬁguration as BERTBASE (L = 12, H = 768, A = 12, 110M params).', 'The BERT model training process includes two stages: pre-training on unlabeled data, and additional training on labeled data for a specific application problem. Depending on the task, the retraining process and the architectures used may differ, although they are all based on the same model with the same set of parameters.', 'the emergence of some specialized models based on the architecture and teaching methodology of BERT, which has shown its effectiveness, but previously trained on specialized text corpora, is quite logical.', '3.2 Language-Speciﬁc BERT Models The models we index vary along with a number of dimensions, which we discuss below. The main distinction, however, is the speciﬁc language the model was trained on. The availability of data sets in that language determines the tasks and domains this model was applied to.', 'notice much difference. Probably this is because differently from the original BERT paper, here we are directly training a model on the target data set.']","According to the provided context, the BERT model is based on the neural network architecture of the Transformer model. 

However, the versions of the BERT model that were initially trained are not explicitly mentioned in the provided context.",BERT is based on the multilayer bidirectional transformer. The authors originally trained a standard version with 12 layers and a large version with 24 layers.,1.0,0.5,0.29
What measure is used to evaluate the robustness of the hybrid approach?,"['in Figure 4. According to the results, it is clear that the hybrid approach is very robust. Specifically, the hybrid approach either improves or does not degrade the performance of the baseline in the majority of cases. According to the results in Figure 4, for 50% of the', 'ording to the results in Figure 4, for 50% of the queries there is an improvement when using the hybrid approach, for 40% there is no change in performance, and for 20% there is a degradation in performance. Yet, while the average percentage of improvement for the good performing queries is around 18%, the performance of the bad performing ones decreases in about 4% only.', 'the poorest-performing queries). According to the results, we can see that the improvements of the hybrid approach are much higher for the low quarters with an average improvement of 14% for Q1. In the higher quarter (Q4), on the other hand, there is only a very slight', 'results in the lexical list. Fur- thermore, it is interesting to see that the improvement is stable with respect to the result list size which attests to the potential robustness of the hybrid approach. This result motivates the explo- ration of automatic approaches for merging the', '4.2.3 Robustness analysis. In this section, we analyze the robust- ness of the hybrid approach with respect to the different queries. First, we divide the queries in the evaluation set such that the queries in each group have a similar level of increase (or decrease) in recall when using the hybrid retrieval approach, compared to the lexical retrieval baseline; the increase/decrease is measured in percentage; we focus on a result list of 1000 documents. The queries in each group are counted and presented in a histogram in Figure 4. According to the results, it is clear that the hybrid approach']","According to the context, the measure used to evaluate the robustness of the hybrid approach is the percentage of increase (or decrease) in recall when using the hybrid retrieval approach, compared to the lexical retrieval baseline.",The Reliability of Improvement (RI) is reported to measure the robustness of the hybrid approach.,1.0,0.5,0.4
What was the lowest bits/dim score achieved by the 12-layer Reformer model on the enwik8 test set?,"['the test set. We also trained a 12-layer Reformer model for longer with further tuning and improvements and we reached 1.05 bits/dim on the enwiki8 test set.', 'Large Reformer models. To verify that the Reformer can indeed ﬁt large models on a single core and train fast on long sequences, we train up to 20-layer big Reformers on enwik8 and imagenet64. As can be seen in Figure 5, these models ﬁt into memory and train. We were not able to train Trans- former baselines in this case as they are too slow and memory-hungry, but we see clear improvement with the number of layers. A 12-layer model on enwik8 trained for 20K steps with a dropout rate of 0.1 achieves 1.19 bits/dim on the test set. We also trained a 12-layer Reformer model for longer with further', 'activations only once in the training pro- cess instead of N times, where N is the number of layers. The resulting model, the Reformer, performs on par with Transformer models while being much more memory-efﬁcient and much faster on long sequences.', '7 Published as a conference paper at ICLR 2020 Figure 3: Effect of shared query-key space (left) and reversibility (right) on performance on enwik8 and imagenet64 training. The curves show bits per dim on held-out data. Table 4: BLEU scores on newstest2014 for WMT English-German (EnDe). We additionally report detokenized BLEU scores as computed by sacreBLEU (Post, 2018).', '∗Equal Contribution 1https://hackingsemantics.xyz/2019/leaderboards/ 1 Published as a conference paper at ICLR 2020 We introduce the Reformer model which solves these problems using the following techniques: Reversible layers, ﬁrst introduced in Gomez et al. (2017), enable storing only a single copy of activations in the whole model, so the N factor disappears. Splitting activations inside feed-forward layers and processing them in chunks removes the dff factor and saves memory inside feed-forward layers.']","According to the context, the lowest bits/dim score achieved by the 12-layer Reformer model on the enwik8 test set was 1.05 bits/dim.","With further tuning and improvements, the 12-layer Reformer model reached 1.05 bits/dim.",1.0,1.0,0.5
"How do the parameters of BioGPT compare with those of its backbone, GPT-2 medium?","['We make comparison to general domain GPT-2 for all the experiments. Speciﬁcally, we use the GPT-2medium model from the Hugging face library [52]6 which is the backbone network of our BioGPT.', 'includes open issues, other technical challenges and future research directions in the field of GPT. Finally, we conclude the paper in Section VII, by summarizing the key findings and contributions of this study. The list of key acronyms are listed in Table 1.', 'Scaling to Larger Size We also scaled our model to larger size. We built BioGPT- Large, based on the GPT-2 XL architecture (the largest version of GPT-2), with 1.5B model parameters. We ﬁne-tune and evaluate its performance on the downstream tasks, as shown in Table 11. Table 11. Performance of BioGPT-Large ﬁne-tuned on downstream tasks Task Metric Performance BC5CDR KD-DTI DDI PubMedQA Accuracy HoC F1 F1 F1 F1 50.12 38.39 44.89 81.0 84.40', 'here. demonstration. From the results in Table 7, we can see that: (1) Given relatively common names as input, for example in the ﬁrst two cases (i.e., Bicalutamide and JAK-3), GPT-2 can generate meaningful and ﬂuent text that is related to the word and biomedicine, while BioGPT generates more speciﬁc and professional descriptions. (2) When given some uncommon names (e.g., in the Apricitabine and Xylazine cases), GPT- 2 cannot generate meaningful descriptions while BioGPT still', 'F1 BioBERT [10] PubMedBERT [9] PubMedBERTlarge BioLinkBERTbase GPT-2medium 81.54 82.32 82.70 84.35 81.84 BioGPT 85.12 We can see from the results in Table 6 that BioGPT achieves 85.12% accuracy with 3.28% improvement over general domain GPT-2, and surpasses BioBERT, PubMedBERT and BioLinkBERT with 3.58%, 2.8%, 0.77% improvements respectively.']",I don't know.,"BioGPT has 347 million parameters, slightly less than the 355 million parameters of GPT-2 medium, due to differences in the vocabulary size which affects the embedding and output projection dimensions.",1.0,,0.0
Which specific performance metrics do the authors focus on to evaluate ranking tasks?,"['However, we only describe the evaluation metrics from a general ranking perspective without considering specific task scenarios. In particu- lar, top-ranked texts are more important for retrieval tasks, and therefore cut-off metrics are often adopted to examine the quality of', '2. We introduce new metrics to assess a wide range of ranking scenarios, including those with tied ranking scores. The metrics effectively evaluate this scenario by diminishing the optimistic effect brought by tied rankings. Based on these metrics, our proposed method outperforms state-of-the-art and requires fewer computational resources.', 'computational cost. We also proposed two metrics to fairly evaluate the performance of a wide range of ranking scenarios including tied ranking scores. Furthermore, our investigation into the performance of PaLM 2 as a reranker emphasizes the significance of reranker model', 'The above metrics work well for most cases, however, they may fail to fairly characterize the ranking performance when there are ties in ranking scores, which is common in relevant scores generated by LLMs such as ChatGPT [31], PaLM 2 [9], LLaMA [38], and GPT4 [32]. Please refer to Fig 5 in the Appendix for the detailed prompt and results of relevant scores between questions and documents. To address ties in the ranking scores, we propose variants of MRR and MHits@10. Denote r(t) p as the rank of the document p with t ties. In other words, the relevant score between the question and the', 'metrics primarily focus on ranking tasks, specifically Mean Tied Reciprocal Ranking and MHits@10. Thus, our paper focuses on using reranking to improve RAG – as it is a fundamental bridge between the retrieval and reading processes.']",The authors focus on Mean Tied Reciprocal Ranking and MHits@10 as specific performance metrics to evaluate ranking tasks.,The authors primarily use Mean Tied Reciprocal Ranking (MTRR) and Tied Mean Hits@10 (TMHits@10).,1.0,0.5,0.67
How much compute time and hardware was required to train DistilBERT?,"['Data and compute power We train DistilBERT on the same corpus as the original BERT model: a concatenation of English Wikipedia and Toronto Book Corpus [Zhu et al., 2015]. DistilBERT was trained on 8 16GB V100 GPUs for approximately 90 hours. For the sake of comparison, the RoBERTa model [Liu et al., 2019] required 1 day of training on 1024 32GB V100.', 'Size and inference speed To further investigate the speed-up/size trade-off of DistilBERT, we compare (in Table 3) the number of parameters of each model along with the inference time needed to do a full pass on the STS- B development set on CPU (Intel Xeon E5-2690 v3 Haswell @2.9GHz) using a batch size of 1. DistilBERT has 40% fewer parameters than BERT and is 60% faster than BERT.', 'ELMo BERT-base DistilBERT 68.7 79.5 77.0 44.1 56.3 51.3 68.6 86.7 82.2 76.6 88.6 87.5 71.1 91.8 89.2 86.2 89.6 88.5 53.4 69.3 59.9 91.5 92.7 91.3 70.4 89.0 86.9 56.3 53.5 56.3 Table 2: DistilBERT yields to comparable performance on downstream tasks. Com- parison on downstream tasks: IMDb (test ac- curacy) and SQuAD 1.1 (EM/F1 on dev set). D: with a second step of distillation during ﬁne-tuning. Table 3: DistilBERT is signiﬁcantly smaller while being constantly faster. Inference time of a full pass of GLUE task STS-B (sen- timent analysis) on CPU with a batch size of 1. Model', '5.2 Hardware and Schedule We trained our models on one machine with 8 NVIDIA P100 GPUs. For our base models using the hyperparameters described throughout the paper, each training step took about 0.4 seconds. We trained the base models for a total of 100,000 steps or 12 hours. For our big models,(described on the bottom line of ), step time was 1.0 seconds. The big models were trained for 300,000 steps (3.5 days). 5.3 Optimizer', 'The results on each of the 9 tasks are showed on Table 1 along with the macro-score (average of individual scores). Among the 9 tasks, DistilBERT is always on par or improving over the ELMo baseline (up to 19 points of accuracy on STS-B). DistilBERT also compares surprisingly well to BERT, retaining 97% of the performance with 40% fewer parameters.']","According to the provided context, DistilBERT was trained on 8 16GB V100 GPUs for approximately 90 hours.",It took approximately 90 hours to train DistilBERT using 8 16GB V100 GPUs.,1.0,1.0,1.0
On what specific datasets does G2PT demonstrate the effectiveness of its learned representations for classification tasks?,"['G2PT for molecular property prediction on MoleculeNet datasets. The results demonstrate the effectiveness of G2PT’s learned representations for classification tasks. Finally, we analyze the G2PT model and show its performance with data aug- mentation.', 'goodness of fit on the training set. G2PT also delivers strong performance on the GuacaMol and QM9 datasets. We additionally pro- vide qualitative examples from the MOSES and GuacaMol', 'GuacaMol 10 70 100 85M 300M 100Validity (%) MOSES 90 MOSES GuacaMol 1.5BModel size QM9 60 100#Sequences per graph 1M 10M 80 707M 1 90 QM9 Figure 3. Model and data scaling effects. as 3D information or chirality, G2PT is trained exclusively on 2D graph structural information. Overall, these results indicate that G2PT not only excels in generation but also learns effective graph representations. 5.7. Scaling Effects', 'The quantitative results are presented in Table 4. On MOSES, G2PT surpasses other state-of-the-art models in va- lidity, uniqueness, FCD, and SNN metrics. We introduce the details for metrics in appendix B.6. Notably, the FCD, SNN, and scaffold similarity (Scaf) evaluations compare gener- ated samples to a held-out test set, where the test molecules have scaffolds distinct from the training data. Although the scaffold similarity score is relatively low, the overall perfor- mance indicates that G2PT achieves a better goodness of fit on the training set. G2PT also delivers strong performance on', 'B.4. Fine-tuning G2PT for Graph Property Prediction Datasets. We use eight classification tasks in MoleculeNet (Wu et al., 2018a) following Zhu et al. (2024) to validate the predictive capability of our learned representations. (2) (3) (4) The datasets cover two types of molecular properties: biophysical and physiological properties.']","According to the provided context, G2PT demonstrates the effectiveness of its learned representations for classification tasks on the MoleculeNet datasets.",G2PT was fine-tuned for molecular property prediction on the MoleculeNet datasets.,0.3333333333333333,1.0,0.86
Where can the code to reproduce all the experiments be found?,"['The answer NA means that the paper does not include experiments. • If the paper includes experiments, a No answer to this question will not be perceived well by the reviewers: Making the paper reproducible is important, regardless of whether the code and data are provided or not.', '5. Open access to data and code Question: Does the paper provide open access to the data and code, with sufﬁcient instruc- tions to faithfully reproduce the main experimental results, as described in supplemental material? 23 Answer: [Yes] Justiﬁcation: We include implementation details in the paper and will release the code and data after publication.', 'A.2 EXPERIMENT DETAILS This section provides additional details about our experiment setup, in particular regarding the model evaluation and the setup of our timing experiments.', '8. Experiments compute resources Question: For each experiment, does the paper provide sufﬁcient information on the com- puter resources (type of compute workers, memory, time of execution) needed to reproduce the experiments? Answer: [Yes] Justiﬁcation: We provide details on compute resources in Section A.', 'instructions for how to replicate the results, access to a hosted model (e.g., in the case of a large language model), releasing of a model checkpoint, or other means that are appropriate to the research performed.']","According to the provided context, the answer is:

The code to reproduce all the experiments can be found after publication, as stated in the following documents:

- Document(id='d08b240a-a56f-4417-85bb-7aac3f78e4ce', metadata={'source': '../data/papers/rag/corag.pdf', 'page_number': 23, 'orig_elements': 'eJy1VW1v2zYQ/isHfVoBS5NIvVj5MhjYMGTogg3tlyENAoo8xUQpUSOpxEbQ/76j5DZe027Dinyxfe/H5547Xz8maHDAMdxqlVxAIgtZY5Nv0zKvi7RkLE/FlrOUqS7fFlXTVH2fbCAZMAglgqCYx0Ra65QeRUC/yEYc7Rxu96jv9oE0TcuynIJO+getwp7UdbGqJ6vHECOvr4uqyvgGWFFk7GYDn2RWZEWUy22ZsS/Iiz8pEn/0AYf4kt/0Ac2bSUhMPsQi4g5vx3no0JGV8agLeIjtJW/3aB0OHsSo4DUOg/AQ9iLQB8LkrO3BodHoYZ7sCH5vZ6OgW2wTOnMkc48OR4kqi+iE44Qx8Wvtw2Xsh6p9jjRnoq64KtK6yXlaSlanbcG7tGjLbcXarstL9ZJI8yIrI5JV1i5In2R+kllbxZBn8uL/v5EuM/jpQJDpCIQwhJufTaAvQlLNUnfa6HD8rxDKqmd82xN6XSeIsS1Lu6LClLdNuWU5KxvVviSEJc9agqTMs2aBcJV5Ua9ylVdZ81xe/f8RQqPH90uNx8QH4ei9o8IDKXhZnKG5i4+bnYm/xTThqPQh2yUfbv5lCr/P6IO24wX8aNGvLBc0FehnQ2RW2ktjPYIwZjHqsbduEDEERkSFCoL9NDRcfAahR8BDCs+m64H256kGRUaBWiGndc10ANH3KIN/SiWN0OtGfm8dSDtKM3tq4LNs3zm8E04Z9IvhYY9kc4uDtAqXjY6jB+GWdb3XsXvKONrw6gfYjf4BHQH9B/ob+GUmWN7NfZcXUqwAXQ7TSrn19YqYpI3/ezbq9g01H+27DH6eSUkDRH9xzuMr4RzluMe3cQhfIHPD63rLiy6tJPG4rLoubZuap6wuOWu3Usi8fPnLy+myVmeXl5paL22VlzHkmbz4f8vlpRHFGcDVDgak32eXd5mwihSlaRHMRAEVmfORYj6DdzPtOYPLc06cHP255wYEXNmPtRYOag9/nhYBHjRRPRaJRx2dRBqUggckbXdcUju810ix/gJ+Fe/1eHdW8Ol8GVoWD3qYrAtiDBv4Bnp+5Z/k5i8zqmw5', 'languages': ['eng'], 'filename': 'corag.pdf', 'filetype': 'application/pdf', 'category': 'CompositeElement', 'element_id': '09cb890515540a2e2a32393ba3b333ca', 'start_index': 476}, page_content='The answer NA means that the paper does not include experiments. • If the paper includes experiments, a No answer to this question will not be perceived well by the reviewers: Making the paper reproducible is important, regardless of whether the code and data are provided or not.') 
- Document(id='4a34ea47-520e-4b85-a462-69c65b19c04f', metadata={'source': '../data/papers/rag/corag.pdf', 'page_number': 23, 'orig_elements': 'eJy1VF1r3DAQ/CvCzydjS7Jk56UUSqGl9IMWSklDkKVVTuCzjSXncoT+967spM3HUWjgXo6b1az2NHsz57cZdLCDPl56m52RjBW15sqUVPDGUaEaRmvQjnIj2raWVheNyjYk20HUVkeNPbeZGYbJ+l5HCAvu9GGY4+UW/NU2YgVvyQtsuqvvvY1bLMtyLY+D72PqPD8veZmLDZGqyquLDfmD6yqXCTNZ5+URvPCxkIVDiLBLL/nsb6D7OmoD2a80RF/BZT/vWpjwlPFUi3CTfl5W5eTTCD3RxkAIJA4kPY3o3hIzWEjvjYcREvWDD/FdmoD9T7WrpVPOCE5bCYKKkkvacNdQrQrOBGtZxewptRM8b1CLpsjFot2KFWM5S7gqqlw9xyv/xdp9mSFEP/Rn5M0AqN0WyKhHmMg4DdfeAhkeK5sIj9TdkL2PWxJm93N2bVEaj4oS34c4zYaSdPfS6DTS3Nx1BzIBXm5nA8ttO+17Ajc406dl6A7Pw9zFsCE6EAvBTL4Fi1fikHFcV4asHWo+ed29erjfj3qadPTX8C2978iSQRa4Z6hwycpSYYykrcZvprWGF6pljtcnXDIvylRSguVlWuI9rpC54PI4XvgvXjLjDzV6Owyo3DFxFEjZsrqmrnCGCi2B1rx0tCwkqytjmWr46R2gxPoHv4O1WKViKFX9DC7k/xFGPBTmdR/2MOHsHxAuHmr0zccOjoYEd7LkvKLKMUkFqIqiOfBD1JhiDKttdXqJ6uZRRpRlcZ8JInU8xQv9xSK9nzEh7syt16z4DmhH082YD353b8l0hH6N2nchufVvlqSs2PsuObsDHVbfp/BYTtY4cTGFztx2fh2S/8PWF78BoV0YgQ==', 'languages': ['eng'], 'filename': 'corag.pdf', 'filetype': 'application/pdf', 'category': 'CompositeElement', 'element_id': '3c9efbdd3abd843aac1d0ee6d57119ef', 'start_index': 0}, page_content='5. Open access to data and code Question: Does the paper provide open access to the data and code, with sufﬁcient instruc- tions to faithfully reproduce the main experimental results, as described in supplemental material? 23 Answer: [Yes] Justiﬁcation: We include implementation details in the paper and will release the code and data after publication.')",The code is provided in the Supplementary Materials.,1.0,0.75,0.22
What do the DCI metrics evaluate in the context of the GANsformer's latent representations?,"['., 2020) and present the results in . This analysis conﬁrms that the GANS- former latent representations enjoy higher disentanglement when compared to the baseline StyleGAN approach.', 'Object Area Object Number Co-occurrence Shape Size Material Color Class GAN 0.038 2.378 13.532 1.334 0.256 0.108 1.011 6.435 StyleGAN 0.035 1.622 9.177 0.643 0.066 0.322 1.402 4.571 GANsformers 0.045 2.142 9.506 1.856 0.393 1.573 1.519 5.315 GANsformerd 0.068 2.825 13.020 2.815 0.427 2.887 3.189 16.742 Table 3. Disentanglement metrics (DCI), which asses the Disen- tanglement, Completeness and Informativeness of latent repre- sentations, computed over 1k CLEVR images. The GANsformer achieves the strongest results compared to competing approaches.', 'the GANsformer can gather the information in a more adaptive and selective manner. Overall, using this structure endows the discriminator with the capacity to likewise model long- range dependencies, which can aid the discriminator in its assessment of the image ﬁdelity,', 'Figure 3. Model Structure. Left: The GANsformer layer, com- posed of a bipartite attention to propagate information from the latents to the evolving features grid, followed by a standard con- volution and upsampling. These layers are stacked multiple times starting from a 4×4 grid, until a ﬁnal high-resolution image is produced. Right: The latents and image features attend to each other to capture the scene compositionality. The GANsformer’s compositional latent space contrasts with the StyleGAN mono- lithic one, where a single latent modulates uniformly the whole scene.', 'and, while featuring an efﬁcient setup that still scales linearly with the input size on the other. As such, the GANsformer can sidestep the computational costs and applicability constraints incurred by prior work, due to their dense and potentially excessive pairwise connectivity of the standard transformer (Zhang et al., 2019; Brock et al., 2019), and successfully advance generative modeling of images and scenes.']","The DCI metrics evaluate the Disentanglement, Completeness, and Informativeness of latent representations in the context of the GANsformer's latent representations.","They evaluate Disentanglement, Completeness, and Informativeness to measure the one-to-one correspondence between latent factors and global image attributes.",1.0,1.0,0.75
