user_input,retrieved_contexts,response,reference,context_recall,faithfulness,factual_correctness(mode=f1)
How does the GANsformer update the input elements using the retrieved information from attention?,"['4.2. Transparency & Compositionality To gain more insight into the model’s internal representa- tion and its underlying generative process, we visualize the attention distributions produced by the GANsformer as it synthesizes new images. Recall that at each layer of the generator, it casts attention between the k latent variables and the evolving spatial features of the generated image.', 'Figure 5. Sample images and attention maps. Samples of images generated by the GANsformer for the CLEVR, LSUN-Bedroom and Cityscapes datasets, and a visualization of the produced attention maps. The different colors correspond to the latent variables that attend to each region. For the CLEVR dataset we should multiple attention maps in different layers of the model, revealing how the latent variables roles change over the different layers – while they correspond to different objects as the layout of the scene is being formed in early layers, they behave similarly to a surface normal in the', 'oduced attention maps to shed more light upon its internal representations and synthe- sis process. All in all, as we will see through the rest of the paper, by bringing the renowned GANs and Transformer architectures together under one roof, we can integrate their complementary strengths, to create a strong, compositional and efﬁcient network for visual generative modeling.', 'Figure 1. Sample images generated by the GANsformer, along with a visualization of the model attention maps. and prior knowledge inform the interpretation of the par- ticular (Gregory, 1970). While their respective roles and dynamics are being actively studied, researchers agree that it is the interplay between these two complementary processes that enables the formation of our rich internal representa- tions, allowing us to perceive the world in its fullest and create vivid imageries in our mind’s eye (Intait˙e et al., 2013).', 'Duplex (Ours) 020406080100120140160180100100010000100000FID ScoreDataset size (Logaritmic)Data Efficiency GAN Figure 6. (1-2) Performance as a function of initial and ﬁnal layers the attention is applied to. The more layers attention is applied to, the better the model’s performance get and the faster it learns, verifying the effectiveness of the GANsformer approach. (3) Learning curve for the GANsformer and competing approaches. (4): Data-efﬁciency for CLEVR.']",I don't know.,"It uses the retrieved information to control the scale and bias of the elements, similar to the multiplicative integration in StyleGAN.",0.0,0.0,0.0
How is the Transformers library designed to serve different user bases?,"['Figure 2: The Transformers library. (Diagram-Right) Each model is made up of a Tokenizer, Transformer, and Head. The model is pretrained with a ﬁxed head and can then be further ﬁne-tuned with alternate heads for different tasks. (Bottom) Each model uses a speciﬁc Tokenizer either implemented in Python or in Rust. These often differ in small details, but need to be in sync with pretraining. (Left) Transformer architectures specialized for different tasks, e.g. understanding versus generation, or for speciﬁc use-cases, e.g. speed, image+text. (Top) heads allow a Transformer to be used for', 'Transformers is a library dedicated to supporting Transformer-based architectures and facilitating the distribution of pretrained models. At the core of the libary is an implementation of the Transformer which is designed for both research and production. The philosophy is to support industrial-strength im- plementations of popular model variants that are easy to read, extend, and deploy. On this founda- tion, the library supports the distribution and usage of a wide-variety of pretrained models in a cen- tralized model hub. This hub supports users to compare different models with the same', 'Transformers library and model hub as a low-level framework. Since Transformers provides a hub for NLP mod- els, it is also related to popular model hubs includ- ing Torch Hub and TensorFlow Hub which collect framework-speciﬁc model parameters for easy use. Unlike these hubs, Transformers is domain-speciﬁc which allows the system to provide automatic sup- port for model analysis, usage, deployment, bench- marking, and easy replicability.', 'Transformers aims to facilitate easy use and dis- tribution of pretrained models. Inherently this is a community process; a single pretraining run fa- cilitates ﬁne-tuning on many speciﬁc tasks. The Model Hub makes it simple for any end-user to ac- cess a model for use with their own data. This hub now contains 2,097 user models, both pretrained and ﬁne-tuned, from across the community. Fig- ure 1 shows the increase and distribution of popular transformers over time. While core models like BERT and GPT-2 continue to be popular, other spe- cialized models including DistilBERT (Sanh et al.,', '2019), Open- NMT (Klein et al., 2017), Texar (Hu et al., 2018), Megatron-LM (Shoeybi et al., 2019), and Mar- ian NMT (Junczys-Dowmunt et al., 2018). Build- ing on these elements, Transformers adds extra user-facing features to allow for easy downloading, caching, and ﬁne-tuning of']","According to the provided context, the Transformers library is designed to serve different user bases by providing a centralized model hub that allows users to easily access and use a wide variety of pretrained models. This hub supports users to compare different models with the same architecture, making it simple for any end-user to access a model for use with their own data. Additionally, the library provides automatic support for model analysis, usage, deployment, benchmarking, and easy replicability, which caters to different user needs and expertise levels.","It is designed to be extensible for researchers, straightforward for practitioners, and both fast and robust for use in industrial deployments.",1.0,0.8333333333333334,0.33
How does intra-subject learning compare to cross-subject learning when retraining BERT on specific text corpora?,"['Studies of the effectiveness of BERT retraining [74] show that, first, retrained models show significantly better results compared to models without retraining, and, secondly, intra-subject learning is generally more effective than intra-task learning. Cross-subject learning does not significantly improve performance relative to the original BERT model, which is logical given that BERT is trained on a general set of texts.', 'Further pre-training: BERT is initially trained on general-purpose texts, which may have a different data distribution than the texts of the target application area. Naturally, the desire to retrain BERT on a specific text corpus can be based on an intra-task dataset (the same dataset that will be used to train the target model), an intra-subject dataset (a set of text data obtained from the same subject area) or a cross-subject dataset, in depending on the nature of the texts and the availability of data sets.', 'developing a methodology for unsupervised learning on a large unlabeled corpus of subject-specific texts can be another way to increase the flexibility and universality of BERT for different subject areas. Using BERT for Text Annotation Tasks', 'Multitasking Learning: In the absence of pre-trained natural language models, multitasking learning is effective in leveraging shared knowledge of multiple target tasks. When researchers are faced with several word processing tasks in the same subject area, it makes sense to retrain the BERT model in these tasks simultaneously. The problem of improving the subject-specific classification of texts using BERT', 'In the context of language consideration, BERT or RoBERTa become a better alternative for English-specific tasks because both are trained on vast volumes of English corpus and perform well on several English-based NLP tasks. M-BERT, on the other hand, is a better option for “low resources” languages-specific tasks in which the local language-specific models are obviously rare. Based on the studies as have been reported in [27], [46], [40], [50], [13], [47], [32], [45], and [23], M-BERT model is the currently available answer to the cross-language problem caused by the original-based BERT']","According to the provided context, studies of the effectiveness of BERT retraining show that intra-subject learning is generally more effective than intra-task learning. However, cross-subject learning does not significantly improve performance relative to the original BERT model.","Intra-subject learning generally proves more effective than intra-task learning, while cross-subject learning yields little to no improvement over the original BERT model.",1.0,1.0,1.0
"In the on-device computation experiment, how much faster was DistilBERT compared to the BERT-base model on an iPhone 7 Plus?","['On device computation We studied whether DistilBERT could be used for on-the-edge applications by building a mobile application for question answering. We compare the average inference time on a recent smartphone (iPhone 7 Plus) against our previously trained question answering model based on BERT-base. Excluding the tokenization step, DistilBERT is 71% faster than BERT, and the whole model weighs 207 MB (which could be further reduced with quantization). Our code is available5.', 'Size and inference speed To further investigate the speed-up/size trade-off of DistilBERT, we compare (in Table 3) the number of parameters of each model along with the inference time needed to do a full pass on the STS- B development set on CPU (Intel Xeon E5-2690 v3 Haswell @2.9GHz) using a batch size of 1. DistilBERT has 40% fewer parameters than BERT and is 60% faster than BERT.', 'Data and compute power We train DistilBERT on the same corpus as the original BERT model: a concatenation of English Wikipedia and Toronto Book Corpus [Zhu et al., 2015]. DistilBERT was trained on 8 16GB V100 GPUs for approximately 90 hours. For the sake of comparison, the RoBERTa model [Liu et al., 2019] required 1 day of training on 1024 32GB V100.', 'ELMo BERT-base DistilBERT 68.7 79.5 77.0 44.1 56.3 51.3 68.6 86.7 82.2 76.6 88.6 87.5 71.1 91.8 89.2 86.2 89.6 88.5 53.4 69.3 59.9 91.5 92.7 91.3 70.4 89.0 86.9 56.3 53.5 56.3 Table 2: DistilBERT yields to comparable performance on downstream tasks. Com- parison on downstream tasks: IMDb (test ac- curacy) and SQuAD 1.1 (EM/F1 on dev set). D: with a second step of distillation during ﬁne-tuning. Table 3: DistilBERT is signiﬁcantly smaller while being constantly faster. Inference time of a full pass of GLUE task STS-B (sen- timent analysis) on CPU with a batch size of 1. Model', 'The results on each of the 9 tasks are showed on Table 1 along with the macro-score (average of individual scores). Among the 9 tasks, DistilBERT is always on par or improving over the ELMo baseline (up to 19 points of accuracy on STS-B). DistilBERT also compares surprisingly well to BERT, retaining 97% of the performance with 40% fewer parameters.']","According to the document with id '26f6c7a1-b45d-407d-8e70-129b14d8cb50', on page 4, it is stated that ""Excluding the tokenization step, DistilBERT is 71% faster than BERT, and the whole model weighs 207 MB (which could be further reduced with quantization).""",DistilBERT was 71% faster than the BERT-base model when excluding the tokenization step.,1.0,0.6,0.0
"On what corpora was the BioBERT model trained, and how large was the total volume compared to the original BERT training corpus?","['The training took place according to the BERT method [16] on a corpus consisting of annotations of articles from the PubMed database and full-text versions of articles from the PMC database. The training took place for 23 days on 8 NVIDIA V100 GPUs based on weights exported from the original pretrained BERT model, that is, formally, this is additional training. Note that the total volume of the biomedical corpus was 18 billion words, while the volume for training the original model was only 3.3 billion. The learning process is schematically shown in the figure:', 'the emergence of some specialized models based on the architecture and teaching methodology of BERT, which has shown its effectiveness, but previously trained on specialized text corpora, is quite logical.', 'Following, to a large extent, the original procedure for training the model, they concentrated on obtaining the largest possible open corpus of texts for the formation of the training sample. Initially, BERT is trained on a collection of BookCorpus [96] and Wikipedia, which is about 16 GB of uncompressed text. In this work, we used four additional public corpora of English-language texts - CC-News [100], OpenWebText [58], and Stories [78], totaling about 160 GB, that is, an order of magnitude more than the original.', '4 Training Procedure Analysis This section explores and quantiﬁes which choices are important for successfully pretraining BERT models. We keep the model architecture ﬁxed.7 Speciﬁcally, we begin by training BERT models with the same conﬁguration as BERTBASE (L = 12, H = 768, A = 12, 110M params).', 'The model was trained following the original BERT training method, but on a different, more compact body of texts and using a specialized vocabulary for tokenization. The training took 7 days on an 8-core TPU (by comparison, training the full version of the original BERT model took 4 days on a 16-core TPU and is estimated to be 40-70 days on an 8-core).']","According to the context, the BioBERT model was trained on a corpus consisting of annotations of articles from the PubMed database and full-text versions of articles from the PMC database. The total volume of the biomedical corpus was 18 billion words, while the volume for training the original BERT model was only 3.3 billion words.","BioBERT was trained on abstracts from PubMed and full-text articles from PMC. The biomedical corpus volume was 18 billion words, which is significantly larger than the original BERT's 3.3 billion word corpus.",0.8461538461538461,1.0,0.67
What specific evaluation tasks were used to benchmark BioGPT's capabilities?,"['the target sequence format and the prompt for better modeling the tasks. Experiments demonstrate that BioGPT achieves better performance compared to baseline methods and other well-performing methods across all the tasks.', 'F1 BioBERT [10] PubMedBERT [9] PubMedBERTlarge BioLinkBERTbase GPT-2medium 81.54 82.32 82.70 84.35 81.84 BioGPT 85.12 We can see from the results in Table 6 that BioGPT achieves 85.12% accuracy with 3.28% improvement over general domain GPT-2, and surpasses BioBERT, PubMedBERT and BioLinkBERT with 3.58%, 2.8%, 0.77% improvements respectively.', 'Scaling to Larger Size We also scaled our model to larger size. We built BioGPT- Large, based on the GPT-2 XL architecture (the largest version of GPT-2), with 1.5B model parameters. We ﬁne-tune and evaluate its performance on the downstream tasks, as shown in Table 11. Table 11. Performance of BioGPT-Large ﬁne-tuned on downstream tasks Task Metric Performance BC5CDR KD-DTI DDI PubMedQA Accuracy HoC F1 F1 F1 F1 50.12 38.39 44.89 81.0 84.40', 'GPT-2medium REBEL REBELpt 23.39 35.36 46.59 31.93 28.64 39.60 24.68 28.27 40.56 BioGPT 41.70 44.75 40.76 The results are shown in Table 4 from which we can see that BioGPT achieves 40.76% with 16.08% and 12.49% improvement against GPT-2medium and REBEL. It also surpasses REBELpt which uses additional large relation extraction dataset for two- stage pre-training.', 'on biomedical benchmarks. However, previous works mainly focus on BERT models which are more appropriate for understanding tasks, not generation tasks. In comparison, GPT models have demonstrated their abilities on generation tasks but demonstrate inferior performance when directly']","According to the provided context, the specific evaluation tasks used to benchmark BioGPT's capabilities are:

1. BC5CDR
2. KD-DTI
3. DDI
4. PubMedQA
5. HoC (which is likely ""Hypothesis-Only"" or a similar task, but the exact meaning is not clear from the provided context)

These tasks are mentioned in Table 11, which shows the performance of BioGPT-Large on these downstream tasks.","BioGPT was evaluated on relation extraction tasks (BC5CDR, KD-DTI, DDI), PubMedQA, document classification on HOC, and a text generation task.",0.75,0.8888888888888888,0.77
How does the masked language modeling (MLM) task operate during BERT's pre-training?,"['2.3 Training Objectives During pretraining, BERT uses two objectives: masked language modeling and next sentence pre- diction. Masked Language Model (MLM) A random sample of the tokens in the input sequence is selected and replaced with the special token [MASK]. The MLM objective is a cross-entropy loss on predicting the masked tokens. BERT uni- formly selects 15% of the input tokens for possi- ble replacement. Of the selected tokens, 80% are replaced with [MASK], 10% are left unchanged, and 10% are replaced by a randomly selected vo- cabulary token.', 'Devlin et al. (2019) introduced BERT in 2018 as a context-sensitive alternative to previous word embeddings (which assume a word always has the same representation, independent of its context). The model essentially stacks several encoder-decoder structures based on transformers together. It uses masks to blank out individual words, forcing the model to “ﬁll in the blanks”, thereby increasing its context-sensitivity. Two key elements in the BERT pretraining process are the masked language model and the next sentence prediction. In the former process, a random subsample (in the BERT paper, 15%)', 'Pre-trained Language Models It has proven to be a very successful pattern in deep learning to pre-train models on large scale unlabeled data via careful designed self-supervision tasks and then transfer to downstream tasks by ﬁne-tuning on them. Downstream tasks can beneﬁt from the learned representations from the pre-trained models. BERT [2] is a bidirectional transformer based contextualized language model pre-trained on large scale text corpus English Wikipedia and BooksCorpus. It is pre- trained via carefully designed self-supervision tasks: masked language modeling (MLM) task where random', 'Masked language modeling, also known as the Klose problem [76], is widely used to train text attachments and consists of teaching a model to predict a word (token) in a text sequence, replaced by a special token [MASK]. This technique is one of two BERT training tasks and is detailed in [16].', 'BERT tries to get around this limitation by using learning according to the so-called “masked language models”, that is, the target function of learning a given representation formalizes the task of predicting a randomly selected and masked word in a text, taking into account only the surrounding context. Thus, a deep bi-directional transformer is trained.']","According to the provided context, during BERT's pre-training, the masked language modeling (MLM) task operates as follows:

""A random sample of the tokens in the input sequence is selected and replaced with the special token [MASK]. The MLM objective is a cross-entropy loss on predicting the masked tokens. BERT uniformly selects 15% of the input tokens for possible replacement. Of the selected tokens, 80% are replaced with [MASK], 10% are left unchanged, and 10% are replaced by a randomly selected vocabulary token.""

This is mentioned in the context of the document with id '98af959b-b2de-4dc0-9bc7-7d1fc33e62a3' and page number 2.","In the MLM task, a selection of random word tokens from the input text are replaced by a designated [MASK] token, which the model is then trained to predict.",1.0,1.0,0.31
How does the HyDE baseline retrieve relevant text chunks?,"['3.1.1 Source Documents → Text Chunks To start, the documents in the corpus are split into text chunks. The LLM extracts information from each chunk for downstream processing. Selecting the size of the chunk is a fundamental design decision; longer text chunks require fewer LLM calls for such extraction (which reduces cost) but suffer from degraded recall of information that appears early in the chunk (Kuratov et al., 2024; Liu et al., 2023). See Section A.1 for prompts and examples of the recall-precision trade-offs.', '3.1.2 Text Chunks → Entities & Relationships In this step, the LLM is prompted to extract instances of important entities and the relationships between the entities from a given chunk. Additionally, the LLM generates short descriptions for the entities and relationships. To illustrate, suppose a chunk contained the following text: 4', 'sparse retriever from the DPR paper [111]: Given the question “Who is the bad guy in lord of the rings?” a dense retriever can retrieve a relevant text span', '2 Methods We explore RAG models, which use the input sequence x to retrieve text documents z and use them as additional context when generating the target sequence y. As shown in Figure 1, our models x) with parameters ⌘ that returns (top-K truncated) leverage two components: (i) a retriever p⌘(z 1) parametrized distributions over text passages given a query x and (ii) a generator p✓(yi| |', '5 and § § 5 Containing Passage ICT Task We begin with experiments on the task of retriev- ing a Wikipedia passage y containing a sequence of words x. We create a dataset using Wikipedia, following the Inverse Cloze Task definition by Lee et al. (2019), but adapted to suit the goals of our study. The task is defined by first breaking Wikipedia texts into segments of length at most l. D o w n l o a d e d f r o m h t t p : / / d i r e c t . m i t . e d u / t a c l / a r t i c l e - p d f / d o i / 1 0 . 1 1 6 2 / t a c l _ a _ 0 0 3 6 9 / 1 9 2 4 0 4 0 / t a c l _ a _ 0 0 3 6 9 . p d f']",I don't know.,"HyDE uses an LLM to generate a hypothetical document based on the query, which is then used to retrieve relevant text chunks for the final answer.",1.0,1.0,0.0
What steps were taken to ensure the reproducibility of the experimental results during scenario construction?,"['Depending on the contribution, reproducibility can be accomplished in various ways. For example, if the contribution is a novel architecture, describing the architecture fully might sufﬁce, or if the contribution is a speciﬁc model and empirical evaluation, it may be necessary to either make it possible for others to replicate the model with the same dataset, or provide access to the model. In general. releasing code and data is often one good way to accomplish this, but reproducibility can also be provided via detailed instructions for how to replicate the results, access to a hosted model', 'Theorems and Lemmas that the proof relies upon should be properly referenced. 4. Experimental result reproducibility Question: Does the paper fully disclose all the information needed to reproduce the main ex- perimental results of the paper to the extent that it affects the main claims and/or conclusions of the paper (regardless of whether the code and data are provided or not)? Answer: [Yes] Justiﬁcation: Implementation details are provided in Section A. Guidelines:', 'instructions for how to replicate the results, access to a hosted model (e.g., in the case of a large language model), releasing of a model checkpoint, or other means that are appropriate to the research performed.', 'A.2 EXPERIMENT DETAILS This section provides additional details about our experiment setup, in particular regarding the model evaluation and the setup of our timing experiments.', 'The answer NA means that the paper does not include experiments. • If the paper includes experiments, a No answer to this question will not be perceived well by the reviewers: Making the paper reproducible is important, regardless of whether the code and data are provided or not.']",I don't know.,The authors used a construction pipeline with a fixed random seed to ensure reproducibility.,0.0,0.0,0.0
