user_input,retrieved_contexts,response,reference,context_recall,faithfulness,factual_correctness(mode=f1)
How does ColBERT filter punctuation from document embeddings?,"['filtering is meant to reduce the number of embeddings per doc- ument, as we hypothesize that (even contextualized) embeddings of punctuation are unnecessary for effectiveness.', 'Document Encoder. Our document encoder has a very similar architecture. We first segment a document 𝑑 into its constituent tokens𝑑1𝑑2...𝑑𝑚,towhichweprependBERT’sstarttoken[CLS]fol- lowed by our special token [D] that indicates a document sequence. Unlike queries, we do not append [mask] tokens to documents. Af- ter passing this input sequence through BERT and the subsequent linear layer, the document encoder filters out the embeddings corre- sponding to punctuation symbols, determined via a pre-defined list. This filtering is meant to reduce the number of embeddings per doc- ument, as we', '3.1 Architecture Figure 3 depicts the general architecture of ColBERT, which com- prises: (a) a query encoder 𝑓𝑄, (b) a document encoder 𝑓𝐷, and (c) the late interaction mechanism. Given a query 𝑞 and document 𝑑, 𝑓𝑄 encodes 𝑞 into a bag of fixed-size embeddings 𝐸𝑞 while 𝑓𝐷 en- codes 𝑑 into another bag 𝐸𝑑. Crucially, each embeddings in 𝐸𝑞 and 𝐸𝑑 is contextualized based on the other terms in 𝑞 or𝑑, respectively. We describe our BERT-based encoders in §3.2.', 'ColBERT is differentiable end-to-end. We fine-tune the BERT encoders and train from scratch the additional parameters (i.e., the linear layer and the [Q] and [D] markers’ embeddings) using the Adam [16] optimizer. Notice that our interaction mechanism has no trainable parameters. Given a triple ⟨𝑞,𝑑+,𝑑−⟩ with query 𝑞, positive document 𝑑+ and negative document 𝑑−, ColBERT is used to produce a score for each document individually and is optimized via pairwise softmax cross-entropy loss over the computed scores of 𝑑+ and 𝑑−. 3.4 Offline Indexing: Computing & Storing', 'We denote the padding with masked tokens as query augmen- tation,astepthatallowsBERTtoproducequery-basedembeddings at the positions corresponding to these masks. Query augmentation is intended to serve as a soft, differentiable mechanism for learning to expand queries with new terms or to re-weigh existing terms based on their importance for matching the query. As we show in §4.4, this operation is essential for ColBERT’s effectiveness.']","According to the provided context, ColBERT filters out the embeddings corresponding to punctuation symbols from document embeddings. This filtering is done via a pre-defined list, which is used to determine the punctuation symbols to be removed. This filtering is meant to reduce the number of embeddings per document, as the authors hypothesize that even contextualized embeddings of punctuation are unnecessary for effectiveness.",The document encoder removes embeddings associated with punctuation symbols by utilizing a pre-defined list.,1.0,1.0,0.67
What type of custom kernel is provided in the supplementary code for inference benchmarking?,"['8 REPRODUCIBILITY STATEMENT In the Supplementary Materials, we provide code to reproduce all experiments in this paper. More speciﬁcally, this includes: Compressing all models from the OPT and BLOOM model families to 2/3/4 bits. Evaluating perplexity of the quantized models. Our 3-bit CUDA kernel together with compressed inference benchmarking features. Code for the ZeroShot experiments. A README ﬁle providing sample commands and information on how to run all scripts.', '4.3 Scaling Test-Time Compute In alignment with OpenAI o1 [12], our model allows for scaling test-time compute to potentially achieve better performance without updating model weights. There are multiple ways to control the test-time compute. In Figure 3, we concentrate on two factors: the retrieval chain length L and the number of sampled chains N for best-of-N sampling. Greedy decoding is a special instance of best-of-N sampling with N = 1 and the temperature set to 0. 6', 'In general, our kernels target generative inference in the low batch-size setting (for simplicity, we consider only batchsize 1) where the underlying (close to) matrix-vector products are memory- bound. For non-generative and large-batch applications, operations may be compute- rather than memory-bound and our kernels thus not directly applicable. Instead, one could simply decompress the matrix before performing the corresponding matrix-matrix calculations: this takes < 1.5ms on an A100 and < 3ms on an A6000 compared to 76ms/365ms for the subsequent OPT-175B FC2 layer computation with', 'tor product kernel which performs a matrix vector product by dynamically dequantizing weights when needed. Most notably, this does not require any activation quantization. While dequantization consumes extra compute, the kernel has to access a lot less memory, leading to signiﬁcant speedups, as shown in Table 6. We note that almost all of the speedup is due to our kernels, as communication costs are negligible in our standard HuggingFace-accelerate-like setting (see Appendix A.2.2 for details).', 'the development of a new benchmark is essential. Therefore, we have carefully considered factors such as domain, number of variables, frequency, non-stationarity, and predictability, and have selected a subset from the UTSD as the new benchmark. The datasets we have selected are']","According to the reproducibility statement in the supplementary materials of the paper, the code provided includes a 3-bit CUDA kernel together with compressed inference benchmarking features.",The authors provide a 3-bit CUDA kernel along with compressed inference benchmarking features.,1.0,1.0,0.86
How is the information from the visual word embeddings aggregated back into the visual sentence embedding within the TNT architecture?,"['visual sentence embedding after the projection of a linear layer. We build our TNT architecture by stacking the TNT blocks. Compared to the conventional vision transformers (ViT) which corrupts the local structure of the patch, our TNT can better preserve and model the local', 'Y i = [yi,1,yi,2,··· ,yi,m], yi,j = FC(Vec(xi,j)), (5) where yi,j ∈ Rc is the j-th word embedding, c is the dimension of word embedding, and Vec(·) is the vectorization operation. In TNT, we have two data ﬂows in which one ﬂow operates across the visual sentences and the other processes the visual words inside each sentence. For the word embeddings, we utilize a transformer block to explore the relation between visual words: Y (cid:48)i l = Y i l = Y (cid:48)i Y i l−1 + MSA(LN(Y i l + MLP(LN(Y (cid:48)i l−1)), l)). (1) (2) (3) (6) (7) 3', '8 Figure 4: Visualization of the averaged word embeddings of TNT-S. Figure 5: Attention maps of different queries in the inner transformer. Red cross symbol denotes the query location. 3.5 Transfer Learning To demonstrate the strong generalization ability of TNT, we transfer TNT-S, TNT-B models trained on ImageNet to the downstream tasks.', 'l = Zl−1 + MSA(LN(Zl−1)), l + MLP(LN(Z(cid:48) l)). This outer transformer block Tout is used for modeling relationships among sentence embeddings. In summary, the inputs and outputs of the TNT block include the visual word embeddings and sentence embeddings as shown in Fig. 1(b), so the TNT can be formulated as Yl,Zl = TNT(Yl−1,Zl−1).', 'Position encoding. Spatial information is an important factor in image recognition. For sentence embeddings and word embeddings, we both add the corresponding position encodings to retain spatial information as shown in Fig. 1. The standard learnable 1D position encodings are utilized here. Speciﬁcally, each sentence is assigned with a position encodings: Z0 ← Z0 + Esentence, where Esentence ∈ R(n+1)×d are the sentence position encodings. As for the visual words in a sentence, a word position encoding is added to each word embedding:']","According to the provided context, the information from the visual word embeddings is aggregated back into the visual sentence embedding within the TNT architecture through the following equation:

Yl,Zl = TNT(Yl−1,Zl−1)

This equation suggests that the TNT block takes the previous visual word embeddings (Yl−1) and sentence embeddings (Zl−1) as inputs, and outputs the updated visual word embeddings (Yl) and sentence embeddings (Zl).

However, to answer the specific question, we need to look at the equation that describes how the TNT block processes the visual word embeddings. This equation is:

Y (cid:48)i l = Y i l = Y (cid:48)i Y i l−1 + MSA(LN(Y i l + MLP(LN(Y (cid:48)i l−1)), l))

This equation shows that the TNT block uses a self-attention mechanism (MSA) to aggregate the information from the visual word embeddings. The self-attention mechanism takes the current visual word embeddings (Y i l) and the previous visual word embeddings (Y (cid:48)i l−1) as inputs, and outputs the updated visual word embeddings (Y i l).

Therefore, the information from the visual word embeddings is aggregated back into the visual sentence embedding within the TNT architecture through the self-attention mechanism.",The information from the visual word embeddings is added to the visual sentence embedding after being projected through a linear layer.,1.0,0.8181818181818182,0.0
"According to the review, what are the anticipated future directions for the development of textual metrics?","['The most common textual metrics are based on counting the number of n-grams found in both sentences. The larger the dimension n in an n-gram, the more the metric can capture the similarity of whole words and their order, but at the same time, the more this metric is limited and tied to a specific formulation and word forms. The already mentioned BLUE and MeTEOR belong to this category of metrics.', 'Undoubtedly, the direction of the future development of textual metrics will be the wider use of BERT as a basis for assessment, a kind of semantic engine. Also promising is the development of specific models that take into account the peculiarities of specific subject areas and increase the basic level of accuracy through specialization. Concerning BERTScore, another advantage is its differentiability, which will allow it to be integrated into the methodology for training text models in the future, which promises to further increase the performance and quality of machine learning models of', 'studies regard- ing text classification. For the type of binary, multi-class or multi-label text classifications, these types of metrics that were calculated based on the result of confusion matrix have be- come a de facto standard to evaluate the models’ performance. If the previous', ""the proposal, is the vectorized representation of the candidate proposal. A good metric should reflect the person's judgment as closely as possible, that is, show a high correlation with the person's assessment results. All existing metrics can be roughly classified into one of four categories: n-gram match, edit distance, attachment comparison, and trained functions."", 'Since the criterion for the quality of a text metric is its correlation with human judgments, it is not surprising that machine learning is used to build trained metrics, where the target function is just such a coincidence. For example, BLEND [48] uses a regression model to weigh 29 known metrics. The disadvantage of this approach is the dependence on the presence of a corpus of pre-labeled data for the training set, as well as the risk of overfitting in a certain subject area and, as a consequence, the loss of generalizing ability and universality.']","According to the review, the anticipated future directions for the development of textual metrics are:

1. The wider use of BERT as a basis for assessment, a kind of semantic engine.
2. The development of specific models that take into account the peculiarities of specific subject areas and increase the basic level of accuracy through specialization.

These directions are mentioned in the review of BERT-based models, specifically in the document with id '80a81942-026f-4c02-b5a6-69b0e2e07c2a'.",Future directions involve wider utilization of BERT as a semantic engine for assessment and the creation of specialized models that account for specific subject areas to increase accuracy.,1.0,0.75,0.73
How does the model predict the graph label using the extracted graph representation?,"['4.2. Property Prediction In a graph-level learning task, we often need to predict the label y of a graph G. With the pre-trained model, we fine- tune it to address the graph-level learning task. After the sequence s is generated from G, we extract the activation h of the final token sL from the last Transformer block as the graph representation. The rationale is that the model must have learned the information of the entire graph in order to expand it with further edges. We replace the token- predicting layer with an MLP to predict y based on h:', '1. Introduction Graph generation has emerged as a crucial task across di- verse fields such as chemical discovery and social network analysis, thanks to its ability to model complex relationships and produce realistic, structured data (Du et al., 2021; Zhu et al., 2022). Early generation methods such as DeepGMG (Li et al., 2018) and GraphRNN (You et al., 2018b) model graphs with 1Tufts University 2Northeastern University 3Cornell University. Correspondence to: Xiaohui Chen <xiaohui.chen@tufts.edu>, Li-Ping Liu <liping.liu@tufts.edu>.', 'Metrics for generic graph datasets. We adopt the evaluation framework outlined by (Martinkus et al., 2022) and (Bergmeister et al., 2024), incorporating both dataset-agnostic and dataset-specific metrics. The dataset-agnostic metrics evaluate the alignment between the distributions of the generated graphs and the training data by analyzing general graph properties. Specifically, we characterize graphs based on their node degrees (Deg.), clustering coefficients (Clus.), orbit counts (Orbit), eigenvalues of the normalized graph Laplacian (Spec.), and statistics derived from a wavelet graph', 'Graph pre-training methods. We compare against several pre-training approaches for molecular property prediction, as summarized in Table 5. The goal ofGraph pre-training methods is to learn robust graph representations via exploiting the structural information. AttrMask (Hu et al., 2020a) uses attribute masking at both node and graph levels to capture local and global features simultaneously. ContextPred (Hu et al., 2020a) builds on this idea by predicting subgraph contexts, enabling the model to understand patterns beyond individual attributes. Similarly, InfoGraph (Sun et al., 2020) focuses', '5.1. Setup Datasets. We consider both generative tasks and predictive tasks in our experiments. We use three molecule datasets: QM9 (Wu et al., 2018b), MOSES (Polykovskiy et al., 2020), and GuacaMol (Brown et al., 2019); and four generic graph datasets: Planar, Tree, Lobster, and stochastic block model (SBM), which are widely used to benchmark graph gen- erative models. In predictive tasks, we fine-tune models pre-trained from GuacaMol datasets on molecular proper- ties with the benchmark method MoleculeNet (Wu et al., 2018a). Further details are in Appendix B.4,']","According to the provided context, after extracting the activation h of the final token sL from the last Transformer block as the graph representation, the model replaces the token-predicting layer with an MLP (Multi-Layer Perceptron) to predict the graph label y based on h.",The model replaces the token-predicting layer with a Multi-Layer Perceptron (MLP) to predict the label based on the extracted representation.,1.0,1.0,0.5
What are the two forms of attention that can be computed over the bipartite graph depending on the direction of information propagation?,"['graph between two groups of variables (in the GAN case, latents and image features). In the following, we consider two forms of attention that could be computed over the bipartite graph – Simplex attention, and Duplex attention, depending on the direction in which information', '3.1.1. SIMPLEX ATTENTION We begin by introducing the simplex attention, which dis- tributes information in a single direction over the Bipar- tite Transformer. Formally, let Xn×d denote an input set of n vectors of dimension d (where, for the image case, n = W×H), and Y m×d denote a set of m aggregator vari- ables (the latents, in the case of the generator). We can then compute attention over the derived bipartite graph between 2In computer networks, simplex refers to single direction com- munication, while duplex refers to communication in both ways.', 'Figure 2. We introduce the GANsformer network, that leverages a bipartite structure to allow long-range interactions, while evading the quadratic complexity standard transformers suffer from. We present two novel attention operations over the bipartite graph: simplex and duplex, the former permits communication in one direction, in the generative context – from the latents to the image features, while the latter enables both top-down and bottom up connections between these two variable groups.', 'This update compounds two attention operations on top of each other, where we ﬁrst compute soft attention assign- ments between X and Y , and then reﬁne the assignments by considering their centroids, analogously to the k-means algorithm (Lloyd, 1982; Locatello et al., 2020).', 'Pi = {j : h(qi) = h(kj)} Figure 2(a-b) shows a schematic comparison of full-attention with a hashed variant. Part (a) depicts that the attention matrix for full attention is typically sparse, but the computation does not take advantage of this sparsity. In (b), the queries and keys have been sorted according to their hash bucket. Since similar items fall in the same bucket with high probability, the full attention pattern can be approximated by only allowing attention within each bucket.']","The two forms of attention that can be computed over the bipartite graph depending on the direction of information propagation are:

1. Simplex attention
2. Duplex attention",The two forms are Simplex attention and Duplex attention.,1.0,1.0,0.67
How is the validation set pre-processed before encoding for language generation experiments?,"['BioRxiv, Mar. 2023. content/10.1101/2023.03.11.532238v1 [32] S. Edunov, A. Baevski, and M. Auli, ‘‘Pre-trained language model representations for language generation,’’ in Proc. Conf. North Amer. Chapter Assoc. Comput. Linguistics, Human Lang. Technol., Jun. 2019, pp. 4052–4059.', 'For language generation experiments, we calculate the perplexity, in standard fashion like Radford et al. (2019), as follows: First, the entire validation set is concatenated using two linebreaks as separators and encoded using the default HuggingFace tokenizer of each model. Next, the sequence is split into non-overlapping segments of width 2048, the full context size of our models. These are sent through the model to collect the log-probabilities corresponding to the next token each. Their exponentiated average is the ﬁnal perplexity we report. For zero-shot tasks we follow the EleutherAI', 'Li Dong, Nan Yang, Wenhui Wang, Furu Wei, Xiaodong Liu, Yu Wang, Jianfeng Gao, Ming Uniﬁed Zhou, and Hsiao-Wuen Hon. 2019. language model pre-training for natural language arXiv preprint understanding and generation. arXiv:1905.03197.', 'Language model pretraining has led to sig- niﬁcant performance gains but careful com- parison between different approaches is chal- lenging. Training is computationally expen- sive, often done on private datasets of different sizes, and, as we will show, hyperparameter choices have signiﬁcant impact on the ﬁnal re- sults. We present a replication study of BERT pretraining (Devlin et al., 2019) that carefully measures the impact of many key hyperparam- eters and training data size. We ﬁnd that BERT was signiﬁcantly undertrained, and can match or exceed the performance of every model published', 'Yuan, X., Li, J., Wang, D., Chen, Y., Mao, X., Huang, L., Xue, H., Wang, W., Ren, K., and Wang, J. (2024). S-eval: Automatic and adaptive test generation for benchmarking safety evaluation of large language models. arXiv preprint arXiv:2405.14191.']","According to the provided context, the validation set is pre-processed as follows for language generation experiments:

""First, the entire validation set is concatenated using two linebreaks as separators and encoded using the default HuggingFace tokenizer of each model.""",The entire validation set is first concatenated using two linebreaks as separators.,1.0,1.0,0.5
How did all GraphRAG conditions perform against the naı̈ve RAG baseline in terms of comprehensiveness and diversity?,"['different RAG systems using predefined criteria (defined in Section 3.3). We use this approach to compare GraphRAG to vector RAG on two representative real-world text datasets. Results show GraphRAG strongly outperforms vector RAG when using GPT-4 as the LLM.', 'GraphRAG is similar to other approaches that use hierarchical indexing to create summaries (similar to Kim et al. 2023; Sarthi et al. 2024). GraphRAG contrasts with these approaches by generating a graph index from the source data, then applying graph-based community', 'GraphRAG builds upon prior work on advanced RAG strategies. GraphRAG leverages summaries over large sections of the data source as a form of ”self-memory” (described in Cheng et al. 2024), which are later used to answer queries as in Mao et al. 2020). These summaries are generated in parallel and iteratively aggregated into global summaries, similar to prior techniques (Feng et al., 2023; Gao et al., 2023; Khattab et al., 2022; Shao et al., 2023; Su et al., 2020; Trivedi et al., 2022; Wang et al., 2024). In particular, GraphRAG is similar to other approaches that use hierarchical indexing to', 'GraphRAG 23.6%76.4% NaiveRAG-HighNaiveRAG-HighNaiveRAG-HighNaiveRAG-High Diversity27.2%72.8% Cmax 33.2%66.8% NaiveRAGLightRAGNaiveRAGLightRAGNaiveRAGLightRAGNaiveRAGLightRAG Empowerment36.0%64.0% 22.8%77.2% Model 38.8%61.2% 38.8%61.2% Empowerment32.0%68.0% Ours 42.8%57.2% 35.2%64.8% 39.2%60.8% Phase 16.4%83.6% Comprehensiveness32.4%67.6% 45.2%54.8% Overall32.4%67.6% 38.0%62.0% 43.2%56.8% 22.0%78.0% 1 16.4%83.6% 16.8%83.2% 44.0%56.0% 1,399×2+Cextract Calls 42.4%57.6%', 'in Figure 4. According to the results, it is clear that the hybrid approach is very robust. Specifically, the hybrid approach either improves or does not degrade the performance of the baseline in the majority of cases. According to the results in Figure 4, for 50% of the']","According to the provided context, in the document with id '4433e6bd-d980-4fac-84df-f4db145161a1', the page content shows the following table:

|  | Diversity | Comprehensiveness |
| --- | --- | --- |
| NaiveRAG-High | 72.8% | 67.6% |
| LightRAG | 66.8% | 64.8% |
| NaiveRAG-High | 72.8% | 67.6% |
| LightRAG | 66.8% | 64.8% |
| NaiveRAG-High | 72.8% | 67.6% |
| LightRAG | 66.8% | 64.8% |
| NaiveRAG-High | 72.8% | 67.6% |
| LightRAG | 66.8% | 64.8% |
| Ours | 57.2% | 64.8% |
| Phase | 83.6% | 54.8% |
| Overall | 67.6% | 62.0% |
| 1 | 83.6% | 54.8% |
| 1,399×2+Cextract Calls | 57.6% |  |

However, the table does not show the performance of all GraphRAG conditions against the naive RAG baseline in terms of comprehensiveness and diversity.",All evaluated GraphRAG conditions outperformed the naı̈ve RAG baseline on the metrics of comprehensiveness and diversity.,0.0,1.0,0.0
