user_input,retrieved_contexts,response,reference,context_recall,faithfulness,factual_correctness(mode=f1)
How does the GANsformer update the input elements using the retrieved information from attention?,"['4.2. Transparency & Compositionality To gain more insight into the model’s internal representa- tion and its underlying generative process, we visualize the attention distributions produced by the GANsformer as it synthesizes new images. Recall that at each layer of the generator, it casts attention between the k latent variables and the evolving spatial features of the generated image.', 'Figure 6. (1-2) Performance as a function of initial and ﬁnal layers the attention is applied to. The more layers attention is applied to, the better the model’s performance get and the faster it learns, verifying the effectiveness of the GANsformer approach. (3) Learning curve for the GANsformer and competing approaches. (4): Data-efﬁciency for CLEVR. that the model coherently attend to semantic concepts such as windows, pillows, sidewalks and cars, as well as coherent background regions like carpets, ceiling, and walls. 4.3. Disentanglement', 'Figure 5. Sample images and attention maps. Samples of images generated by the GANsformer for the CLEVR, LSUN-Bedroom and Cityscapes datasets, and a visualization of the produced attention maps. The different colors correspond to the latent variables that attend to each region. For the CLEVR dataset we should multiple attention maps in different layers of the model, revealing how the latent variables roles change over the different layers – while they correspond to different objects as the layout of the scene is being formed in early layers, they behave similarly to a surface normal in the ﬁnal layers of the generator.', ""Figure 3. Model Structure. Left: The GANsformer layer, com- posed of a bipartite attention to propagate information from the latents to the evolving features grid, followed by a standard con- volution and upsampling. These layers are stacked multiple times starting from a 4×4 grid, until a ﬁnal high-resolution image is produced. Right: The latents and image features attend to each other to capture the scene compositionality. The GANsformer’s compositional latent space contrasts with the StyleGAN mono- lithic one, where a single latent modulates uniformly the whole scene. these two groups of elements. Speciﬁcally, we then deﬁne: T Q Attention(Q, K, V') = softmax Vd )v ap(X,Y) = Attention (¢(X), k(Y),v(Y))"", 'Generative Adversarial Transformers | LN 4 L e e - L Figure 4. Samples of images generated by the GANsformer for the CLEVR, Bedroom and Cityscapes datasets, and a visualization of the produced attention maps. The different colors correspond to the latents that attend to each region. the normalization and information propagation from Y to X, by essentially letting Y control X statistical tendencies of X, which for instance can be useful in the case of visual synthesis for generating particular objects or entities.', 'Compared to these prior works, the GANsformer stands out as it manages to avoid the high costs ensued by self at- tention, employing instead bipartite attention between the image features and a small collection of latent variables. Its design ﬁts naturally with the generative goal of transforming source latents into an image, facilitating long-range inter- action without sacriﬁcing computational efﬁciency. Rather, Generative Adversarial Transformers Standard Transformer The Bipartite Transformer Self-Attention Simplex-Attention Duplex-Attention', 'Motivated to address these shortcomings and unlock the full potential of this promising network for the ﬁeld of com- puter vision, we introduce the Generative Adversarial Trans- former, or GANsformer for short, a simple yet effective generalization of the vanilla transformer, explored here for the task of visual synthesis. The model features a biparatite construction for computing soft attention, that iteratively aggregates and disseminates information between the gener- ated image features and a compact set of latent variables to enable bidirectional interaction between these dual represen- tations. This proposed design achieves a favorable balance, being capable of ﬂexibly modeling global phenomena and long-range interactions on the one hand, while featuring an efﬁcient setup that still scales linearly with the input size on the other. As such, the GANsformer can sidestep the', 'obal scale, our design lets the GANsformer exercise ﬁner control in impacting features at the object granularity, while leverag- ing the use of attention to make its internal representations more explicit and transparent.']","The GANsformer updates the input elements using the retrieved information from attention through a bipartite attention mechanism. Specifically, it iteratively aggregates and disseminates information between the generated image features and a compact set of latent variables, enabling bidirectional interaction between these dual representations. This process is facilitated by the softmax function, which normalizes the attention weights to ensure that the information is propagated effectively.","It uses the retrieved information to control the scale and bias of the elements, similar to the multiplicative integration in StyleGAN.",1.0,0.3333333333333333,0.2
How is the Transformers library designed to serve different user bases?,"['Figure 2: The Transformers library. (Diagram-Right) Each model is made up of a Tokenizer, Transformer, and Head. The model is pretrained with a ﬁxed head and can then be further ﬁne-tuned with alternate heads for different tasks. (Bottom) Each model uses a speciﬁc Tokenizer either implemented in Python or in Rust. These often differ in small details, but need to be in sync with pretraining. (Left) Transformer architectures specialized for different tasks, e.g. understanding versus generation, or for speciﬁc use-cases, e.g. speed, image+text. (Top) heads allow a Transformer to be used for different tasks. Here we assume the input token sequence is x1:N from a vocabulary V, and y represents different possible outputs, possibly from a class set C. Example datasets represent a small subset of example code distributed with the library.', 'Transformers is a library dedicated to supporting Transformer-based architectures and facilitating the distribution of pretrained models. At the core of the libary is an implementation of the Transformer which is designed for both research and production. The philosophy is to support industrial-strength im- plementations of popular model variants that are easy to read, extend, and deploy. On this founda- tion, the library supports the distribution and usage of a wide-variety of pretrained models in a cen- tralized model hub. This hub supports users to compare different models with the same minimal API and to experiment with shared models on a variety of different tasks.', 'Since Transformers provides a hub for NLP mod- els, it is also related to popular model hubs includ- ing Torch Hub and TensorFlow Hub which collect framework-speciﬁc model parameters for easy use. Unlike these hubs, Transformers is domain-speciﬁc which allows the system to provide automatic sup- port for model analysis, usage, deployment, bench- marking, and easy replicability.', 'Transformers Central to the library are carefully tested implementations of Transformer architecture variants which are widely used in NLP. The full list of currently implemented architectures is shown in Figure 2 (Left). While each of these architectures', 'g, and ﬁne-tuning of the models as well as seamless transition to production. Transformers maintains some compatibility with these libraries, most directly including a tool for performing infer- ence using models from Marian NMT and Google’s BERT.', '6 Conclusion As Transformer and pretraining play larger roles in NLP, it is important for these models to be acces- sible to researchers and end-users. Transformers is an open-source library and community designed to facilitate users to access large-scale pretrained models, to build and experiment on top of them, and to deploy them in downstream tasks with state- of-the-art performance. Transformers has gained signiﬁcant organic traction since its release and is set up to continue to provide core infrastructure while helping to facilitate access to new models. 3https://github.com/huggingface/ swift-coreml-transformers', '4 Community Model Hub Transformers aims to facilitate easy use and dis- tribution of pretrained models. Inherently this is a community process; a single pretraining run fa- cilitates ﬁne-tuning on many speciﬁc tasks. The Model Hub makes it simple for any end-user to ac- cess a model for use with their own data. This hub now contains 2,097 user models, both pretrained and ﬁne-tuned, from across the community. Fig- ure 1 shows the increase and distribution of popular transformers over time. While core models like BERT and GPT-2 continue to be popular, other spe- cialized models including DistilBERT (Sanh et al., 2019), which was developed for the library, are', 'The NLP and ML communities have a strong cul- ture of building open-source research tools. The structure of Transformers is inspired by the pi- oneering tensor2tensor library (Vaswani et al., 2018) and the original source code for BERT (De- vlin et al., 2018), both from Google Research. The concept of providing easy caching for pre- trained models stemmed from AllenNLP (Gard- ner et al., 2018). The library is also closely re- lated to neural translation and language modeling systems, such as Fairseq (Ott et al., 2019), Open- NMT (Klein et al., 2017), Texar (Hu et al., 2018), Megatron-LM (Shoeybi et al., 2019), and Mar- ian NMT (Junczys-Dowmunt et al., 2018). Build- ing on these elements, Transformers adds extra user-facing features to allow for easy downloading, caching, and ﬁne-tuning of the models as well as seamless transition to production. Transformers maintains some compatibility']","The Transformers library is designed to serve different user bases by providing a centralized model hub that allows users to compare and experiment with shared models on various tasks. This hub supports users with a minimal API, making it easy for researchers and end-users to access large-scale pretrained models, build and experiment on top of them, and deploy them in downstream tasks with state-of-the-art performance. Additionally, the library maintains some compatibility with other libraries, such as Marian NMT and Google's BERT, and provides tools for inference and fine-tuning, making it accessible to users with different levels of expertise and needs.","It is designed to be extensible for researchers, straightforward for practitioners, and both fast and robust for use in industrial deployments.",1.0,1.0,0.47
How does intra-subject learning compare to cross-subject learning when retraining BERT on specific text corpora?,"['Studies of the effectiveness of BERT retraining [74] show that, first, retrained models show significantly better results compared to models without retraining, and, secondly, intra-subject learning is generally more effective than intra-task learning. Cross-subject learning does not significantly improve performance relative to the original BERT model, which is logical given that BERT is trained on a general set of texts.', 'Further pre-training: BERT is initially trained on general-purpose texts, which may have a different data distribution than the texts of the target application area. Naturally, the desire to retrain BERT on a specific text corpus can be based on an intra-task dataset (the same dataset that will be used to train the target model), an intra-subject dataset (a set of text data obtained from the same subject area) or a cross-subject dataset, in depending on the nature of the texts and the availability of data sets.', '● development and detailed analysis of techniques for retraining BERT for specific word problems. For example, the authors in [74] consider techniques for retraining a model on long text sequences consisting of more than 512 tokens. ● a methodology for retraining BERT on small sets of texts, which are not enough to highlight full knowledge of the textual features of the subject area. Since manual data markup is still a very time-consuming process, in many specific areas there is not enough marked-up text selection to fully retrain the text model. ● developing a methodology for unsupervised learning on a large unlabeled corpus of subject-specific texts can be another way to increase the flexibility and universality of BERT for different subject areas. Using BERT for Text Annotation Tasks', 'BERT tries to get around this limitation by using learning according to the so-called “masked language models”, that is, the target function of learning a given representation formalizes the task of predicting a randomly selected and masked word in a text, taking into account only the surrounding context. Thus, a deep bi-directional transformer is trained. The BERT model training process includes two stages: pre-training on unlabeled data, and additional training on labeled data for a specific application problem. Depending on the task, the retraining process and the architectures used may differ, although they are all based on the same model with the same set of parameters.', '3 Making-Sense of Language-Speciﬁc BERT Models While multi- and cross-lingual BERT representations allow for zero-shot learning and capture univer- sal semantic structures, they do gloss over language-speciﬁc differences. Consequently, a number of language-speciﬁc BERT models have been developed to ﬁll that need. These models almost always showed better performance on the language they were trained for than the universal model. In order to navigate this wealth of constantly changing information, a simple overview paper is no longer sufﬁcient. While we aim to give a general overview here, we refer the interested reader to the constantly updated online resource, BertLang.', 'Multitasking Learning: In the absence of pre-trained natural language models, multitasking learning is effective in leveraging shared knowledge of multiple target tasks. When researchers are faced with several word processing tasks in the same subject area, it makes sense to retrain the BERT model in these tasks simultaneously.', 'In the future, we plan to provide independent veriﬁcation of reported results and direct comparisons of language-speciﬁc BERT models on speciﬁc domains and tasks. We plan to use the same data to ﬁne-tune the models providing comparable performance values for the models. We believe these comparisons will be beneﬁcial to the community of both researchers and beginning practitioners in NLP.', '2.1 BERT BERT uses the Transformer (Vaswani et al., 2017) architecture to learn word embeddings. The Trans- former is a recent architectural advancement that can be included in deep networks for sequence mod- eling. Instead of modeling sequences as RNNs or LSTMs, the Transformer learns global dependencies between input and output, using only attention mechanisms. 1https://github.com/google-research/bert/blob/master/multilingual.md 2These models require a large amount of computational resources unaffordable for many users, and comes with severe ecological costs: training BERT on a GPU is roughly equivalent to a trans-American ﬂight in terms of CO2 emissions (Strubell et al., 2019)).']","According to the retrieved context, intra-subject learning is generally more effective than intra-task learning when retraining BERT on specific text corpora. Additionally, cross-subject learning does not significantly improve performance relative to the original BERT model, which is logical given that BERT is trained on a general set of texts.","Intra-subject learning generally proves more effective than intra-task learning, while cross-subject learning yields little to no improvement over the original BERT model.",1.0,1.0,0.8
"In the on-device computation experiment, how much faster was DistilBERT compared to the BERT-base model on an iPhone 7 Plus?","['Size and inference speed To further investigate the speed-up/size trade-off of DistilBERT, we compare (in Table 3) the number of parameters of each model along with the inference time needed to do a full pass on the STS- B development set on CPU (Intel Xeon E5-2690 v3 Haswell @2.9GHz) using a batch size of 1. DistilBERT has 40% fewer parameters than BERT and is 60% faster than BERT. On device computation We studied whether DistilBERT could be used for on-the-edge applications by building a mobile application for question answering. We compare the average inference time on a recent smartphone (iPhone 7 Plus) against our previously trained question answering model based on BERT-base. Excluding the tokenization step, DistilBERT is 71% faster than BERT, and the whole model weighs 207 MB (which could be further reduced with quantization). Our code is available5.', 'Table 1: DistilBERT retains 97% of BERT performance. Comparison on the dev sets of the GLUE benchmark. ELMo results as reported by the authors. BERT and DistilBERT results are the medians of 5 runs with different seeds.', 'The results on each of the 9 tasks are showed on Table 1 along with the macro-score (average of individual scores). Among the 9 tasks, DistilBERT is always on par or improving over the ELMo baseline (up to 19 points of accuracy on STS-B). DistilBERT also compares surprisingly well to BERT, retaining 97% of the performance with 40% fewer parameters.', 'being 60% faster. To leverage the inductive biases learned by larger models during pre-training, we introduce a triple loss combining language modeling, distillation and cosine-distance losses. Our smaller, faster and lighter model is cheaper to pre-train and we demonstrate its capabilities for on-device computations in a proof-of-concept experiment and a comparative on-device study.', 'Distillation We applied best practices for training BERT model recently proposed in Liu et al. [2019]. As such, DistilBERT is distilled on very large batches leveraging gradient accumulation (up to 4K examples per batch) using dynamic masking and without the next sentence prediction objective. Data and compute power We train DistilBERT on the same corpus as the original BERT model: a concatenation of English Wikipedia and Toronto Book Corpus [Zhu et al., 2015]. DistilBERT was trained on 8 16GB V100 GPUs for approximately 90 hours. For the sake of comparison, the RoBERTa model [Liu et al., 2019] required 1 day of training on 1024 32GB V100.', 'Time and Space Analysis Figure 7 compares the running time/quality trade-off curves for DE- BERT and ME-BERT on the MS MARCO passage task usingtheScaNN(Guoetal.,2020)libraryona160 Intel(R) Xeon(R) CPU @ 2.20GHz coresmachine with 1.88TBmemory. Both models use one vector of size k = 1024 per query; DE-BERT uses one and ME-BERT uses 3 vectors of size k = 1024 per document. The size of the document index for DE-BERT is 34.2GB and the size of the index for ME-BERT is about 3 times larger. The indexing time was 1.52h and 3.02h for DE-BERT and ME-BERT, respectively. The ScaNN configuration we use is num leaves=5000, and num leaves to search ranges from 25 to 2000 (from less to more exact search)andtimeperqueryismeasuredwhenusing parallel inference on all 160 cores. In the higher quality range of the curves, ME-BERT achieves', 'Table 3: DistilBERT is signiﬁcantly smaller while being constantly faster. Inference time of a full pass of GLUE task STS-B (sen- timent analysis) on CPU with a batch size of 1.', '2.4 Optimization BERT is optimized with Adam (Kingma and Ba, 2015) using the following parameters: β1 = 0.9, β2 = 0.999, ǫ = 1e-6 and L2 weight de- cay of 0.01. The learning rate is warmed up over the ﬁrst 10,000 steps to a peak value of 1e-4, and then linearly decayed. BERT trains with a dropout of 0.1 on all layers and at- tention weights, and a GELU activation func- tion (Hendrycks and Gimpel, 2016). Models are pretrained for S = 1,000,000 updates, with mini- batches containing B = 256 sequences of maxi- mum length T = 512 tokens. 2.5 Data BERT is trained on a combination of BOOKCOR- PUS (Zhu et al., 2015) plus English WIKIPEDIA, which totals 16GB of uncompressed text.3 3 Experimental Setup In this section, we describe the experimental setup for our replication study of BERT.']","DistilBERT was 71% faster than BERT-base in the on-device computation experiment on an iPhone 7 Plus, excluding the tokenization step.",DistilBERT was 71% faster than the BERT-base model when excluding the tokenization step.,1.0,1.0,0.67
"On what corpora was the BioBERT model trained, and how large was the total volume compared to the original BERT training corpus?","['The authors of the BioBERT model (Seoul University), as the name implies, propose a specialized BERT-based text nesting model for the analysis of biomedical publications. The motivation for developing this model and the approach to teaching are completely similar. The training took place according to the BERT method [16] on a corpus consisting of annotations of articles from the PubMed database and full-text versions of articles from the PMC database. The training took place for 23 days on 8 NVIDIA V100 GPUs based on weights exported from the original pretrained BERT model, that is, formally, this is additional training. Note that the total volume of the biomedical corpus was 18 billion words, while the volume for training the original model was only 3.3 billion. The learning process is schematically shown in the figure:', 'The BioBERT training process, like most similar models, consists of two parts: initial training and adjustment (additional training) for a specific word processing task. The authors of the model used three common tasks to assess the performance of the model: named entity recognition (NER [89]), relation extraction (REL), and answering a question (QA [67]). The simulation showed the full advantage of the new model over conventional BERT in all specific tasks. The best results to date have been achieved in several tasks. BioBERT is the first, but not the only problem-specific model based on BERT. I. Betalgi, K. Lo, and A. Cohan from the University of Seattle [6] present a SciBERT model trained on a corpus of scientific articles.', 'comparison, training the full version of the original BERT model took 4 days on a 16-core TPU and is estimated to be 40-70 days on an 8-core). As a result of numerical experiments on some tasks (extraction of entities, classification of texts, determination of dependencies, etc.) for the processing of scientific texts. Datasets from subject areas were used: biomedicine (ChemProt [31], EBM-NLP [57] and others), computer science (SciERC [47], ACL-ARC [28]), and interdisciplinary (SciCite, described by A. Cohan in [10 ]). On all datasets tested, SciBERT performed better than overall BERT and performed best to date for most.', 'This model was trained on a random sample of more than 1 million scientific articles from the SemanticScholar database [1]. SciBERT also reconfigures the tokenization tool underlying BERT to account for the different vocabulary of the selected corpus. In the process of building the tokenizer, it turned out that the intersection of general-purpose dictionaries and the scientific corpus was 42%, which indicates a significant difference in the distribution of the token between these corpora. Along with an intuitive understanding, this fact gives reason to believe that the use of specific models can give increase productivity. The model was trained following the original BERT training method, but on a different, more compact body of texts and using a specialized vocabulary for tokenization. The training took 7 days on an 8-core TPU (by', '4 Training Procedure Analysis This section explores and quantiﬁes which choices are important for successfully pretraining BERT models. We keep the model architecture ﬁxed.7 Speciﬁcally, we begin by training BERT models with the same conﬁguration as BERTBASE (L = 12, H = 768, A = 12, 110M params).', 'Following, to a large extent, the original procedure for training the model, they concentrated on obtaining the largest possible open corpus of texts for the formation of the training sample. Initially, BERT is trained on a collection of BookCorpus [96] and Wikipedia, which is about 16 GB of uncompressed text. In this work, we used four additional public corpora of English-language texts - CC-News [100], OpenWebText [58], and Stories [78], totaling about 160 GB, that is, an order of magnitude more than the original. After training, the resulting model was tested against three common benchmarks measuring natural text understanding - GLUE [83], SQuAD [67], and RACE [33]. On all these tasks, the authors received an improvement in the initial indicators, which allows us to conclude that the BERT model is undertrained.', 'The user interface of the Model Hub is designed to be simple and open to the community. To upload a model, any user can sign up for an account and use a command-line interface to produce an archive consisting a tokenizer, transformer, and head. This bundle may be a model trained through the library or converted from a checkpoint of other popular training tools. These models are then stored and given a canonical name which a user can use to download, cache, and run the model either for ﬁne- tuning or inference in two lines of code. To load FlauBERT (Le et al., 2020), a BERT model pre- trained on a French training corpus, the command is: 1 tknzr = AutoTokenizer.from_pretrained( 2 ""flaubert/flaubert_base_uncased"") 3 model = AutoModel.from_pretrained( 4 ""flaubert/flaubert_base_uncased"")', 'al of BERT models, the NLP community has started to investigate and generate an abundant number of BERT models that are trained on a particular language, and tested on a speciﬁc data domain and task. This allows us to evaluate the true potential of mBERT as a universal language model, by comparing it to the performance of these more speciﬁc models. This paper presents the current state of the art in language-speciﬁc BERT models, providing an overall picture with respect to different dimensions (i.e. architectures, data domains, and tasks). Our aim is to provide an immediate and straightforward overview of the commonalities and differences between Language-Speciﬁc (language-speciﬁc) BERT models and mBERT. We also provide an interactive and constantly updated website that can be used to explore the information we have collected, at https://bertlang.unibocconi.it.']","The BioBERT model was trained on a corpus consisting of annotations of articles from the PubMed database and full-text versions of articles from the PMC database. The total volume of the biomedical corpus was 18 billion words, which is significantly larger than the original BERT training corpus of 3.3 billion words.","BioBERT was trained on abstracts from PubMed and full-text articles from PMC. The biomedical corpus volume was 18 billion words, which is significantly larger than the original BERT's 3.3 billion word corpus.",0.3333333333333333,1.0,0.73
What specific evaluation tasks were used to benchmark BioGPT's capabilities?,"['We can see from the results in Table 6 that BioGPT achieves 85.12% accuracy with 3.28% improvement over general domain GPT-2, and surpasses BioBERT, PubMedBERT and BioLinkBERT with 3.58%, 2.8%, 0.77% improvements respectively.', 'The results are shown in Table 4 from which we can see that BioGPT achieves 40.76% with 16.08% and 12.49% improvement against GPT-2medium and REBEL. It also surpasses REBELpt which uses additional large relation extraction dataset for two- stage pre-training.', 'Scaling to Larger Size We also scaled our model to larger size. We built BioGPT- Large, based on the GPT-2 XL architecture (the largest version of GPT-2), with 1.5B model parameters. We ﬁne-tune and evaluate its performance on the downstream tasks, as shown in Table 11. Table 11. Performance of BioGPT-Large ﬁne-tuned on downstream tasks', 'For this task, no objective evaluation metric is reported here. Instead, we provide a few examples here demonstration. for From the results in Table 7, we can see that: (1) Given relatively common names as input, for example in the ﬁrst two cases (i.e., Bicalutamide and JAK-3), GPT-2 can generate meaningful and ﬂuent text that is related to the word and biomedicine, while BioGPT generates more speciﬁc and professional descriptions. (2) When given some uncommon names (e.g., in the Apricitabine and Xylazine cases), GPT- 2 cannot generate meaningful descriptions while BioGPT still', 'answer it with the drug “hydroxychloroquine” which is indeed noticed at MedlinePlus8. Notice that GPT-2 is pre-trained on the corpus before COVID-19 while BioGPT is pre-trained on the corpus before 2021 that contains COVID-19 information, therefore it is not surprising that BioGPT performs much better than GPT-2 on COIVD-19 related key words in Table 8. However, in the last example in Table 8, both models do not have any knowledge of the Omicron variants of SARS-CoV-2 which appear in the late 2021, while BioGPT still generates more ﬂuent and relevant text compared to GPT-2. Overall, we can see that BioGPT pre-trained on in-domain biomedical literature from scratch performs better than general domain GPT-2 across various biomedical NLP tasks, and performs better than most previous methods on respective tasks, achieving state-of-the-art on four out of six tasks.', 'Model Accuracy PubMedBERT [9] 55.8 BioELECTRa [28] 64.2 BioLinkBERTbase [29] 70.2 BioLinkBERTlarge [29] 72.2 BioGPT 78.2', 'From the results in Table 2, we can see that BioGPT achieves the best result (44.98%) among all the methods, with large improvements. We have several ﬁndings: 1) pipeline- based method GLRE signiﬁcantly drops when using NER tagged by open-source tools instead of ground truth NER. However, this is often the common case in practical situation where the annotations for NER are lacked or expensive to collect. When applying open-source NER tools to some speciﬁc domains, errors occur and lead to inferior performance of relation extraction. 2) Compared to REBEL, BioGPT has a large gain with 8.28% improvement. Notice that seq2rel [25] is trained on both the training set and validation set, while our BioGPT is only trained on the training set and still outperforms it with 4.78% improvement. Moreover, when also trained on both the training set and the validation set, BioGPT', 'From the results in Table 5 we can see that BioGPT achieves 78.2% accuracy with 6.0% improvement over previous best performance obtained by BioLinkBERT [29], achieving a new state-of-the-art on this task. Document Classiﬁcation HoC (the Hallmarks of Cancers corpus) consists of 1580 PubMed abstracts manually annotated at sentence level by Table 5. Results on PubMedQA question answering task']","The specific evaluation tasks used to benchmark BioGPT's capabilities include:

1. Downstream tasks (performance on which is shown in Table 11, although no objective evaluation metric is reported).
2. Relation extraction (performance on which is shown in Table 4, with BioGPT achieving 40.76% with 16.08% and 12.49% improvement against GPT-2medium and REBEL, respectively).
3. Document classification (performance on which is shown in Table 5, with BioGPT achieving 78.2% accuracy with 6.0% improvement over previous best performance obtained by BioLinkBERT).
4. PubMedQA question answering task (performance on which is shown in Table 5, with BioGPT achieving the best result of 44.98% among all the methods).
5. Biomedical NLP tasks (performance on which is shown in Table 6, with BioGPT achieving 85.12% accuracy with 3.28% improvement over general domain GPT-2, and surpassing BioBERT, PubMedBERT, and BioLinkBERT with 3.58%, 2.8%, and 0.77% improvements, respectively).","BioGPT was evaluated on relation extraction tasks (BC5CDR, KD-DTI, DDI), PubMedQA, document classification on HOC, and a text generation task.",1.0,1.0,0.48
How did the performance of RAG on the FEVER 3-way classification task compare to state-of-the-art pipeline models?,"['Table 6: Ablations on the dev set. As FEVER is a classiﬁcation task, both RAG models are equivalent.', 'FEVER [56] requires classifying whether a natural language claim is supported or refuted by Wikipedia, or whether there is not enough information to decide. The task requires retrieving evidence from Wikipedia relating to the claim and then reasoning over this evidence to classify whether the claim is true, false, or unveriﬁable from Wikipedia alone. FEVER is a retrieval problem coupled with an challenging entailment reasoning task. It also provides an appropriate testbed for exploring the RAG models’ ability to handle classiﬁcation rather than generation. We map FEVER class labels (supports, refutes, or not enough info) to single output tokens and directly train with claim-class pairs. Crucially, unlike most other approaches to FEVER, we do not use supervision on retrieved evidence. In many real-world applications, retrieval supervision signals aren’t available, and models that do not', '5.1 Best Practices for Implementing RAG According to our experimental findings, we suggest two distinct recipes or practices for implementing RAG systems, each customized to address specific requirements: one focusing on maximizing perfor- mance, and the other on striking a balance between efficiency and efficacy. Best Performance Practice: To achieve the high- est performance, it is recommended to incorporate query classification module, use the “Hybrid with HyDE” method for retrieval, employ monoT5 for reranking, opt for Reverse for repacking, and lever- age Recomp for summarization. This configuration yielded the highest average score of 0.483, albeit with a computationally-intensive process.', 'Retrieval Ablations A key feature of RAG is learning to retrieve relevant information for the task. To assess the effectiveness of the retrieval mechanism, we run ablations where we freeze the retriever during training. As shown in Table 6, learned retrieval improves results for all tasks. We compare RAG’s dense retriever to a word overlap-based BM25 retriever [53]. Here, we replace RAG’s retriever with a ﬁxed BM25 system, and use BM25 retrieval scores as logits when calculating p(z | 6 show the results. For FEVER, BM25 performs best, perhaps since FEVER claims are heavily x). Table entity-centric and thus well-suited for word overlap-based retrieval. Differentiable retrieval improves results on all other tasks, especially for Open-Domain QA, where it is crucial.', 'both the effectiveness and efficiency of RAG systems. To the best of our knowledge, there has been no systematic effort to pursue the optimal implementation of RAG, partic- ularly for the entire RAG workflow.', 'Figure 3: Results of generator fine-tuning. used for fine-tuning and evaluation mainly follow (Lin et al., 2023). We train our generator for 3 epochs and constrain the maximum length of the sequence to 1600, using a batch size of 4 and a learning rate of 5e-5. During testing, we use a zero-shot setting. Detailed Results Table 12 shows our evaluation results on each dataset. A.7 Experimental Details of Comprehensive Evaluation Tasks and Datasets We conducted extensive ex- periments across various NLP tasks and datasets to assess the performance of RAG systems. Specif- ically: (1) Commonsense Reasoning: We eval- uated on MMLU (Hendrycks et al., 2020), ARC- Challenge (Clark et al., 2018), and OpenbookQA (Mihaylov et al., 2018) datasets. (2) Fact Check-', 'FEVER TQA NQ 95 91 3 a 94 90 2 93 89 g o w Accuracy o N 92 88 91 —e— greedy —— greedy 61 —— greedy —=— best-of-4 87 —=— best-of-4 60 —=— best-of-4 920 —— best-of-8 —— best-of-8 59 —+— best-of-8 4 6 8 10 Chain Length 4 6 8 10 Chain Length 6 Chain Length 8 10', '4.1 Experimental Settings To evaluate the effectiveness of LightRAG, we con- ducted experiments on four datasets from the Ultra- Domain benchmark (Qian et al., 2024), covering diverse domains such as Agriculture, CS, Legal, and Mixed. Each dataset ranges from 600,000 to 5,000,000 tokens. We compare LightRAG with state-of-the-art RAG methods, including Naive RAG, RQ-RAG, HyDE, and GraphRAG. Using a robust LLM-based evaluation, we assess perfor- mance across four dimensions: Comprehensive- ness, Diversity, Empowerment, and Overall. Detailed descriptions of datasets, question gener- ation, and baselines are provided in Appendix 9.1.']",The retrieved context does not contain enough information to answer this question.,"RAG scored within 4.3% of the state-of-the-art pipeline models, achieving strong results without needing the intermediate retrieval supervision that the complex pipelines require.",1.0,0.5,0.0
What bit-widths are the OPT and BLOOM models compressed to in the provided reproducibility code?,"['BLOOM Bits 560M 1.1B 1.7B 3B full 16 41.71 45.41 48.11 53.24 RTN 4 39.40 42.51 44.70 51.35 GPTQ 4 40.24 44.49 44.49 52.82 RTN 3 45.44 46.87 37.58 45.08 GPTQ 3 39.14 41.79 42.85 46.63 7.1B 57.37 56.14 56.14 48.61 51.56 176B 67.47 66.33 67.42 28.87 62.84', 'BLOOM Bits 560M 1.1B 1.7B 3B full 16 65.07 67.14 69.97 70.51 RTN 4 63.11 65.29 67.74 69.86 GPTQ 4 64.31 66.05 68.77 69.42 RTN 3 58.60 60.80 60.88 66.28 GPTQ 3 61.62 62.62 65.18 68.34 7.1B 73.72 72.69 72.96 69.70 70.95 176B 79.16 79.00 79.00 53.32 77.70', 'BLOOM Bits 560M 1.1B 1.7B 3B full 16 34.06 42.85 46.71 52.12 RTN 4 26.00 39.06 41.92 45.84 GPTQ 4 31.75 39.80 46.28 51.41 RTN 3 9.10 15.95 15.02 24.55 GPTQ 3 21.31 28.70 33.65 43.12 7.1B 57.79 50.48 54.65 29.90 47.41 176B 67.40 66.70 67.71 0.17 65.10', 'BLOOM Bits 560M 1.1B 1.7B 3B full 16 61.94 63.27 65.44 67.79 RTN 4 60.15 60.66 62.95 67.09 GPTQ 4 61.17 62.32 64.48 67.22 RTN 3 54.87 56.08 55.79 59.83 GPTQ 3 57.80 59.77 61.81 63.97 7.1B 71.99 70.72 71.36 66.20 69.26 176B 76.89 76.00 76.32 48.50 75.37', 'BLOOM Bits 560M 1.1B 1.7B 3B 7.1B 176B full 16 22.42 17.69 15.39 13.48 11.37 8.11 RTN 4 25.90 22.00 16.97 14.76 12.10 8.37 GPTQ 4 24.03 19.05 16.48 14.20 11.73 8.21 RTN 3 57.08 50.19 63.59 39.36 17.38 571 GPTQ 3 32.31 25.08 21.11 17.40 13.47 8.64', 'BLOOM Bits 560M 1.1B 1.7B 3B 7.1B 176B full 16 43.69 57.96 30.00 25.34 20.83 14.59 RTN 4 51.10 66.85 33.58 27.68 22.42 15.00 GPTQ 4 46.97 62.47 31.84 26.49 21.67 14.75 RTN 3 126. 185. 106. 66.78 35.04 107. GPTQ 3 70.35 87.04 46.11 34.02 26.14 15.57', 'BLOOM Bits 560M 1.1B 1.7B 3B full 16 24.15 25.68 26.79 30.55 RTN 4 23.89 23.34 26.45 29.52 GPTQ 4 23.46 25.51 25.94 28.92 RTN 3 21.67 22.86 23.29 27.13 GPTQ 3 23.21 24.06 24.91 28.58 7.1B 33.45 32.17 32.25 31.31 30.97 176B 44.97 43.17 44.20 24.74 40.70', 'BLOOM Bits 560M 1.1B 1.7B 3B 7.1B 176B full 16 26.60 22.05 19.49 17.49 15.20 11.71 RTN 4 29.89 24.44 21.26 18.76 16.06 12.04 GPTQ 4 28.00 23.25 20.55 18.10 15.60 11.81 RTN 3 67.49 60.71 113. 80.49 22.59 598. GPTQ 3 35.78 28.83 25.34 21.25 17.67 12.27']",The retrieved context does not contain enough information to answer this question.,"The provided code compresses the models from the OPT and BLOOM families to 2, 3, and 4 bits.",0.0,1.0,0.0
How does the masked language modeling (MLM) task operate during BERT's pre-training?,"['2.3 Training Objectives During pretraining, BERT uses two objectives: masked language modeling and next sentence pre- diction. Masked Language Model (MLM) A random sample of the tokens in the input sequence is selected and replaced with the special token [MASK]. The MLM objective is a cross-entropy loss on predicting the masked tokens. BERT uni- formly selects 15% of the input tokens for possi- ble replacement. Of the selected tokens, 80% are replaced with [MASK], 10% are left unchanged, and 10% are replaced by a randomly selected vo- cabulary token. In the original implementation, random mask- ing and replacement is performed once in the be- ginning and saved for the duration of training, al- though in practice, data is duplicated so the mask is not always the same for every training sentence (see Section 4.1).', 'BERT tries to get around this limitation by using learning according to the so-called “masked language models”, that is, the target function of learning a given representation formalizes the task of predicting a randomly selected and masked word in a text, taking into account only the surrounding context. Thus, a deep bi-directional transformer is trained. The BERT model training process includes two stages: pre-training on unlabeled data, and additional training on labeled data for a specific application problem. Depending on the task, the retraining process and the architectures used may differ, although they are all based on the same model with the same set of parameters.', 'Devlin et al. (2019) introduced BERT in 2018 as a context-sensitive alternative to previous word embeddings (which assume a word always has the same representation, independent of its context). The model essentially stacks several encoder-decoder structures based on transformers together. It uses masks to blank out individual words, forcing the model to “ﬁll in the blanks”, thereby increasing its context-sensitivity. Two key elements in the BERT pretraining process are the masked language model and the next sentence prediction. In the former process, a random subsample (in the BERT paper, 15%) of the words in a text are replaced by a [MASK] token, and the task is to predict the correct token. The latter process instead is the task of predicting how likely one sentence is to follow another one in text. See Figure 1 for a schematic view on BERT. Other than traditional word embeddings, BERT', 'It has proven to be a very successful pattern in deep learning to pre-train models on large scale unlabeled data via careful designed self-supervision tasks and then transfer to downstream tasks by ﬁne-tuning on them. Downstream tasks can beneﬁt from the learned representations from the pre-trained models. BERT [2] is a bidirectional transformer based contextualized language model pre-trained on large scale text corpus English Wikipedia and BooksCorpus. It is pre- trained via carefully designed self-supervision tasks: masked language modeling (MLM) task where random word tokens of the input text are replaced by a special token [MASK] which is to be predicted by the model from the context, and the next sentence prediction (NSP) task where two sentences are to be predicted whether the second one is probable given the ﬁrst one. The pre-trained BERT provides contextualized word', '4 Training Procedure Analysis This section explores and quantiﬁes which choices are important for successfully pretraining BERT models. We keep the model architecture ﬁxed.7 Speciﬁcally, we begin by training BERT models with the same conﬁguration as BERTBASE (L = 12, H = 768, A = 12, 110M params).', 'L = CE(L g Sigmoid(d-§))+MSE ( 4. d-)+Mask(q)+Mask(d). Where CE and MSE are the Cross Entropy loss and Mean Squared Error loss, respectively; Mask(-) is the masked language model loss used in BERT; G and d are the vectors generated by the neural model. We use the two losses as it is expected for the two to be com- plementary. While the CE loss can help learn the rough distinction between something that is completely non-relevant to something that is somehow relevant. The MSE loss can fine-tune the model to be more discriminative. We tried to fine-tune the model with just CE and MSE loss at the end of the training process but didn’t notice much difference. Probably this is because differently from the original BERT paper, here we are directly training a model on the target data set.', 'BERT Language Model BERT Language Model I play the violin [SEP] ... I play with my cat Masked Language Model I play the violin I play the [MASK] I play the violin [SEP] and the tuba Next Sentence Prediction I play the violin [SEP] but I eat food ... Yes No Figure 1: A schematic representation of BERT, masked language model and next sentence prediction. Different words have different meanings and BERT looks at the word context to generate contextual representations. Transformers greatly shifted the focus of the research community towards attention-based architec- tures. The encoder-decoder structure based on transformers is also incorporated into BERT.', 'The power of BERT representations lies in the fact that it is essentially a pretrained model that can be ﬁne-tuned over speciﬁc downstream tasks, which enables it to achieve state-of-the-art results. The fundamental underlying component of this architecture is the Transformer model (Vaswani et al., 2017), an attention-based mechanism that has been shown to be effective in many different tasks. Both the Transformer and BERT have gathered much attention, and there is now a wealth of research articles and blog posts describing the inner workings of these models (Rogers et al., 2020, among others).']","During BERT's pre-training, the masked language modeling (MLM) task operates as follows: a random sample of the tokens in the input sequence is selected and replaced with the special token [MASK]. Of the selected tokens, 80% are replaced with [MASK], 10% are left unchanged, and 10% are replaced by a randomly selected vocabulary token. The MLM objective is a cross-entropy loss on predicting the masked tokens, taking into account only the surrounding context.","In the MLM task, a selection of random word tokens from the input text are replaced by a designated [MASK] token, which the model is then trained to predict.",1.0,1.0,0.62
How does the HyDE baseline retrieve relevant text chunks?,"['Chunk Size Chunk size significantly impacts performance. Larger chunks provide more context, enhancing comprehension but increasing process time. Smaller chunks improve retrieval recall and reduce time but may lack sufficient context. Chunking Techniques Advanced techniques such as small-to-big and sliding window improve retrieval quality by organizing chunk block relation- ships. Small-sized blocks are used to match queries, and larger blocks that include the small ones along with contextual information are returned. Metadata Addition Enhancing chunk blocks with metadata like titles, keywords, and hypo- thetical questions can improve retrieval, provide more ways to post-process retrieved texts, and help LLMs better understand retrieved information.', '3.2 Chunking Chunking documents into smaller segments is cru- cial for enhancing retrieval precision and avoiding length issues in LLMs. This process can be ap- plied at various levels of granularity, such as token, sentence, and semantic levels. • Token-level Chunking is straightforward but may split sentences, affecting retrieval quality. • Semantic-level Chunking uses LLMs to deter- mine breakpoints, context-preserving but time- consuming. • Sentence-level Chunking balances preserving text semantics with simplicity and efficiency. In this study, we use sentence-level chunking, bal- ancing simplicity and semantic preservation. We examine chunking from four dimensions:', 'Table 7: Results for different retrieval methods on TREC DL19/20. The best result for each method is made bold and the second is underlined. using HyDE. Concatenating multiple pseudo- documents with the original query can significantly enhance retrieval performance, though at the cost of increased latency, suggesting a trade-off between retrieval effectiveness and efficiency. However, in- discriminately increasing the number of hypothet- ical documents does not yield significant benefits and substantially raises latency, indicating that us- ing a single hypothetical document is sufficient.', 'utility in real-world applications. By adapting to specific domain knowledge (Tu et al., 2024), RAG systems ensure that the information provided is not only pertinent but also tailored to the user’s needs. Furthermore, they offer access to up-to-date information (Zhao et al., 2024), which is crucial in rapidly evolving fields. Chunking plays a vital role in facilitating the retrieval-augmented generation process (Lyu et al., 2024). By breaking down a large external text corpus into smaller, more man- ageable segments, chunking significantly enhances the accuracy of information retrieval. This enables more targeted similarity searches, ensuring that the retrieved content is directly relevant to user queries.', 'zephyr-7b-alpha4 and gpt-3.5-turbo5 as gen- eration model and evaluation model respectively. The size of the chunk overlap is 20 tokens. First sixty pages of the document lyft_20216 are used as corpus, then prompting LLMs to generate about one hundred and seventy queries according to cho- sen corpus. The impact of different chunk sizes is shown in Table 3. Chunking Techniques To demonstrate the effec- tiveness of advanced chunking techniques, we use the LLM-Embedder (Zhang et al., 2023a) model as embedding model. The smaller chunk size is 175 tokens, the larger chunk size is 512 tokens and the chunk overlap is 20 tokens. Techniques like small-to-big and sliding window improve retrieval quality by maintaining context and ensuring rele- vant information is retrieved. Detailed results are shown in Table 4.', 'Table 2: Results of the Query Classifier. A.2 Experimental Details of Chunking Methods Chunk Size Finding the optimal chunk size involves a balance between some metrics such as faithfulness, relevancy. Faithfulness measures whether the response is hallucinated or matches the retrieved texts. Relevancy measures whether the retrieved texts and response match queries. We use the evaluation module of LlamaIndex(LlamaIndex) to calculate the metrics above. For embedding, we use the text-embedding-ada-0023 model, which supports long input length. We choose 3https://platform.openai.com/docs/guides/embeddings/ embedding-models', '2.2 Retriever Enhancement Strategy Document chunking and embedding methods sig- nificantly impact retrieval performance. Common chunking strategies divide documents into chunks, but determining optimal chunk length can be chal- lenging. Small chunks may fragment sentences, while large chunks might include irrelevant con- text. LlamaIndex (Liu, 2022) optimizes the chunk- ing method like Small2Big and sliding window. Retrieved chunks can be irrelevant and numbers can be large, so reranking is necessary to filter irrelevant documents. A common reranking ap- proach employs deep language models such as BERT (Nogueira et al., 2019), T5 (Nogueira et al., 17717', '5 Containing Passage ICT Task We begin with experiments on the task of retriev- ing a Wikipedia passage y containing a sequence of words x. We create a dataset using Wikipedia, following the Inverse Cloze Task definition by Lee et al. (2019), but adapted to suit the goals of our study. The task is defined by first breaking Wikipedia texts into segments of length at most l. D o w n l o a d e d f r o m h t t p : / / d i r e c t . m i t . e d u / t a c l / a r t i c l e - p d f / d o i / 1 0 . 1 1 6 2 / t a c l _ a _ 0 0 3 6 9 / 1 9 2 4 0 4 0 / t a c l _ a _ 0 0 3 6 9 . p d f b y g u e s t o n 1 9 J u n e 2 0 2 6 336']","The HyDE baseline retrieves relevant text chunks by concatenating multiple pseudo-documents with the original query, which can significantly enhance retrieval performance. However, this approach comes at the cost of increased latency, suggesting a trade-off between retrieval effectiveness and efficiency.","HyDE uses an LLM to generate a hypothetical document based on the query, which is then used to retrieve relevant text chunks for the final answer.",1.0,1.0,0.29
"How are forecasting, imputation, and anomaly detection unified during pre-training?","['D. Showcase To present a clear performance of our proposed Timer, we provide visualizations for downstream forecasting, imputation, and anomaly detection tasks in Figure 19, 20 and 21. The forecasting and imputation contain experimental results at different sample ratios. For anomaly detection, we provide the position of the anomaly and the generated normal series by Timer. ECL 20% Samples Traffic 20% Samples PEMS03 20% Samples PEMS04 20% Samples ECL 5% Samples Traffic 5% Samples PEMS03 5% Samples PEMS04 5% Samples Figure 19. Visualization of input-672-predict-96 forecasting results of Timer trained with 5% and 20% samples. 25 Timer: Generative Pre-trained Transformers Are Large Time Series Models', '(1) Forecasting (2) Imputation (3) Detection 6’ 7’ 8’ 9’ … 1 2’ 3 4’ 5 2 3 4 5 6 Autoregression Assemble Comparison 2’ 3’ 4’ 5’ 6’ 2’ 3’ 4’ 5’ 6’ 2’ 3’ 4’ 5’ 6’ Timer Timer Timer 1 2 3 4 5 1 [M] 3 [M] 5 1 2 3 4 5 Figure 5. Illustration of our generative task unification: (1) Gener- ative pre-trained Timer can naturally predict the next series by the iterative autoregression; (2) By introducing masked tokens during adaptation, Timer generates imputations with the previous context and assemble them with the observed part; (3) We propose predic- tive anomaly detection by predicting normal series in advance.', '4. Experiments We demonstrate Timer as a large time series model in time series forecasting, imputation, and anomaly detection by tackling them in a unified generative scheme, which is de- scribed in Figure 5. We compare Timer with state-of-the-art task-specific models and present the benefit of pre-training on data-scarce scenarios, known as the few-shot ability of large models. Furthermore, we delve into the model scala- bility, including model/data size, and try to build a compre- hensive zero-shot evaluation across concurrent large time series models. All the downstream datasets are not included in the pre-training stage to prevent data leakage. We provide the detailed implementation and model configurations of pre-training and adaptation in Appendix B.1 and B.2.', 'Academic research In this paper, we release a high-quality dataset for scalable pre-training. Different from prior works, the dataset is not merely aggregation but follows deftly curation. Based on it, the research on scalable time series architectures and pre-training techniques can be facilitated. Towards large time series models, the proposed Timer shows its generalization and versatility in many tasks. The regime of generative pre-training and autoregression can be instructive for future research. 26 Timer: Generative Pre-trained Transformers Are Large Time Series Models Table 12. Downstream imputation with 20% samples. Pre-training benefit ∆% is calculated as the ratio of decreased imputing error in MSE. In the case of 20% samples, our pre-trained model outperforms TimesNet in 86.4% of 44 settings on datasets and masked ratios.', 'Real-world time series analysis is increasingly underscoring the demand for large time series models (LTSM). In this paper, we release a time series dataset with 1 billion time points, propose a unified sequence format to address the heterogeneity of multivariate time series, and develop a gen- erative pre-trained Transformer as a generalizable, scalable, task-general LTSM. Empirically, we evaluate our model in forecasting, imputation, and anomaly detection, yielding state-of-the-art performance and notable pre-training bene- fits in the data-scarce scenario. Further analysis validates the model scalability, explores the architecture for LTSMs, and highlights the versatility of our autoregressive generation. By performing zero-shot forecasting on available large mod- els, we conduct the initial quantitative assessments among LTSMs. Quality evaluations unveil crucial pathways for fu- ture', 'downstream adaption, we adopt the same next token prediction as the pre-training, that is, training Timer with the lookback series containing N = 7 segments of the length S = 96 to generate the next token with length 96, which is regarded as the standard value. After training, we record the MSE of all segments in the test set and sort them in descending order. We find the first segment hit the anomaly interval labeled in the dataset within the first α quantile, and we record the quantile. Based on the above protocol, the real-time judgment ability of the model for sudden anomalies can be predictively examined. Detailed quantiles of Timer in 250 tasks are provided in Table 15. With more complex time series anomalies introduced in UCR Anomaly Archive, we hope to establish a reasonable and challenging benchmark in the field of anomaly detection.', 'imputation (Friedman, 1962), anomaly detection (Breunig et al., 2000), etc. Despite the ubiquity of real-world time se- ries, training samples can be scarce in specific applications. While remarkable advances have been made in deep time series models (Wu et al., 2022; Zeng et al., 2023; Liu et al., 2023b), the accuracy of state-of-the-art deep models (Nie et al., 2022) can still deteriorate drastically in such scenar- ios, even within prevalent benchmarks as shown in Figure 1. Concurrently, we are witnessing rapid progress of large lan- guage models (Radford et al., 2018), involving training on large-scale text corpora and exhibiting remarkable few-shot and zero-shot capabilities (Radford et al., 2019). It can be indicative for the community to develop large time series models (LTSM) that are transferable on various data-scarce scenarios by pre-training on numerous time series data.', 'Considering the prevalent scenarios of anomaly detection by monitoring real-time measurements, the quick judgment of on-the-fly time series anomaly can be more practical in the real world. Therefore, we propose a predictive protocol of anomaly detection based on generative models. Concretely, we use the observed segments to predict the future segment, and the predicted segment will be established as the standard to be compared with the actual value received. We adopt the UCR Anomaly Archive proposed by Wu & Keogh (2021). The task is to find the position of an anomaly in the test series based on a single normal series for training, which is an extremely data-scarce scenario with only one available sample. For 22 Timer: Generative Pre-trained Transformers Are Large Time Series Models']","During pre-training, forecasting, imputation, and anomaly detection are unified through a generative scheme. This is illustrated in Figure 5, which shows that the generative pre-trained Timer can naturally predict the next series by iterative autoregression (forecasting), generate imputations with the previous context and assemble them with the observed part (imputation), and predict normal series in advance for anomaly detection.",These diverse time series tasks are converted into a unified generative task focused on next token prediction.,1.0,1.0,0.25
What steps were taken to ensure the reproducibility of the experimental results during scenario construction?,"['• If the paper includes experiments, a No answer to this question will not be perceived well by the reviewers: Making the paper reproducible is important, regardless of whether the code and data are provided or not. • If the contribution is a dataset and/or model, the authors should describe the steps taken to make their results reproducible or veriﬁable.', '• Depending on the contribution, reproducibility can be accomplished in various ways. For example, if the contribution is a novel architecture, describing the architecture fully might sufﬁce, or if the contribution is a speciﬁc model and empirical evaluation, it may be necessary to either make it possible for others to replicate the model with the same dataset, or provide access to the model. In general. releasing code and data is often one good way to accomplish this, but reproducibility can also be provided via detailed instructions for how to replicate the results, access to a hosted model (e.g., in the case of a large language model), releasing of a model checkpoint, or other means that are appropriate to the research performed.', '• Inversely, any informal proof provided in the core of the paper should be complemented by formal proofs provided in appendix or supplemental material. • Theorems and Lemmas that the proof relies upon should be properly referenced. 4. Experimental result reproducibility Question: Does the paper fully disclose all the information needed to reproduce the main ex- perimental results of the paper to the extent that it affects the main claims and/or conclusions of the paper (regardless of whether the code and data are provided or not)? Answer: [Yes] Justiﬁcation: Implementation details are provided in Section A. Guidelines: • The answer NA means that the paper does not include experiments.', '(d) We recognize that reproducibility may be tricky in some cases, in which case authors are welcome to describe the particular way they provide for reproducibility. In the case of closed-source models, it may be that access to the model is limited in some way (e.g., to registered users), but it should be possible for other researchers to have some path to reproducing or verifying the results. 5. Open access to data and code Question: Does the paper provide open access to the data and code, with sufﬁcient instruc- tions to faithfully reproduce the main experimental results, as described in supplemental material? 23 Answer: [Yes] Justiﬁcation: We include implementation details in the paper and will release the code and data after publication.', '• The authors should provide instructions on data access and preparation, including how to access the raw data, preprocessed data, intermediate data, and generated data, etc. • The authors should provide scripts to reproduce all experimental results for the new proposed method and baselines. If only a subset of experiments are reproducible, they should state which ones are omitted from the script and why. • At submission time, to preserve anonymity, the authors should release anonymized versions (if applicable). • Providing as much information as possible in supplemental material (appended to the paper) is recommended, but including URLs to data and code is permitted.', '• While NeurIPS does not require releasing code, the conference does require all submis- sions to provide some reasonable avenue for reproducibility, which may depend on the nature of the contribution. For example (a) If the contribution is primarily a new algorithm, the paper should make it clear how to reproduce that algorithm. (b) If the contribution is primarily a new model architecture, the paper should describe the architecture clearly and fully. (c) If the contribution is a new model (e.g., a large language model), then there should either be a way to access this model for reproducing the results or a way to reproduce the model (e.g., with an open-source dataset or instructions for how to construct the dataset).', '8. Experiments compute resources Question: For each experiment, does the paper provide sufﬁcient information on the com- puter resources (type of compute workers, memory, time of execution) needed to reproduce the experiments? Answer: [Yes] Justiﬁcation: We provide details on compute resources in Section A. Guidelines: • The answer NA means that the paper does not include experiments. • The paper should indicate the type of compute workers CPU or GPU, internal cluster, or cloud provider, including relevant memory and storage. • The paper should provide the amount of compute required for each of the individual experimental runs as well as estimate the total compute. • The paper should disclose whether the full research project required more compute than the experiments reported in the paper (e.g., preliminary or failed experiments that didn’t make it into the paper).', 'JURNAL INFOTEL, VOL. 16, NO. 4, NOVEMBER 2024, PP. 713–728. 716 FATWANTO et al. 2.1 Planning At this stage, a review protocol to conduct the study is designed with the purpose of having a systematic and structured literature review. The protocol consists of research questions, searching tools, searching terms, inclusion, exclusion, and quality assessment criteria. The protocol also establishes a data analysis and synthesis strategy as a guidance in extracting and summarizing the collected papers. The protocol is described in Table 1. Table 1: Systematic literature review protocol']",The retrieved context does not contain enough information to answer this question.,The authors used a construction pipeline with a fixed random seed to ensure reproducibility.,1.0,0.0,0.0
How does ColBERT filter punctuation from document embeddings?,"['Document Encoder. Our document encoder has a very similar architecture. We first segment a document 𝑑 into its constituent tokens𝑑1𝑑2...𝑑𝑚,towhichweprependBERT’sstarttoken[CLS]fol- lowed by our special token [D] that indicates a document sequence. Unlike queries, we do not append [mask] tokens to documents. Af- ter passing this input sequence through BERT and the subsequent linear layer, the document encoder filters out the embeddings corre- sponding to punctuation symbols, determined via a pre-defined list. This filtering is meant to reduce the number of embeddings per doc- ument, as we hypothesize that (even contextualized) embeddings of punctuation are unnecessary for effectiveness. In summary, given 𝑞 = 𝑞0𝑞1...𝑞𝑙 and 𝑑 = 𝑑0𝑑1...𝑑𝑛, we compute the bags of embeddings 𝐸𝑞 and 𝐸𝑑 in the following manner, where # refers to the [mask] tokens:', 'Even though ColBERT’s late-interaction framework can be ap- pliedtoawidevarietyofarchitectures(e.g.,CNNs,RNNs,transform- ers,etc.),wechoosetofocusthisworkonbi-directionaltransformer- based encoders (i.e., BERT) owing to their state-of-the-art effective- ness yet very high computational cost. 3.1 Architecture Figure 3 depicts the general architecture of ColBERT, which com- prises: (a) a query encoder 𝑓𝑄, (b) a document encoder 𝑓𝐷, and (c) the late interaction mechanism. Given a query 𝑞 and document 𝑑, 𝑓𝑄 encodes 𝑞 into a bag of fixed-size embeddings 𝐸𝑞 while 𝑓𝐷 en- codes 𝑑 into another bag 𝐸𝑑. Crucially, each embeddings in 𝐸𝑞 and 𝐸𝑑 is contextualized based on the other terms in 𝑞 or𝑑, respectively. We describe our BERT-based encoders in §3.2.', 'are kept for query-text interaction. Different from the repre- sentation scheme of cross-encoder (Section 3.2.1), these contextualized representations do not directly interact across queries and texts during encoding. Instead, they introduce a query-time mechanism for per-token representation interaction, called late interaction [113]. As the extension of ColBERT, ColBERTer [91] designs an approach by combining single-representation (the “[CLS]” embedding) and multi-representation (per-token embeddings) mechanisms for matching, achieving performance improvement over ColBERT.', 'While ColBERT’s embedding dimension has limited impact on the efficiency of query encoding, this step is crucial for controlling the space footprint of documents, as we show in §4.5. In addition, it can have a significant impact on query execution time, particu- larly the time taken for transferring the document representations onto the GPU from system memory (where they reside before pro- cessing a query). In fact, as we show in §4.2, gathering, stacking, and transferring the embeddings from CPU to GPU can be the most expensive step in re-ranking with ColBERT. Finally, the out- put embeddings are normalized so each has L2 norm equal to one. The result is that the dot-product of any two embeddings becomes equivalent to their cosine similarity, falling in the [−1,1] range.', 'Relativetoexistingneuralrankers(especially,butnotexclusively, BERT-based ones), this computation is very cheap that, in fact, the cost of a simple implementation is dominated by the gathering and transferring of the pre-computed embeddings. To illustrate, ranking 𝑘 documents via typical BERT rankers requires feeding BERT 𝑘 different inputs each of length 𝑙 = |𝑞| + |𝑑𝑖| for query 𝑞 and documents 𝑑𝑖, where attention has quadratic cost in the length of the sequence. In contrast, ColBERT feeds BERT only a single, much shorter sequence of length 𝑙 = |𝑞|. Consequently, ColBERT is not only cheaper, it also scales much better with 𝑘 (§4.2).', '4.1.2 Implementation. Our ColBERT models are implemented us- ing Python 3 and PyTorch 1. We use the popular transformers6 library for pre-trained BERT. Similar to [25], we fine-tune all Col- BERT models with learning rate 3×10−6 with a batch size 32. We fix the number of embeddings per query at 𝑁𝑞 = 32. Unless otherwise stated, we set our ColBERT embedding dimension 𝑚 to 128; §4.5 demonstrates ColBERT’s robustness to a wide range of dimensions.', 'deep transformer architecture, which computes a contextualized representation of each token. We denote the padding with masked tokens as query augmen- tation,astepthatallowsBERTtoproducequery-basedembeddings at the positions corresponding to these masks. Query augmentation is intended to serve as a soft, differentiable mechanism for learning to expand queries with new terms or to re-weigh existing terms based on their importance for matching the query. As we show in §4.4, this operation is essential for ColBERT’s effectiveness.', 'ained similarity. By delaying and yet retaining this fine-granular interaction, ColBERT can leverage the expressiveness of deep LMs while simultaneously gaining the ability to pre-compute document representations offline, considerably speeding up query processing. Crucially, ColBERT’s pruning-friendly interaction mechanism en- ables leveraging vector-similarity indexes for end-to-end retrieval directly from millions of documents. We extensively evaluate Col- BERT using two recent passage search datasets. Results show that ColBERT’s effectiveness is competitive with existing BERT-based models (and outperforms every non-BERT baseline), while exe- cuting two orders-of-magnitude faster and requiring up to four orders-of-magnitude fewer FLOPs per query.']","ColBERT filters out the embeddings corresponding to punctuation symbols from document embeddings via a pre-defined list. This filtering is done after passing the input sequence through BERT and the subsequent linear layer, and it is meant to reduce the number of embeddings per document, as the authors hypothesize that even contextualized embeddings of punctuation are unnecessary for effectiveness.",The document encoder removes embeddings associated with punctuation symbols by utilizing a pre-defined list.,1.0,0.8571428571428571,0.4
What type of custom kernel is provided in the supplementary code for inference benchmarking?,"['8 REPRODUCIBILITY STATEMENT In the Supplementary Materials, we provide code to reproduce all experiments in this paper. More speciﬁcally, this includes: • Compressing all models from the OPT and BLOOM model families to 2/3/4 bits. • Evaluating perplexity of the quantized models. • Our 3-bit CUDA kernel together with compressed inference benchmarking features. • Code for the ZeroShot experiments. • A README ﬁle providing sample commands and information on how to run all scripts.', 'enough to execute on huge models without issues. As a bonus, using a well-optimized Cholesky kernel also yields further speedup. We detail all small changes necessary for the Cholesky version of the algorithm next.', '4.3 Scaling Test-Time Compute In alignment with OpenAI o1 [12], our model allows for scaling test-time compute to potentially achieve better performance without updating model weights. There are multiple ways to control the test-time compute. In Figure 3, we concentrate on two factors: the retrieval chain length L and the number of sampled chains N for best-of-N sampling. Greedy decoding is a special instance of best-of-N sampling with N = 1 and the temperature set to 0. 6', 'Years 2020 2019 Methods PLMs Arch. Training Negative Data Aug. Pretrain Other Tricks Context-candidate attention Joint training Poly-encoders [98] ICT [120) BERT BERThe MR SR TAP TAP 2020 ICT+BFS+WLP [28] BERThe SR TAP 2020 REALM [79] BERTe SR RAP Joint training + Async. index 2020 DPR [111] BERThe SR IB+SHN ALD 2020 ColBERT [113] BERT} Multi-core pre-processing 2020 ME-BERT [161] BERT), 0 MR IB+DyHN Sparse-dense hybrid 2020 RepBERT [309] BERT}¢¢ SR B 2020 ANCE [289) RoBERTay ;¢ SR DyHN Async. index 2020 EZRQG [135) BERT} e SR Query generation 2020 AugmentedBERT [297] BERT}e SR SHN Kernel density estimation 2020 In-batch KD [89] BERTh SR 1B BB Cross-architecture KD 2020 RocketQA [207] ERNIE SR CB+DeHN Iter. training 2020 AugmentSBERT [259] BERThe SR SHN+DeHN Kernel density estimation 2020 TCT-ColBERT [141] BERTe SR IB+SHN KD Sparse-dense hybrid', 'We report the competition’s official metric, namely MRR@10, on the validation set (Dev) and the evaluation set (Eval). We also report the re-ranking latency, which we measure using a single Tesla V100 GPU, and the FLOPs per query for each neural ranking model. To do so, we adapt the baselines’ publicly-available reference implemen- tations into our pytorch testbed. For ColBERT, our reported latency subsumes the entire computation from gathering the document representations, moving them to the GPU, tokenizing then encod- ing the query, and applying late interaction to compute document scores. For the baselines, we measure the scoring computations on the GPU and exclude the CPU-based text preprocessing (similar to [9]). In principle, the baselines can pre-compute most of this preprocessing (e.g., document tokenization) offline. We estimate the FLOPs using the torchprofile8 library.', 'We additionally use a novel dataset, CC-NEWS, and release our models and code for pretraining and ﬁnetuning at: https://github.com/pytorch/fairseq.', 'h RocketQA variants do not include all the optimization techniques introduced in Section 4, they provide a unified base model by examining the effects of different optimization techniques in a rel- atively fair way. As a comparison, we incorporate the classic BM25 [227] and DPR [111] methods as baselines. To reproduce the experiments in this part, we implement a code repertory for dense retrieval at the link https://github.com/PaddlePaddle/RocketQA and release the script or code to reproduce the results in Table 3. This code repertory is implemented based on the library Pad- dlePaddele, consisting of RocketQA, RocketQAPAIR and RocketQAv2. For a fair comparison, we re-implement the DPR model with PaddlePaddele and use ERNIE as the base PLM [253].', 'In general, our kernels target generative inference in the low batch-size setting (for simplicity, we consider only batchsize 1) where the underlying (close to) matrix-vector products are memory- bound. For non-generative and large-batch applications, operations may be compute- rather than memory-bound and our kernels thus not directly applicable. Instead, one could simply decompress the matrix before performing the corresponding matrix-matrix calculations: this takes < 1.5ms on an A100 and < 3ms on an A6000 compared to 76ms/365ms for the subsequent OPT-175B FC2 layer computation with batchsize 16×1024 tokens. Hence, for such applications our methods signiﬁcantly reduce the required number of GPUs at very little computational overhead. This is similar to recent work (Dettmers et al., 2022), but we achieve a 2.5× higher compression rate.']",Our 3-bit CUDA kernel is provided in the supplementary code for inference benchmarking.,The authors provide a 3-bit CUDA kernel along with compressed inference benchmarking features.,1.0,0.5,0.8
How is the information from the visual word embeddings aggregated back into the visual sentence embedding within the TNT architecture?,"['Y i = [yi,1,yi,2,··· ,yi,m], yi,j = FC(Vec(xi,j)), (5) where yi,j ∈ Rc is the j-th word embedding, c is the dimension of word embedding, and Vec(·) is the vectorization operation. In TNT, we have two data ﬂows in which one ﬂow operates across the visual sentences and the other processes the visual words inside each sentence. For the word embeddings, we utilize a transformer block to explore the relation between visual words: Y =Y + MSA(LN(Y , ©) Y =Y’} + MLP(LN(Y})). O] 3', 'Z\' = Z1 + MSA(LN(Z_1)), ® 2, = Z\' + MLP(LN(Z""))). 10) This outer transformer block Tout is used for modeling relationships among sentence embeddings. In summary, the inputs and outputs of the TNT block include the visual word embeddings and sentence embeddings as shown in Fig. 1(b), so the TNT can be formulated as Yl,Zl = TNT(Yl−1,Zl−1). (11) In our TNT block, the inner transformer block is used to model the relationship between visual words for local feature extraction, and the outer transformer block captures the intrinsic information from the sequence of sentences. By stacking the TNT blocks for L times, we build the transformer- in-transformer network. Finally, the classiﬁcation token serves as the image representation and a fully-connected layer is applied for classiﬁcation.', '“visual sentences” and present to further divide them into smaller patches (e.g., 4×4) as “visual words”. The attention of each word will be calculated with other words in the given visual sentence with negligible computational costs. Features of both words and sentences will be ag- gregated to enhance the representation ability. Experiments on several benchmarks demonstrate the effectiveness of the proposed TNT architecture, e.g., we achieve an 81.5% top-1 accuracy on the ImageNet, which is about 1.7% higher than that of the state-of-the-art visual transformer with similar computational cost. The PyTorch code is available at https://github.com/huawei-noah/CV-Backbones, and the MindSpore code is available at https://gitee.com/mindspore/models/ tree/master/research/cv/TNT.', 'Number of visual words. In TNT, the input image is split into a number of 16×16 patches and each patch is further split into m sub-patches (visual words) of size (s,s) for computational efﬁciency. Here we test the ef- fect of hyper-parameter m on TNT-S architecture. When we change m, the embedding dimension c also changes Table 8: Effect of #words m.', 'In addition to the patch-level features, we also visualize the pixel-level embeddings of TNT in Fig. 4. For each patch, we reshape the word embeddings according to their spatial positions to form the feature maps and then average these feature maps by the channel dimension. The averaged feature maps corresponding to the 14×14 patches are shown in Fig. 4. We can see that the local information is well preserved in the shallow layers, and the representations become more abstract gradually as the network goes deeper.', 'For the sentence level, we create the sentence embedding memories to store the sequence of sentence- level representations: Z0 = [Zclass,Z1 0 ] ∈ R(n+1)×d where Zclass is the class token 0,Z2 0,··· ,Zn similar to ViT [9], and all of them are initialized as zero. In each layer, the sequence of word embeddings are transformed into the domain of sentence embedding by linear projection and added into the sentence embedding: Zi l−1 = Zi l−1 + FC(Vec(Y i l )), (8) l−1 ∈ Rd and the fully-connected layer FC makes the dimension match for addition. With the where Zi above addition operation, the representation of sentence embedding is augmented by the word-level features. We use the standard transformer block for transforming the sentence embeddings:', 'Position encoding. Spatial information is an important factor in image recognition. For sentence embeddings and word embeddings, we both add the corresponding position encodings to retain spatial information as shown in Fig. 1. The standard learnable 1D position encodings are utilized here. Speciﬁcally, each sentence is assigned with a position encodings: Z0 ← Z0 + Esentence, (12) where Esentence ∈ R(n+1)×d are the sentence position encodings. As for the visual words in a sentence, a word position encoding is added to each word embedding: Y i 0 ← Y i 0 + Eword, i = 1,2,··· ,n (13) where Eword ∈ Rm×c are the word position encodings which are shared across sentences. In this way, sentence position encoding can maintain the global spatial information, while word position encoding is used for preserving the local relative position.', '𝐿 × Output Outer Transformer Block 1 Sentence position encoding + Inner Transformer Block + Inner Transformer Block … + Inner Transformer Block Sentence embedding 0 * 1 1 4 7 2 5 8 3 6 9 2 1 4 7 2 5 8 3 6 9 … 9 1 4 7 2 5 8 3 6 9 * Class token Linear Projection of Visual Sentences and Words … 1 Word position encoding Word embedding Figure 1: Illustration of the proposed Transformer-iN-Transformer (TNT) framework. The inner transformer block is shared in the same layer. The word position encodings are shared across visual sentences.']","The information from the visual word embeddings is aggregated back into the visual sentence embedding within the TNT architecture through the following steps:

1. The sequence of word embeddings are transformed into the domain of sentence embedding by linear projection in Equation (8): Zi l−1 = Zi l−1 + FC(Vec(Y i l−1)), where Zi l−1 is the sentence embedding, FC is the fully-connected layer, and Vec(Y i l−1) is the vectorized word embedding.
2. The resulting sentence embedding is then added to the previous sentence embedding, augmenting its representation with the word-level features.
3. The standard transformer block is used to transform the sentence embeddings, allowing the model to capture the relationships between the sentence embeddings and the word embeddings.

This process is repeated for each layer of the TNT architecture, with the output of each layer being used as the input to the next layer.",The information from the visual word embeddings is added to the visual sentence embedding after being projected through a linear layer.,1.0,1.0,0.8
"According to the review, what are the anticipated future directions for the development of textual metrics?","[""In general, the text metric, or the metric of the quality of text generation, is a function , where is the vectorized representation of the sample proposal, and is the vectorized representation of the candidate proposal. A good metric should reflect the person's judgment as closely as possible, that is, show a high correlation with the person's assessment results. All existing metrics can be roughly classified into one of four categories: n-gram match, edit distance, attachment comparison, and trained functions. A good metric should reflect the person's judgment as closely as possible, that is, show a high correlation with the person's assessment results. All existing metrics can be roughly classified into one of four categories: n-gram match, edit distance, attachment comparison, and trained functions."", 'The most common textual metrics are based on counting the number of n-grams found in both sentences. The larger the dimension n in an n-gram, the more the metric can capture the similarity of whole words and their order, but at the same time, the more this metric is limited and tied to a specific formulation and word forms. The already mentioned BLUE and MeTEOR belong to this category of metrics. Some methods calculate the proximity of proposals by the number of edits that translate a candidate into a reference. Methods such as TER [72] and ITER [61] take into account the semantic proximity of words and the normalization of grammatical forms. This can also include methods like PER [77] and CDER [37], taking into account the permutation of text blocks. Some more modern methods (CharacTER [84], EED [73]) have unexpectedly better results.', 'Undoubtedly, the direction of the future development of textual metrics will be the wider use of BERT as a basis for assessment, a kind of semantic engine. Also promising is the development of specific models that take into account the peculiarities of specific subject areas and increase the basic level of accuracy through specialization. Concerning BERTScore, another advantage is its differentiability, which will allow it to be integrated into the methodology for training text models in the future, which promises to further increase the performance and quality of machine learning models of natural text processing.', 'certain hyperparameters arrangement. In addition, we also identified and located any description and explanation about evaluation metrics for particular NLP tasks. A total of 41 papers that met these quality assesment criteria were finally chosen.', 'uently demanded NLP tasks (i.e. text classification, question answering, and text summarization), and also the employed evaluation metrics for particular NLP tasks.', 'RQ 3. What type of evaluation metrics were normally employed for particular NLP tasks?', 'Since the criterion for the quality of a text metric is its correlation with human judgments, it is not surprising that machine learning is used to build trained metrics, where the target function is just such a coincidence. For example, BLEND [48] uses a regression model to weigh 29 known metrics. The disadvantage of this approach is the dependence on the presence of a corpus of pre-labeled data for the training set, as well as the risk of overfitting in a certain subject area and, as a consequence, the loss of generalizing ability and universality.', 's in- dexed by Scopus and Google Scholar from which 41 complied with our defined review criteria and finally chosen for further analysis. Our review came up with three conclu- sions. First, in order to select appropriate models for particular NLP tasks, three primary concerns should be considered: i) the type of NLP problem to be resolved (i.e. NLP task to be served), ii) the specific domain to be handled (such as financial, medical, law/legal or others), and iii) the intended language to be applied (such as English or others). Second, learning rate, batch size, and the type of optimizer were the three most considered hyper- parameters to be properly arranged in model training. Third, the most widely used metrics for text classification tasks were F1-score, accuracy, precision, and sensitivity (recall), while question answering, and text summarization tasks were mostly used the Exact']","According to the review, the anticipated future directions for the development of textual metrics are:

1. The wider use of BERT as a basis for assessment, serving as a kind of semantic engine.
2. The development of specific models that take into account the peculiarities of specific subject areas, increasing the basic level of accuracy through specialization.
3. The integration of differentiable metrics, such as BERTScore, into the methodology for training text models, which promises to further increase the performance and quality of machine learning models of natural text processing.",Future directions involve wider utilization of BERT as a semantic engine for assessment and the creation of specialized models that account for specific subject areas to increase accuracy.,1.0,1.0,0.25
How does the model predict the graph label using the extracted graph representation?,"['4.2. Property Prediction In a graph-level learning task, we often need to predict the label y of a graph G. With the pre-trained model, we fine- tune it to address the graph-level learning task. After the sequence s is generated from G, we extract the activation h of the final token sL from the last Transformer block as the graph representation. The rationale is that the model must have learned the information of the entire graph in order to expand it with further edges. We replace the token- predicting layer with an MLP to predict y based on h: p(y|s) = Softmax(Dropout(Linear(h))).', '5.2 Large Language Model for Graphs Graphs have become a powerful framework for rep- resenting complex relationships, with applications across fields. As large language models (LLMs) evolve, researchers aim to enhance their ability to interpret graph-structured data. This work falls into three broad categories: i) GNNs as Prefix - using GNNs to generate structure-aware tokens for LLMs, e.g., GraphGPT (Tang et al., 2024) and LLaGA (Chen et al., 2024). ii) LLMs as Prefix - leveraging LLMs to process graph data with text, producing embeddings/labels to refine GNN train- ing, like GALM (Xie et al., 2023) and OFA (Liu et al., 2024). iii) LLMs-Graphs Integration - achieving seamless interaction, using techniques, , fusion training, GNN alignment, and LLM-based agents for direct graph handling, e.g., Grenade (Li et al., 2023) and Congrat (Brannon et al., 2023).', 'Graph pre-training methods. We compare against several pre-training approaches for molecular property prediction, as summarized in Table 5. The goal ofGraph pre-training methods is to learn robust graph representations via exploiting the structural information. AttrMask (Hu et al., 2020a) uses attribute masking at both node and graph levels to capture local and global features simultaneously. ContextPred (Hu et al., 2020a) builds on this idea by predicting subgraph contexts, enabling the model to understand patterns beyond individual attributes. Similarly, InfoGraph (Sun et al., 2020) focuses on multi-scale graph representations by maximizing mutual information between graph-level embeddings and substructures. Moving to contrastive learning approaches, GraphCL (You et al., 2021) applies graph augmentations to generate positive and negative samples for representation learning. Building on', 'Kreuzer, D., Beaini, D., Hamilton, W., L´etourneau, V., and Tossou, P. Rethinking graph transformers with spectral attention. Advances in Neural Information Processing Systems, 34:21618–21629, 2021. Lezama, J., Salimans, T., Jiang, L., Chang, H., Ho, J., and Essa, I. Discrete predictor-corrector diffusion models for image synthesis. In The Eleventh International Confer- ence on Learning Representations, 2022. Li, P. and Leskovec, J. The expressive power of graph neural networks. Graph Neural Networks: Foundations, Frontiers, and Applications, pp. 63–98, 2022. Li, Y., Vinyals, O., Dyer, C., Pascanu, R., and Battaglia, P. Learning deep generative models of graphs. arXiv preprint arXiv:1803.03324, 2018.', '5.1. Setup Datasets. We consider both generative tasks and predictive tasks in our experiments. We use three molecule datasets: QM9 (Wu et al., 2018b), MOSES (Polykovskiy et al., 2020), and GuacaMol (Brown et al., 2019); and four generic graph datasets: Planar, Tree, Lobster, and stochastic block model (SBM), which are widely used to benchmark graph gen- erative models. In predictive tasks, we fine-tune models pre-trained from GuacaMol datasets on molecular proper- ties with the benchmark method MoleculeNet (Wu et al., 2018a). Further details are in Appendix B.4,', '2. Related work Permutation-invariant vs sequential models. Neural graph generative models are first developed as autoregres- sive models. These models represent graphs as sequences and learn to generate such representations. A variety of mod- els such as GraphRNN (You et al., 2018a), GRAN (Liao et al., 2019), GraphDF (Luo et al., 2021), and DAGG (Han et al., 2023) generate entries of the lower triangular of the adjacency matrix of the target graph, while DeepGMG (Li et al., 2018) and BiGG (Dai et al., 2020) directly generate edges through node representations learned from partially generated graphs.', 'Figure 1. Illustration of our proposed graph sequence representation. This representation can be viewed as a sequence of actions: first generating all nodes (node type, node index), then explicitly adding edges (source node index, destination node index, edge type) step by step until completion. A unified vocabulary is used to map different types of actions into a shared token space. We denote the tokenized sequence s = [s1,...,sL], which is used in the following sections. Training objective. With the autoregressive Transformer, we minimize the negative log-likelihood of the sequence. L S —log pe(s) > —logp(sils<i) =1', '., 2021) applies graph augmentations to generate positive and negative samples for representation learning. Building on this idea, GraphMVP (Liu et al., 2022a) incorporates both 2D molecular topology and 3D geometric views, aligning them within a contrastive framework to enhance feature representation. In contrast to these methods, GraphMAE (Hou et al., 2022b) adopts a generative approach, using a masked graph auto-encoder to reconstruct node features and capture structural information.']",The model predicts the graph label using the extracted graph representation by replacing the token-predicting layer with a Multi-Layer Perceptron (MLP). The MLP takes the activation h of the final token sL from the last Transformer block as input and outputs the predicted label y: p(y|s) = Softmax(Dropout(Linear(h))).,The model replaces the token-predicting layer with a Multi-Layer Perceptron (MLP) to predict the label based on the extracted representation.,1.0,1.0,0.29
What are the two forms of attention that can be computed over the bipartite graph depending on the direction of information propagation?,"['The standard transformer network consists of alternating multi-head self-attention and feed-forward layers. We refer to each pair of self-attention and feed-forward layers as a transformer layer, such that a Transformer is considered to be a stack composed of several such layers. The Self- Attention operator considers all pairwise relations among the input elements, so to update each single element by attending to all the others. The Bipartite Transformer gener- alizes this formulation, featuring instead a bipartite graph between two groups of variables (in the GAN case, latents and image features). In the following, we consider two forms of attention that could be computed over the bipartite graph – Simplex attention, and Duplex attention, depending on the direction in which information propagates2 – either in one way only, or both in top-down and bottom-up ways. While for clarity', '3.1.1. SIMPLEX ATTENTION We begin by introducing the simplex attention, which dis- tributes information in a single direction over the Bipar- tite Transformer. Formally, let Xn×d denote an input set of n vectors of dimension d (where, for the image case, n = W×H), and Y m×d denote a set of m aggregator vari- ables (the latents, in the case of the generator). We can then compute attention over the derived bipartite graph between 2In computer networks, simplex refers to single direction com- munication, while duplex refers to communication in both ways. GANsformer Latents Image Latent Attention 2 | | | Simplex / Duplex . Components softly attend to | different regions or objects ResNet block 2 x Conv 3x3 StyleGAN ! Global Latent Upsampling z | + )= N A T x Log(Res) The latent impacts all the image features uniformly', 'Overall, the bipartite transformer is thus composed of a stack that alternates attention (simplex or duplex) and con- volution layers, starting from a 4×4 grid up to the desirable resolution. Conceptually, this structure fosters an interesting communication ﬂow: rather than densely modeling interac- tions among all the pairs of pixels in the images, it supports adaptive long-range interaction between far away pixels in a moderated manner, passing through through a compact and global bottleneck that selectively gathers information from the entire input and distribute it to relevant regions. Intuitively, this form can be viewed as analogous to the top-down notions discussed in section 1, as information is propagated in the two directions, both from the local pixel to the global high-level representation and vise versa.', 'Figure 2. We introduce the GANsformer network, that leverages a bipartite structure to allow long-range interactions, while evading the quadratic complexity standard transformers suffer from. We present two novel attention operations over the bipartite graph: simplex and duplex, the former permits communication in one direction, in the generative context – from the latents to the image features, while the latter enables both top-down and bottom up connections between these two variable groups.', '3.1.2. DUPLEX ATTENTION We can go further and consider the variables Y to poses a key-value structure of their own (Miller et al., 2016): Y = (Kn×d,V n×d), where the values store the content of the Y variables (e.g. the randomly sampled latents for the case of GANs) while the keys track the centroids of the attention- based assignments from X to Y , which can be computed as: K = ab(Y,X). Consequently, we can deﬁne a new update rule, that is later empirically shown to work more effectively than the simplex attention: wX,Y) = v(a(X, K, V)) 0 w(X) + Ba(X, K, V)) This update compounds two attention operations on top of each other, where we ﬁrst compute soft attention assign- ments between X and Y , and then reﬁne the assignments by considering their centroids, analogously to the k-means algorithm (Lloyd, 1982; Locatello et al., 2020).', 'Visualization of Attention Maps. There are two self-attention layers in our TNT block, i.e., an inner self-attention and an outer self-attention for modeling relationship among visual words and sentences respectively. We show the attention maps of different queries in the inner transformer in Figure 5. For a given query visual word, the attention values of visual words with similar appearance are higher, indicating their features will be interacted more relevantly with the query. These interactions are missed in ViT and DeiT, etc. The attention maps in the outer transformer can be found in the supplemental material. 8 2 0 D ol = g BERIFT N L W s | l L B el 5 FFTTETE S W Block-1 i | dda T [E M A HE R L @i T E [ 4 e L - L N | [ l [ R R R L [ L T il 58 R ] RR Block-6', 'Pi = {j : h(qi) = h(kj)} (4) Figure 2(a-b) shows a schematic comparison of full-attention with a hashed variant. Part (a) depicts that the attention matrix for full attention is typically sparse, but the computation does not take advantage of this sparsity. In (b), the queries and keys have been sorted according to their hash bucket. Since similar items fall in the same bucket with high probability, the full attention pattern can be approximated by only allowing attention within each bucket.', 'mory, and then re-computing it on the backward pass when needed for √ dk gradients. This way of computing attention may be less efﬁcient but it only uses memory propor- tional to length. We use this memory-efﬁcient implementation of attention to run the full-attention baselines presented in the experimental section.']","The two forms of attention that can be computed over the bipartite graph depending on the direction of information propagation are:

1. Simplex attention: This distributes information in a single direction over the Bipartite Transformer.
2. Duplex attention: This enables both top-down and bottom-up connections between the two variable groups, allowing information to propagate in both directions.",The two forms are Simplex attention and Duplex attention.,1.0,1.0,0.33
How is the validation set pre-processed before encoding for language generation experiments?,"['A.2.1 EVALUATION For language generation experiments, we calculate the perplexity, in standard fashion like Radford et al. (2019), as follows: First, the entire validation set is concatenated using two linebreaks as separators and encoded using the default HuggingFace tokenizer of each model. Next, the sequence is split into non-overlapping segments of width 2048, the full context size of our models. These are sent through the model to collect the log-probabilities corresponding to the next token each. Their exponentiated average is the ﬁnal perplexity we report. For zero-shot tasks we follow the EleutherAI evaluation harness3 in terms of data preprocessing and ﬁnal score calculation. We note that we evaluate all individual samples separately and thus do not apply any padding.', '54644 [31] W. Hou and Z. Ji, ‘‘GeneTuring tests GPT models in genomics,’’ BioRxiv, Mar. 2023. [Online]. Available: https://www.biorxiv.org/ content/10.1101/2023.03.11.532238v1 [32] S. Edunov, A. Baevski, and M. Auli, ‘‘Pre-trained language model representations for language generation,’’ in Proc. Conf. North Amer. Chapter Assoc. Comput. Linguistics, Human Lang. Technol., Jun. 2019, pp. 4052–4059. [33] A. Rahali and M. A. Akhloufi, ‘‘End-to-end transformer-based models in textual-based NLP,’’ AI, vol. 4, no. 1, pp. 54–110, Jan. 2023. [34] J. R. Stevens, R. Venkatesan, S. Dai, B. Khailany, and A. Raghunathan, ‘‘Softermax: Hardware/software co-design of an efficient softmax for transformers,’’ in Proc. 58th ACM/IEEE Design Autom. Conf. (DAC), Dec. 2021, pp. 469–474.', '2It is possible that these other methods could also improve with more tuning. We leave this exploration to future work. alternatives that lead to better downstream task performance; (2) We use a novel dataset, CC- NEWS, and conﬁrm that using more data for pre- training further improves performance on down- stream tasks; (3) Our training improvements show that masked language model pretraining, under the right design choices, is competitive with all other recently published methods. We release our model, pretraining and ﬁne-tuning code imple- mented in PyTorch (Paszke et al., 2017). 2 Background In this section, we give a brief overview of the BERT (Devlin et al., 2019) pretraining approach and some of the training choices that we will ex- amine experimentally in the following section.', 'In this work, we mainly adopt soft prompts in preﬁx- tuning [49], which leverage continuous embeddings (virtual tokens) to steer the pre-trained language model by directly appending several additional virtual tokens before the text as the prompts. Such continuous embeddings are randomly initialized and learned end-to-end on the downstream tasks to be task-speciﬁc. Diﬀerent from [49], we do not append the virtual tokens to the very beginning of the source input, but only before the target sequence (between the source and the target). Equipped with the prompt, our ﬁnal sequence is constructed as [source; prompt; target], as depicted in Fig. 1. During the inference, we provide the source text and the prompt as the preﬁx for the language model to condition on and let the language model to generate the target output as in Fig. 1.', 'A.6 Experimental Details of Generator Fine-tuning Datasets We fine-tune our model on several question answering(QA) and reading comprehen- sion datasets, including ASQA (Stelmakh et al., 2022), HotpotQA (Yang et al., 2018), Narra- tiveQA (Koˇcisk`y et al., 2018), NQ (Kwiatkowski et al., 2019), SQuAD (Rajpurkar et al., 2016), Triv- iaQA (Joshi et al., 2017), TruthfulQA (Lin et al., 2021b). We use their train splits (for those con- taining significantly more data entries than others, we conducted a random sample). For evaluation, ASQA (Stelmakh et al., 2022), HotpotQA (Yang et al., 2018), NQ (Kwiatkowski et al., 2019), Trivi- aQA (Joshi et al., 2017) are used. We evaluate our 17732', 'Unbalanced autoencoder based pretraining. Recently, Lu et al. [159] have reported an inter- esting finding that a stronger decoder may lead to worse sequence representations for the au- toencoder. It is explained as the bypass effect: when the decoder is strong, it may not refer to the information representation from the encoder, but instead perform the sequence generation condi- tionedonprevioustokens.Theyprovidetheoreticalanalysisonthisfinding,andimplementaweak decoder based on a shallow Transformer with restricted access to previous context. In this way, it explicitly enhances the dependency of the decoder on the encoder. This work has inspired several studies that use the “strong encoder, simple decoder” architecture for unsupervised text represen- tation pretraining. Based on such an unbalanced architecture, SimLM [279] pretrains the encoder and decoder with replaced language', 'Text Generation GPT, GPT-2 and GPT-3 demonstrate remarkable generation ability. Given words, phrases or simple sentences as preﬁx, they can continue to generate text that are syntactically correct and semantically smooth conditioning on the given text. We are also curious about the text generation ability of the pre-trained BioGPT in the biomedical domain, and how does general domain GPT-2 perform in the biomedical domain. text We evaluate the biomedical text generation ability of BioGPT and GPT-2medium. Specially, we extract all the entities within the triplets from the KD-DTI test set (i.e., drugs and targets). Then for each drug/target name, we provide it to the language model as the preﬁx and let the model generate text conditioned on it. We then investigate whether the generated text is meaningful and ﬂuent.', 'Figure 3: Results of generator fine-tuning. used for fine-tuning and evaluation mainly follow (Lin et al., 2023). We train our generator for 3 epochs and constrain the maximum length of the sequence to 1600, using a batch size of 4 and a learning rate of 5e-5. During testing, we use a zero-shot setting. Detailed Results Table 12 shows our evaluation results on each dataset. A.7 Experimental Details of Comprehensive Evaluation Tasks and Datasets We conducted extensive ex- periments across various NLP tasks and datasets to assess the performance of RAG systems. Specif- ically: (1) Commonsense Reasoning: We eval- uated on MMLU (Hendrycks et al., 2020), ARC- Challenge (Clark et al., 2018), and OpenbookQA (Mihaylov et al., 2018) datasets. (2) Fact Check-']","The validation set is pre-processed by concatenating it using two linebreaks as separators, and then encoded using the default HuggingFace tokenizer of each model.",The entire validation set is first concatenated using two linebreaks as separators.,1.0,0.6666666666666666,0.75
How did all GraphRAG conditions perform against the naı̈ve RAG baseline in terms of comprehensiveness and diversity?,"['10760 Table 9: Case Study: Comparison Between LightRAG and the Baseline Method GraphRAG.', 'Figure 2: Head-to-head win rate percentages of (row condition) over (column condition) across two datasets, four metrics, and 125 questions per comparison (each repeated five times and averaged). The overall winner per dataset and metric is shown in bold. Self-win rates were not computed but are shown as the expected 50% for reference. All Graph RAG conditions outperformed na¨ıve RAG on comprehensiveness and diversity. Conditions C1-C3 also showed slight improvements in answer comprehensiveness and diversity over TS (global text summarization without a graph index).', 'GraphRAG builds upon prior work on advanced RAG strategies. GraphRAG leverages summaries over large sections of the data source as a form of ”self-memory” (described in Cheng et al. 2024), which are later used to answer queries as in Mao et al. 2020). These summaries are generated in parallel and iteratively aggregated into global summaries, similar to prior techniques (Feng et al., 2023; Gao et al., 2023; Khattab et al., 2022; Shao et al., 2023; Su et al., 2020; Trivedi et al., 2022; Wang et al., 2024). In particular, GraphRAG is similar to other approaches that use hierarchical indexing to create summaries (similar to Kim et al. 2023; Sarthi et al. 2024). GraphRAG contrasts with these approaches by generating a graph index from the source data, then applying graph-based community detection to create a thematic partitioning of the data. 2.2 Using Knowledge Graphs with LLMs and RAG', '9.4.4 Prompts for RAG Evaluation The evaluation prompt is illustrated in Figure 6. It introduces a comprehensive evaluation framework for comparing two answers to the same question based on three key criteria: Comprehensiveness, Diversity, and Empowerment. Its purpose is to guide the LLM through the process of selecting the better answer for each criterion, followed by an overall assessment. For each of the three crite- ria, the LLM must identify which answer performs better and provide a rationale for its choice. Ulti- mately, an overall winner is determined based on 10757', 'Figure 6: Prompts for RAG Evaluation assessed by the LLM judge, including comprehen- siveness, diversity, empowerment, and overall qual- ity. Our key observations are as follows: i) Comprehensiveness. Notably, LightRAG covers a broader range of machine learning met- rics, showcasing its comprehensiveness and ability to effectively discover relevant information. This highlights the strength of our graph-based index- ing paradigm, which excels in precise entity and relation extraction as well as LLM profiling. ii) Both Diversity and Empowerment. Further- more, LightRAG not only offers a more diverse array of information but also delivers more empow- ering content. This success is due to LightRAG’s', '4 Evaluation We conduct empirical evaluations on benchmark data to assess the effectiveness of the proposed LightRAG framework by addressing the follow- ing research questions: (RQ1): How does Ligh- • tRAG compare to existing RAG baseline methods in terms of generation performance? (RQ2): • How do dual-level retrieval and graph-based index- ing enhance the generation quality of LightRAG? (RQ3): What are the costs associated with Ligh- • tRAG, as well as its adaptability to data changes?', 'to query our NQ RAG model with each index. RAG answers 70% correctly using the 2016 index for 2016 world leaders and 68% using the 2018 index for 2018 world leaders. Accuracy with mismatched indices is low (12% with the 2018 index and 2016 leaders, 4% with the 2016 index and 2018 leaders). This shows we can update RAG’s world knowledge by simply replacing its non-parametric memory.', 'NQ TQA Embedding /Metric MRR_dev MRR_test MH_dev MH_test MRR_dev MRR_test MH_dev MH_test BART-GST 28.4 25.0 53.2 48.7 17.5 17.6 39.1 39.5 GCN 28.9 27.7 51.1 50.0 20.0 19.4 41.6 41.4 GAT 28.1 27.1 52.3 47.2 19.1 18.9 43.0 41.0 GraphSage 29.8 26.5 52.3 47.2 19.6 18.4 42.9 39.7 GIN 28.4 27.8 50.2 48.5 19.7 18.9 42.2 39.3']","According to the retrieved context, all GraphRAG conditions outperformed the naive RAG baseline on comprehensiveness and diversity.",All evaluated GraphRAG conditions outperformed the naı̈ve RAG baseline on the metrics of comprehensiveness and diversity.,1.0,1.0,1.0
Which three hyperparameters were mostly considered for arrangement in training BERT-based models?,"['According to several studies, the proper arrangement of hyperparameters has a significant impact on the BERT-based model. Based on our reviewed papers, the three most considered hyperparameters for training models were learning rate, batch size, and the type of optimizer. Most of the studies also applied certain types of arrangement for these three hyperparameters. These kinds of arrangements practiced in several studies have provided valuable insight for future works in BERT-based models development and optimization. It is strongly advised to identify the purpose of the models’ development or optimization at hand prior deciding certain type of hyperparameters arrangement in our work. Several factors should be considered when deciding on certain hyperparameter arrangements, including the employed hardware capacity, the size of datasets (corpus), the type of the NLP tasks, and the type of', 'Certain hyperparameters arrangement plays a crucial role in optimizing the training process and the resulting performance of deep learning models like BERT. The proper ar- rangement in setting the hyperparameters can have a notable effect on the training process and the resulting models’ performance on certain tasks. Learning rate, batch size, and the type of optimizer were the three most considered hyperparameters to be properly arranged in BERT-based model training. Understanding the utility and influence of each hyperpa- rameter is critical for achieving optimal results. Table 4 lists various types of various hy- perparameters arrangement applied in past research.', 'RQ 2. What type of hyperparameters were mostly considered to be properly arranged in training the BERT-based models? BERT is a recent modification of a series of neural models that makes extensive use of pre-training and has shown useful in a wide range of NLP tasks, including text classifica- tion and question-answering from datasets. To learn word representations, BERT uses the Transformer architecture, that comprise of several encoder layers. It analyzes sequential input, like words in text, using an attention mechanism. The attention mechanism helps the model better understand the text’s context by allowing it to capture the relationship between far-off words [26]. During the training process, numerous parameter variables are applied to setting the process, resulting in many variances in the outcomes.', 'g rate, batch size, and the type of optimizer were the three most considered hyperparameters to be properly arranged in BERT-based model training. A number of factors should be considered when deciding on certain hyperparameter arrangements, including the employed hardware capacity, the size of datasets (corpus), the type of the NLP tasks, and the type of the intended model to be developed or optimized (i.e. generic-foundational or specific-customized models). Third, different types of metrics are normally employed for particular NLP tasks. The most widely used metrics for text classification were F1-score, accuracy, precision, and sensitiv-', 'Based on an extensive as well as intensive study of a sufficient number of papers which complied with our review protocol, we eventually came up with three conclusions. First, each type of BERT-based model variant conveys task-specific suitability due to their in- herent training history. In order to select appropriate models for particular NLP tasks, three primary concerns should be considered: i) the type of NLP problem to be resolved (i.e. NLP task to be served), ii) the specific domain to be handled (such as financial, med- ical, law/legal or others), and iii) the intended language to be applied (such as English or others). Second, certain types of hyperparameters arrangements is suggested for training the BERT-based models for improving their performance. Learning rate, batch size, and the type of optimizer were the three most considered hyperparameters to be properly arranged in', '4 Training Procedure Analysis This section explores and quantiﬁes which choices are important for successfully pretraining BERT models. We keep the model architecture ﬁxed.7 Speciﬁcally, we begin by training BERT models with the same conﬁguration as BERTBASE (L = 12, H = 768, A = 12, 110M params).', 'mentation of these level of learning rate are [26], [25], [19], [32], [20], [15], [29], [30], [16], [17], [34], [28], [31], [50], [49], [13], [27], [33], [22], [39], and [35]. Most of these studies that apply learning rate levels of 2.00E-05 and 3.00E-05 were perhaps due to the original research on BERT as reported in the paper titled “BERT: Pre-training of Deep Bidirectional Transformers for Language Understanding”, in which the authors mentioned that the optimal hyperparameter values are actually specific to a particular training context, nevertheless several ranges of values are generally work well in all type of tasks. For their study, however, the authors specifically set their learning rate value to 2.00E-05, 3.00E-05, and 5.00E-05.', 'At the final phase of papers selection (evaluation), a thorough review was carried out of all 672 selected papers from previous action. In this phase, each papers were deeply scru- tinized to identify the content that deemed suitable and relevant to answer the proposed research questions. During this phase, we scrutinized each selected papers according to the quality assesment criteria. We especially put more efforts to identify and locate any papers which contain data, description, and explanation regarding the method of develop- ing or optimizing BERT-based models for three frequently demanded NLP tasks (i.e. text classification, question answering, and text summarization). It included the identification of any type of BERT-based model variants and implementation of certain hyperparameters arrangement. In addition, we also identified and located any description and explanation about']","The three hyperparameters that were mostly considered for arrangement in training BERT-based models are:

1. Learning rate
2. Batch size
3. Type of optimizer","The three most considered hyperparameters were the learning rate, batch size, and the type of optimizer.",1.0,1.0,1.0
What are the main limitations of existing RAG systems that LightRAG seeks to address?,"['both the effectiveness and efficiency of RAG systems. To the best of our knowledge, there has been no systematic effort to pursue the optimal implementation of RAG, partic- ularly for the entire RAG workflow.', 'Acknowledgments The authors would like to thank the reviewers for their thoughtful and constructive feedback on this paper, as well as HuggingFace for their help in open-sourcing code to run RAG models. The authors would also like to thank Kyunghyun Cho and Sewon Min for productive discussions and advice. Funding Disclosure EP thanks supports from the NSF Graduate Research Fellowship. PL is supported by the FAIR PhD program. This work was funded by Facebook.', '2.1 RAG Approaches and Systems RAG generally refers to any system where a user query is used to retrieve relevant information from external data sources, whereupon this information is incorporated into the generation of a response to the query by an LLM (or other generative AI model, such as a multi-media model). The query and retrieved records populate a prompt template, which is then passed to the LLM (Ram et al., 2023). RAG is ideal when the total number of records in a data source is too large to include in a single prompt to the LLM, i.e. the amount of text in the data source exceeds the LLM’s context window.', 'In this study, we aim to identify the best practices for RAG through extensive experimentation. Given the infeasibility of testing all possible combinations of these methods, we adopt a three-step approach to identify optimal RAG practices. First, we compare representative methods for each RAG step (or mod- ule) and select up to three of the best-performing methods. Next, we evaluate the impact of each method on the overall RAG performance by testing one method at a time for an individual step, while keeping the other RAG modules unchanged. This allows us to determine the most effective method for each step based on its contribution and interac- tion with other modules during response generation. Once the best method is chosen for a module, it is used in subsequent experiments. Finally, we empirically explore a few promising combinations suitable for different application scenarios where', '4 Evaluation We conduct empirical evaluations on benchmark data to assess the effectiveness of the proposed LightRAG framework by addressing the follow- ing research questions: (RQ1): How does Ligh- • tRAG compare to existing RAG baseline methods in terms of generation performance? (RQ2): • How do dual-level retrieval and graph-based index- ing enhance the generation quality of LightRAG? (RQ3): What are the costs associated with Ligh- • tRAG, as well as its adaptability to data changes?', '3 RAG Workflow In this section, we detail the components of the RAG workflow. For each module, we review com- monly used approaches and select the default and alternative methods for our final pipeline. Section 4 will discuss best practices. Figure 1 presents the workflow and methods for each module. Detailed experimental setups, including datasets, hyperpa- rameters, and results are provided in Appendix A.', '5.1 Best Practices for Implementing RAG According to our experimental findings, we suggest two distinct recipes or practices for implementing RAG systems, each customized to address specific requirements: one focusing on maximizing perfor- mance, and the other on striking a balance between efficiency and efficacy. Best Performance Practice: To achieve the high- est performance, it is recommended to incorporate query classification module, use the “Hybrid with HyDE” method for retrieval, employ monoT5 for reranking, opt for Reverse for repacking, and lever- age Recomp for summarization. This configuration yielded the highest average score of 0.483, albeit with a computationally-intensive process.', 'Several surveys have extensively discussed cur- rent RAG systems, covering aspects like text gener- ation (Cai et al., 2022; Li et al., 2022), integration with LLMs (Gao et al., 2023; Huang and Huang, 2024), multimodal (Zhao et al., 2023a), and AI- generated content (Zhao et al., 2024). While these surveys provide comprehensive overviews of ex- isting RAG methodologies, selecting the appropri- ate algorithm for practical implementation remains challenging. In this paper, we focus on best prac- tices for applying RAG methods, advancing the understanding and application of RAG in LLMs.']",The retrieved context does not contain enough information to answer this question.,"Existing RAG systems rely on flat data representations and lack adequate contextual awareness, leading to fragmented answers that miss complex interdependencies.",1.0,0.0,0.33
What happens to downstream task performance when the NSP loss is removed and sequences are drawn from a single document?,"['• FULL-SENTENCES: Each input is packed with full sentences sampled contiguously from one or more documents, such that the total length is at most 512 tokens. Inputs may cross document boundaries. When we reach the end of one doc- ument, we begin sampling sentences from the next document and add an extra separator token between documents. We remove the NSP loss. • DOC-SENTENCES: Inputs are constructed sim- ilarly to FULL-SENTENCES, except that they may not cross document boundaries. Inputs sampled near the end of a document may be shorter than 512 tokens, so we dynamically in- crease the batch size in these cases to achieve a similar number of total tokens as FULL- SENTENCES. We remove the NSP loss.', '4.2 Model Input Format and Next Sentence Prediction In the original BERT pretraining procedure, the model observes two concatenated document seg- ments, which are either sampled contiguously from the same document (with p = 0.5) or from distinct documents. In addition to the masked lan- guage modeling objective, the model is trained to predict whether the observed document segments come from the same or distinct documents via an auxiliary Next Sentence Prediction (NSP) loss. The NSP loss was hypothesized to be an impor- tant factor in training the original BERT model. Devlin et al. (2019) observe that removing NSP hurts performance, with signiﬁcant performance degradation on QNLI, MNLI, and SQuAD 1.1. However, some recent work has questioned the necessity of the NSP loss (Lample and Conneau, 2019; Yang et al., 2019; Joshi et al., 2019).', 'Results Table 2 shows results for the four dif- ferent settings. We ﬁrst compare the original SEGMENT-PAIR input format from Devlin et al. (2019) to the SENTENCE-PAIR format; both for- mats retain the NSP loss, but the latter uses sin- gle sentences. We ﬁnd that using individual sentences hurts performance on downstream tasks, which we hypothesize is because the model is not able to learn long-range dependencies. We next compare training without the NSP loss and training with blocks of text from a sin- gle document (DOC-SENTENCES). We ﬁnd that this setting outperforms the originally published BERTBASE results and that removing the NSP loss matches or slightly improves downstream task performance, in contrast to Devlin et al. (2019). It is possible that the original BERT implementa- tion may only have removed the loss term while still retaining the SEGMENT-PAIR input format.', 'During the BERT training process, the importance of the second training task, that is, the next sentence prediction (NSP), was revealed. The authors of [16] note that removing this loss function from training significantly reduces performance. However, more recent studies [27,34,87] question the need for NSP inclusion. Several training options for this task were tested to address this issue. First, the original method of two segments, each of which could contain several sentences of the original text, but both together do not exceed 512 tokens in length. Second, the use of a pair of complete sentences selected either sequentially from one text, or different texts in the corpus. Thirdly, training without NSP, when whole related sentences from one or several documents are submitted for input. And fourthly, the same thing, but with the prohibition of sentences from several documents. The', 'Model SQuAD 1.1/2.0 MNLI-m SST-2 RACE Our reimplementation (with NSP loss): SEGMENT-PAIR 90.4/78.7 84.0 92.9 64.2 SENTENCE-PAIR 88.7/76.2 82.9 92.1 63.0 Our reimplementation (without NSP loss): FULL-SENTENCES 90.4/79.1 84.7 92.5 64.8 DOC-SENTENCES 90.6/79.7 84.7 92.7 65.6 88.5/76.3 84.3 92.8 64.3 —/81.3 85.8 92.7 66.1 —/81.0 85.6 934 66.7', 'Next Sentence Prediction (NSP) NSP is a bi- nary classiﬁcation loss for predicting whether two segments follow each other in the original text. Positive examples are created by taking consecu- tive sentences from the text corpus. Negative ex- amples are created by pairing segments from dif- ferent documents. Positive and negative examples are sampled with equal probability. The NSP objective was designed to improve performance on downstream tasks, such as Natural Language Inference (Bowman et al., 2015), which require reasoning about the relationships between pairs of sentences.', 'Source: [43] When testing the training, it was concluded that removing the NSP function improves performance on subsequent tasks, which directly contradicts the original publication. Also, using sentences instead of segments degrades performance, presumably by removing the ability to make long-term generalizations. Initially, BERT was trained in 1 million steps in bursts of 256 sequences. This is computationally equivalent to training in 30 thousand steps but large packets of 8 thousand sequences. There are studies by M. Ott et al. [59]showing that language models can benefit from an increase in the size of the training packet, provided the learning rate is increased accordingly. Research [43] shows that this effect also takes place for BERT, but to a limited extent; the highest performance is achieved with a packet size of about 2 thousand sequences.', 'To better understand this discrepancy, we com- pare several alternative training formats: • SEGMENT-PAIR+NSP: This follows the original input format used in BERT(Devlin et al., 2019), with the NSP loss. Each input has a pair of seg- ments, which can each contain multiple natural sentences, but the total combined length must be less than 512 tokens.']","When the NSP loss is removed and sequences are drawn from a single document (DOC-SENTENCES), downstream task performance improves or matches the original BERTBASE results, and in some cases, it even slightly improves downstream task performance.","Removing the NSP loss under these conditions either matches or slightly improves downstream performance, which contrasts with the original BERT findings.",0.6666666666666666,0.6,0.55
"What is the title of the 2020 paper published by Iz Beltagy, Matthew E. Peters, and Arman Cohan?","['Published as a conference paper at ICLR 2023', 'position at Brandon University, Brandon, MB, Canada, where he is currently active in various professional and scholarly activities. He was promoted to the rank of an Associate Professor, in 2018. He, as he is popularly known, is active in research in the field of data mining and big data. In his eighth-year academic career, he has published a total of 50 papers in high-impactconferencesinmanycountriesandhigh-statusjournals(SCIand SCIE). He has delivered invited guest lectures on big data, cloud computing, the Internet of Things, and cryptography at many Taiwanese and Czech universities. He received the Best Oral Presenter Award in FSDM 2017, which was held at National Dong Hwa University (NDHU), Shoufeng, Taiwan, in 2017. He is an editor of several international scientific research journals. He currently has active research projects with other academics in Taiwan, Singapore, Canada,', '4.4 Fact Veriﬁcation Table 2 shows our results on FEVER. For 3-way classiﬁcation, RAG scores are within 4.3% of state-of-the-art models, which are complex pipeline systems with domain-speciﬁc architectures and substantial engineering, trained using intermediate retrieval supervision, which RAG does not require. 6 Document 1: his works are considered classics of American literature ... His wartime experiences formed the basis for his novel ”A Farewell to Arms” (1929) ... Document 2: ... artists of the 1920s ”Lost Generation” expatriate community. His debut novel, ”The Sun Also Rises”, was published in 1926. Doc 1 Doc 2 Doc 3 Doc 4 Doc 5 BOS” The Sun AlsoR ises” is a novelby this authorof ” A Fare welto Arms”', 'ork.com/index.html). Moreover, he has been a member of the Advisory Board at Symbiosis Institute of Digital and Telecom Management and other reputed universities, since 2022. He is an editorial board member in several Springer and Hindawi journals. He served as a Committee Member for ‘‘Smart Village Project’’-Government of Gujarat, at the district level, in 2017. In 2017, he was awarded with Prestigious Pedagogical Innovation Award by Gujarat Technological University. He was ranked among the top 2% scientists around the world in 2021, 2022, and 2023. He has more than 4100 Google Scholar citations with an H-index of 35. He is recognized among the top 2% scientists in the world as per the survey conducted by Elsevier in the last three years.', 'l. Next, we reviewed the abstracts of the remaining articles to determine their contributions. In the final step of our literature review, we extracted the necessary data for our analysis. By following these phases, we ensured thatourstudywasbasedonhigh-qualityandcrediblesources.', '1. Claims Question: Do the main claims made in the abstract and introduction accurately reﬂect the paper’s contributions and scope? Answer: [Yes] Justiﬁcation: The main claims made in the abstract and introduction accurately reﬂect the paper’s contributions and scope. Guidelines: • The answer NA means that the abstract and introduction do not include the claims made in the paper. • The abstract and/or introduction should clearly state the claims made, including the contributions made in the paper and important assumptions and limitations. A No or NA answer to this question will not be perceived well by the reviewers. • The claims made should match theoretical and experimental results, and reﬂect how much the results can be expected to generalize to other settings.', '• It is ﬁne to include aspirational goals as motivation as long as it is clear that these goals are not attained by the paper.', 'theDepartmentofElectricalandComputerEngineering,LebaneseAmerican University, Byblos, Lebanon, and the Center of Research Impact and Outcome, Chitkara University, Punjab, India. He has more than 14 years of experience in teaching. He has more than 150 international/national publications in reputed journals and conferences. His research interests include machine learning, the Internet of Things, deep neural networks, blockchain, and computer vision. He is an editor of several publishers, such as Springer, Hindawi, Plosone, Scientific Reports (Nature), and Wiley. He also acted as a guest editor in several reputed publishers, such as IEEE, Elsevier, Springer, Hindawi, and MDPI. He was recently recognized as one among the top 2% scientists in the world as per the survey conducted by Elsevier, in 2021. VOLUME 12, 2024 54649']",The retrieved context does not contain enough information to answer this question.,The title of their 2020 paper is 'Longformer: The Long-Document transformer'.,0.0,0.0,0.0
What transformations are applied to the output of each sub-layer in the encoder and decoder before moving to the next block?,"['Decoder: The decoder is also composed of a stack of N = 6 identical layers. In addition to the two sub-layers in each encoder layer, the decoder inserts a third sub-layer, which performs multi-head attention over the output of the encoder stack. Similar to the encoder, we employ residual connections around each of the sub-layers, followed by layer normalization. We also modify the self-attention sub-layer in the decoder stack to prevent positions from attending to subsequent positions. This masking, combined with fact that the output embeddings are offset by one position, ensures that the predictions for position i can depend only on the known outputs at positions less than i.', '3.1 Encoder and Decoder Stacks Encoder: The encoder is composed of a stack of N = 6 identical layers. Each layer has two sub-layers. The ﬁrst is a multi-head self-attention mechanism, and the second is a simple, position- 2 Qutput Probabilities Multi-Head Feed Attention Forward } ) Nx Nx Masked Multi-Head Multi-Head Attention Attention 1 1 Positional Positional Encoding Q @ Encoding Q Input [ coi Embedding Inputs Outputs (shifted right) Figure 1: The Transformer - model architecture.', '3.3 Position-wise Feed-Forward Networks In addition to attention sub-layers, each of the layers in our encoder and decoder contains a fully connected feed-forward network, which is applied to each position separately and identically. This consists of two linear transformations with a ReLU activation in between. FFN(x) = max(0,xW1 + b1)W2 + b2 (2) While the linear transformations are the same across different positions, they use different parameters from layer to layer. Another way of describing this is as two convolutions with kernel size 1. The dimensionality of input and output is dmodel = 512, and the inner-layer has dimensionality dff = 2048.', '3 Model Architecture Most competitive neural sequence transduction models have an encoder-decoder structure [5, 2, 29]. Here, the encoder maps an input sequence of symbol representations (x1,...,xn) to a sequence of continuous representations z = (z1,...,zn). Given z, the decoder then generates an output sequence (y1,...,ym) of symbols one element at a time. At each step the model is auto-regressive [9], consuming the previously generated symbols as additional input when generating the next. The Transformer follows this overall architecture using stacked self-attention and point-wise, fully connected layers for both the encoder and decoder, shown in the left and right halves of Figure 1, respectively.', '3.2.3 Applications of Attention in our Model The Transformer uses multi-head attention in three different ways: • In ""encoder-decoder attention"" layers, the queries come from the previous decoder layer, and the memory keys and values come from the output of the encoder. This allows every position in the decoder to attend over all positions in the input sequence. This mimics the typical encoder-decoder attention mechanisms in sequence-to-sequence models such as [31, 2, 8]. • The encoder contains self-attention layers. In a self-attention layer all of the keys, values and queries come from the same place, in this case, the output of the previous layer in the encoder. Each position in the encoder can attend to all positions in the previous layer of the encoder.', 'Effect of reversible layers. In the two plots on the right in Figure 3, we compare a regular Trans- former per Vaswani et al. (2017) with the reversible one describe in Section 3. The two models have identical parameter counts, and the learning curves likewise appear to be nearly the same. These results show that the memory savings in the reversible Transformer do not come at the expense of accuracy. Reversible layers in machine translation. We also evaluate reversible layers in the context of an encoder-decoder Transformer model for machine translation from English to German. We start by making both the encoder and the decoder fully reversible in the Transformer-base architecture, and 2https://github.com/google/trax/tree/master/trax/models/reformer', 'Probabiliies Output ! Softmax ) Add & Norm 1 Feed Forward Add & Norm Add & Norm | Feed ) Multi-Head Forward Atention [y 4 Add & Norm Add & Norm I | Masked Multi ] Multi-Head Attention Attention Head Positional Encoding Positional Encoding 1 i In put — ts Outputs FIGURE 3. Transformer architecture.', 'where l = 1,2,··· ,L is the index of the l-th block, and L is the total number of stacked blocks. The input of the ﬁrst block Y i 0 is just Y i in Eq. 5. All word embeddings in the image after transformation l ,Y 2 are Yl = [Y 1 l ,··· ,Y n l ]. This can be viewed as an inner transformer block, denoted as Tin. This process builds the relationships among visual words by computing interactions between any two visual words. For example, in a patch of human face, a word corresponding to the eye is more related to other words of eyes while interacts less with forehead part.']","The output of each sub-layer in the encoder and decoder is first passed through a residual connection, followed by layer normalization.","A residual connection is added to the sub-layer's output, which is then followed by layer normalization.",1.0,0.5,0.67
"What are the two primary components used to process the ""sentences"" and ""words"" in the TNT architecture?","['Z\' = Z1 + MSA(LN(Z_1)), ® 2, = Z\' + MLP(LN(Z""))). 10) This outer transformer block Tout is used for modeling relationships among sentence embeddings. In summary, the inputs and outputs of the TNT block include the visual word embeddings and sentence embeddings as shown in Fig. 1(b), so the TNT can be formulated as Yl,Zl = TNT(Yl−1,Zl−1). (11) In our TNT block, the inner transformer block is used to model the relationship between visual words for local feature extraction, and the outer transformer block captures the intrinsic information from the sequence of sentences. By stacking the TNT blocks for L times, we build the transformer- in-transformer network. Finally, the classiﬁcation token serves as the image representation and a fully-connected layer is applied for classiﬁcation.', 'Y i = [yi,1,yi,2,··· ,yi,m], yi,j = FC(Vec(xi,j)), (5) where yi,j ∈ Rc is the j-th word embedding, c is the dimension of word embedding, and Vec(·) is the vectorization operation. In TNT, we have two data ﬂows in which one ﬂow operates across the visual sentences and the other processes the visual words inside each sentence. For the word embeddings, we utilize a transformer block to explore the relation between visual words: Y =Y + MSA(LN(Y , ©) Y =Y’} + MLP(LN(Y})). O] 3', 'ts, including the employed hardware capacity, the size of datasets (corpus), the type of the NLP tasks, and the type of the intended model to be developed or optimized (i.e. generic-foundational or specific-customized models).', 'Position encoding Model Sentence-level Word-level Top-1 X X 80.5 TNT-S v X 80.8 X v 80.7 v v 81.5', 'ollection, which demonstrates the effectiveness of our approach and sheds light on the different characteristics of the semantic approach, the lexical approach, and their combination.', 'sification. The transformer architecture used in GPT is a significant advancement over previous approaches to NLP, such as RNN and CNN. It uses a self-attention mechanism to allow the model to consider the context of the entire sentence when generating the next word, which improved the model’s ability to understand and generate language. The decoder is responsible for generating the output text based on the input representation [3].', '1 PR T A B0 WL RN R e T R Y 0 R R O = 5 P O o % -12 Figure 4: Visualization of the averaged word embeddings of TNT-S. - I [ | y Figure 5: Attention maps of different queries in the inner transformer. Red cross symbol denotes the query location. 3.5 Transfer Learning To demonstrate the strong generalization ability of TNT, we transfer TNT-S, TNT-B models trained on ImageNet to the downstream tasks.', '● ranking the importance of words. The practice of using modern textual models shows that only some words serve as indicative factors in the operation of models, which is consistent with the studies of BERT T. Niven and H. Kao [56], which show the importance of the attention mechanism. Note that this step is trivial under the condition of the white box model and is reduced to calculating the gradient of the model output when changing individual words. ● transformation of words. In this step, words with the identified high importance for the model are replaced. The replacement must satisfy three conditions: have similar semantic meaning, be syntactically appropriate to the original context, and cause the model to mispredict. At this stage, several sub-stages can be distinguished:']","The two primary components used to process the ""sentences"" and ""words"" in the TNT architecture are:

1. The inner transformer block, which models the relationship between visual words for local feature extraction.
2. The outer transformer block, which captures the intrinsic information from the sequence of sentences.","The architecture uses a conventional (outer) transformer block for extracting features and attentions of visual sentences, and embeds a sub-transformer (inner) block for excavating features of visual words.",1.0,0.8571428571428571,0.67
What were the characteristics of the News articles dataset utilized in the evaluation?,"['• BOOKCORPUS (Zhu et al., 2015) plus English WIKIPEDIA. This is the original data used to train BERT. (16GB). • CC-NEWS, which we collected from the En- glish portion of the CommonCrawl News dataset (Nagel, 2016). The data contains 63 million English news articles crawled between September 2016 and February 2019. (76GB af- ter ﬁltering).4 • OPENWEBTEXT (Gokaslan and Cohen, 2019), an open-source recreation of the WebText cor- 4We use news-please (Hamborg et al., 2017) to col- lect and extract CC-NEWS. CC-NEWS is similar to the RE- ALNEWS dataset described in Zellers et al. (2019). pus described in Radford et al. (2019). The text is web content extracted from URLs shared on Reddit with at least three upvotes. (38GB). • STORIES, a dataset introduced in Trinh and Le (2018) containing a subset of CommonCrawl data ﬁltered to match the story-like style of Winograd schemas. (31GB).', 'On the other hand, different domain data sets have been used to evaluate the models; these range from review data for sentiment analysis tasks to transcripts and news for more traditional tasks, such as part of speech tagging. News data are the most common domain, presumably because they are easier to retrieve, and because their more formal register makes them more suited for tasks such as part of speech tagging, dependency parsing, and named entity recognition. Similarly, social media posts from Twitter are mostly used in tasks like sentiment analysis and identiﬁcation of offensive language.', 'A series of activities to search, collect, select (evaluate), analyze, synthesize, extract, and summarize papers from the publicly available publications following the defined re- view protocol was performed during this phase. Firstly, papers were searched based on the defined keywords (i.e. text classification, question answer, and text summarization) and the first three inclusion criteria (i.e. the publication range were between 2019-2024, the papers were indexed by Scopus and/or Google Scholar, and the papers were pub- lished either in journals or proceedings) from the publicly available publications. Secondly, the collected papers were selected (evaluated) based on the fourth inclusion criteria (i.e. to inspect whether the papers’ theme is regarding NLP tasks which employ BERT-based models). Thirdly, the selected papers were further examined to identify the content that was deemed', '19 D Example Answer Comparison Table 5: Example question, answers, and LLM-generated assessments for the News article dataset.', 'RQ 3. What type of evaluation metrics were normally employed for particular NLP tasks?', '5.1 Experiment 1 The indexing process resulted in a graph consisting of 8,564 nodes and 20,691 edges for the Podcast dataset, and a larger graph of 15,754 nodes and 19,520 edges for the News dataset. Table 2 shows the number of community summaries at different levels of each graph community hierarchy. Global approaches vs. vector RAG. As shown in Figure 2 and Table 6, global approaches signifi- cantly outperformed conventional vector RAG (SS) in both comprehensiveness and diversity criteria across datasets. Specifically, global approaches achieved comprehensiveness win rates between 72- 83% (p<.001) for Podcast transcripts and 72-80% (p<.001) for News articles, while diversity win rates ranged from 75-82% (p<.001) and 62-71% (p<.01) respectively. Our use of directness as a validity test confirmed that vector RAG produces the most direct responses across all comparisons.', 'As we can see from Table 4, Wikipedia and Web are two major resources for creating these datasets. Among these datasets, MS MARCO dataset [185] contains a large amount of queries with annotated relevant passages in Web documents, and NQ [116] dataset contains Google search queries and documents with paragraphs and answer spans from the top-ranked Wikipedia pages. Among these datasets, MS MARCO and NQ datasets have been widely used for evaluating dense retrieval models. A recent study [48] has summarized the promotion effect of MS MARCO on the progress of dense retrieval: Neural models can explore large-scale data for training. Besides, based on MS MARCO, several variants have been created to enrich the evaluation characteristics on somespecificaspect,e.g.,themultilingualversionmMARCO[18]andtheMSMARCOChameleons dataset [3] (consisting of obstinate queries that are difficult to answer by', 'Dataset Example activity framing and generation of global sensemaking questions News articles User: Educator incorporating current affairs into curricula Task: Teaching about health and wellness Questions: 1. What current topics in health can be integrated into health education curricula? 2. How do news articles address the concepts of preventive medicine and wellness? 3. Are there examples of health articles that contradict each other, and if so, why? 4. What insights can be gleaned about public health priorities based on news coverage? 5. How can educators use the dataset to highlight the importance of health literacy?']","The News articles dataset utilized in the evaluation was collected from the English portion of the CommonCrawl News dataset (Nagel, 2016), containing 63 million English news articles crawled between September 2016 and February 2019. The dataset was filtered and extracted using the news-please tool (Hamborg et al., 2017), resulting in a dataset of 76GB in size.","The dataset consisted of news articles from September 2013 to December 2023 across various categories, totaling roughly 1.7 million tokens divided into 3197 chunks.",0.0,1.0,0.0
How does G-RAG formulate the initial document embeddings used as node features in the graph neural network?,"['7 different GNN models. Please refer to Appendix B for details. G-RAG: The initial node features are based on document text and AMR information as described in (2). The rest of the setting is the same as GCN. G-RAG-RL: Using the ranking loss function and keep the other setting the same as G-RAG.', '3.2.3 Representation Update Based on the above initial node and edge representations, we arrive at updating representations in the graph neural networks. Given a document graph G(V,E) with |V| = n, the input feature of node v ∈ Rd, and the initial representation of the edge between node v and u is given v ∈ V is denoted as x0 uv ∈ Rl with l = 2. Let N(v) denote the neighbor nodes of the node v ∈ V. The representation by e0 of node v ∈ V at layer ℓ can be derived from a GNN model given by: 1 —1 g | fx » uv ueN (v) where f, | and g are functions for computing feature, aggregating data, and updating node repre- sentations, respectively. Specifically, the function f applies different dimensional edge features as weights to the node features, given by', 'based on AMRs {Gqp1,··· ,Gqpn}. For each node vi ∈ V, it corresponds to the document pi. For vi,vj ∈ V, i ̸= j, if the corresponding AMR Gqpi and Gqpj have common nodes, there will be an undirected edge between vi and vj (with a slight abuse in notation) denoted as eij = (vi,vj) ∈ E. We remove isolated nodes in Gq. In the following, we will construct the graph neural networks based on the document graphs to predict whether the document is relevant to the question. Please refer to Appendix A for AMR graph statistics, i.e., the number of nodes and edges in AMR graphs, of the common datasets in ODQA.', 'on-document pairs. MLP: The initial node features are only based on document text as described in (1) with the BERT [6] encoder. After the node features go through MLP, we get the relevant scores via (8) and take the cross-entropy function (9) as training loss. GCN: Besides updating node representations via GCN, the rest setting is the same as MLP. We also conduct experiments with', 'ighlight the advantages of the proposed G-RAG over state-of-the-art benchmarks, we conducted experiments across various embedding models with fine-tuning parameter in the next section.', 'We compare our proposed algorithm with baselines as follows with fixed hyper-parameters and no fine-tuning, where the hidden dimension is 8, the dropout rate is 0.1, and the learning rate is 1e-4. w/o reranker: Without an additional reranker, the ranking score is based on the retrieval scores provided by DPR [16]. BART: The pre-trained language model BART [19] serves as the reranker. BART-GST: This method integrates graph-as-token into the pre-trained model [42]. For each dataset, we use the best performance provided in the paper. RGCN-S[42] stacks the RGCN model on the top of the transformer. Even though this method is based on graph neural networks, it doesn’t rely on the document graphs, but construct nodes in the graph model based on the text alignment in question-document pairs. MLP: The initial node features are only based on document text as described in (1) with the BERT [6]', '3.2 Graph Neural Networks for Reranking Following Section 3.1, we construct a graph among the n = 100 retrieved documents denoted as Gq given the question q. We aim to exploit both the structural information and the AMR semantic information to rerank the retrieved documents. To integrate the semantic information of documents, the pre-trained language models such as BERT [6], and RoBERTa [23] are powerful tools to encode the document texts as node features in graph neural networks. Even though Wang et al. [42] integrate AMR information into LMs, it increases computational time and GPU memory usage. To address this, we proposed node and edge features for graph neural networks, which simultaneously exploit the structural and the semantic information of AMR but avoid adding redundant information.', '5.2 Large Language Model for Graphs Graphs have become a powerful framework for rep- resenting complex relationships, with applications across fields. As large language models (LLMs) evolve, researchers aim to enhance their ability to interpret graph-structured data. This work falls into three broad categories: i) GNNs as Prefix - using GNNs to generate structure-aware tokens for LLMs, e.g., GraphGPT (Tang et al., 2024) and LLaGA (Chen et al., 2024). ii) LLMs as Prefix - leveraging LLMs to process graph data with text, producing embeddings/labels to refine GNN train- ing, like GALM (Xie et al., 2023) and OFA (Liu et al., 2024). iii) LLMs-Graphs Integration - achieving seamless interaction, using techniques, , fusion training, GNN alignment, and LLM-based agents for direct graph handling, e.g., Grenade (Li et al., 2023) and Congrat (Brannon et al., 2023).']","The initial node features in G-RAG are based on document text and AMR (Abstract Meaning Representation) information. Specifically, the document text is encoded using the BERT encoder, and the AMR information is used to construct the graph structure among the nodes.",The embedding for each document node is created by encoding the concatenation of the document's text and a sequence of words that represents the document's AMR information.,1.0,0.5,0.5
What strategy was used in the evaluation phase to quantify the quality of the generated RAG answers?,"['9.4.4 Prompts for RAG Evaluation The evaluation prompt is illustrated in Figure 6. It introduces a comprehensive evaluation framework for comparing two answers to the same question based on three key criteria: Comprehensiveness, Diversity, and Empowerment. Its purpose is to guide the LLM through the process of selecting the better answer for each criterion, followed by an overall assessment. For each of the three crite- ria, the LLM must identify which answer performs better and provide a rationale for its choice. Ulti- mately, an overall winner is determined based on 10757', '4.3 Jeopardy Question Generation Table 2 shows that RAG-Token performs better than RAG-Sequence on Jeopardy question generation, with both models outperforming BART on Q-BLEU-1. Table 4 shows human evaluation results, over 452 pairs of generations from BART and RAG-Token. Evaluators indicated that BART was more factual than RAG in only 7.1% of cases, while RAG was more factual in 42.7% of cases, and both RAG and BART were factual in a further 17% of cases, clearly demonstrating the effectiveness of RAG on the task over a state-of-the-art generation model. Evaluators also ﬁnd RAG generations to be more speciﬁc by a large margin. Table 3 shows typical generations from each model.', 'to more effective marginalization over documents. Furthermore, RAG can generate correct answers even when the correct answer is not in any retrieved document, achieving 11.8% accuracy in such cases for NQ, where an extractive model would score 0%.', 'In this study, we aim to identify the best practices for RAG through extensive experimentation. Given the infeasibility of testing all possible combinations of these methods, we adopt a three-step approach to identify optimal RAG practices. First, we compare representative methods for each RAG step (or mod- ule) and select up to three of the best-performing methods. Next, we evaluate the impact of each method on the overall RAG performance by testing one method at a time for an individual step, while keeping the other RAG modules unchanged. This allows us to determine the most effective method for each step based on its contribution and interac- tion with other modules during response generation. Once the best method is chosen for a module, it is used in subsequent experiments. Finally, we empirically explore a few promising combinations suitable for different application scenarios where', '4.2 Abstractive Question Answering As shown in Table 2, RAG-Sequence outperforms BART on Open MS-MARCO NLG by 2.6 Bleu points and 2.6 Rouge-L points. RAG approaches state-of-the-art model performance, which is impressive given that (i) those models access gold passages with speciﬁc information required to generate the reference answer, (ii) many questions are unanswerable without the gold passages, and (iii) not all questions are answerable from Wikipedia alone. Table 3 shows some generated answers from our models. Qualitatively, we ﬁnd that RAG models hallucinate less and generate factually correct text more often than BART. Later, we also show that RAG generations are more diverse than BART generations (see §4.5).', 'To assess RAG capabilities, we evenly collect a total of 500 entries from NQ, TriviaQA, HotPotQA, 2WikiMultiHopQA and MuSiQue. Each entry is a ""question, gold document, gold answer"" triple. Metrics We use token-level F1 score and EM score for Open-Domain QA and MultiHop QA tasks, and accuracy for others. We use a more lenient EM score, which evaluates performance based on whether the model generations include gold answers instead of strictly exact matching (Asai et al., 2023).', '2.4 RAG evaluation criteria Our evaluation relies on the LLM to evaluate how well the RAG system answers the generated ques- tions. Prior work has shown LLMs to be good evaluators of natural language generation, includ- ing work where LLMs evaluations were competitive with human evaluations (Wang et al., 2023a; Zheng et al., 2024). Some prior work proposes criteria for having LLMs quantify the quality of 3 Source Documents Global Answer text extraction query-focused and chunking summarization Text Chunks Community Answers domain-tailored query-focused summarization summarization Entities & Relationships Community Summaries domain-tailored domain-tailored summarization community summarization Knowledge Graph detection Graph Communities Indexing Time Pipeline Stage Query Time', '5.1 Best Practices for Implementing RAG According to our experimental findings, we suggest two distinct recipes or practices for implementing RAG systems, each customized to address specific requirements: one focusing on maximizing perfor- mance, and the other on striking a balance between efficiency and efficacy. Best Performance Practice: To achieve the high- est performance, it is recommended to incorporate query classification module, use the “Hybrid with HyDE” method for retrieval, employ monoT5 for reranking, opt for Reverse for repacking, and lever- age Recomp for summarization. This configuration yielded the highest average score of 0.483, albeit with a computationally-intensive process.']","The evaluation phase used a comprehensive evaluation framework for comparing two answers to the same question based on three key criteria: Comprehensiveness, Diversity, and Empowerment. The framework guides the LLM through the process of selecting the better answer for each criterion, followed by an overall assessment. For each criterion, the LLM must identify which answer performs better and provide a rationale for its choice.","The researchers utilized Large Language Models (LLMs) to evaluate the quality of the answers, as prior studies have demonstrated their effectiveness in evaluating natural language generation.",1.0,1.0,0.0
What tokenizer is used to encode the validation set during perplexity calculation?,"['A.2.1 EVALUATION For language generation experiments, we calculate the perplexity, in standard fashion like Radford et al. (2019), as follows: First, the entire validation set is concatenated using two linebreaks as separators and encoded using the default HuggingFace tokenizer of each model. Next, the sequence is split into non-overlapping segments of width 2048, the full context size of our models. These are sent through the model to collect the log-probabilities corresponding to the next token each. Their exponentiated average is the ﬁnal perplexity we report. For zero-shot tasks we follow the EleutherAI evaluation harness3 in terms of data preprocessing and ﬁnal score calculation. We note that we evaluate all individual samples separately and thus do not apply any padding.', 'Tokenizers A critical NLP-speciﬁc aspect of the library is the implementations of the tokenizers nec- essary to use each model. Tokenizer classes (each inheriting from a common base class) can either be instantiated from a corresponding pretrained model or can be conﬁgured manually. These classes store the vocabulary token-to-index map for their corre- sponding model and handle the encoding and de- coding of input sequences according to a model’s speciﬁc tokenization process. The tokenizers im- plemented are shown in Figure 2 (Right). Users can easily modify tokenizer with interfaces to add additional token mappings, special tokens (such as classiﬁcation or separation tokens), or otherwise resize the vocabulary.', 'Tokenizers Name Ex. Uses Character-Level BPE NMT, GPT Byte-Level BPE GPT-2 WordPiece BERT SentencePiece XLNet Unigram LM Character Reformer Custom Bio-Chem', 'Tokenizers can also implement additional useful features for the users. These range from token type indices in the case of sequence classiﬁcation to maximum length sequence truncating taking into account the added model-speciﬁc special tokens (most pretrained Transformer models have a maxi- mum sequence length). For training on very large datasets, Python-based tokenization is often undesirably slow. In the most recent release, Transformers switched its im- plementation to use a highly-optimized tokeniza- tion library by default. This low-level library, available at https://github.com/huggingface/ tokenizers, is written in Rust to speed up the tokenization procedure both during training and deployment.', 'Document Encoder. Our document encoder has a very similar architecture. We first segment a document 𝑑 into its constituent tokens𝑑1𝑑2...𝑑𝑚,towhichweprependBERT’sstarttoken[CLS]fol- lowed by our special token [D] that indicates a document sequence. Unlike queries, we do not append [mask] tokens to documents. Af- ter passing this input sequence through BERT and the subsequent linear layer, the document encoder filters out the embeddings corre- sponding to punctuation symbols, determined via a pre-defined list. This filtering is meant to reduce the number of embeddings per doc- ument, as we hypothesize that (even contextualized) embeddings of punctuation are unnecessary for effectiveness. In summary, given 𝑞 = 𝑞0𝑞1...𝑞𝑙 and 𝑑 = 𝑑0𝑑1...𝑑𝑛, we compute the bags of embeddings 𝐸𝑞 and 𝐸𝑑 in the following manner, where # refers to the [mask] tokens:', '3.2.1 Cross-encoder Architecture. As a direct application of PLMs, cross-encoder considers a query-text pair as an entire “sentence.” To be specific, the input of cross-encoder is the concatena- tion of a query and a text, separated by a special symbol “[SEP].” To obtain the overall represen- tation, another symbol “[CLS]” is inserted at the beginning of the concatenated sentence. Then, the query-text sequence is fed into a PLM for modeling the semantic interaction between any two tokens of the input sequence. After the representations for each token in the sequence have been learned, we can obtain the match representation for this query-text pair. A commonly used way is to take the “[CLS]” representation as the semantic matching representation [203]. Other variants can be also used, e.g., averaging token embeddings [215]. Such an architecture is similar to interaction-based architecture', '8 Table 3: Variations on the Transformer architecture. Unlisted values are identical to those of the base model. All metrics are on the English-to-German translation development set, newstest2013. Listed perplexities are per-wordpiece, according to our byte-pair encoding, and should not be compared to per-word perplexities.', 'be also used, e.g., averaging token embeddings [215]. Such an architecture is similar to interaction-based architecture in the pre-BERT studies [75, 288], since it allows the tokens to']",The default HuggingFace tokenizer of each model is used to encode the validation set during perplexity calculation.,The validation set is encoded using the default HuggingFace tokenizer specific to each model.,1.0,1.0,0.67
What is the objective of the KL-divergence loss in soft-label distillation?,"['LKD M−MSE = MSE r (t) q,d+ −r (t) q,d−,r (s) q,d+ −r (s) q,d− . (10) To examine the effectiveness of different distillation functions, Izacard et al. [102] perform an empirical comparison of the above loss functions, and they find that the KL-divergence loss leads to a better distillation performance than MSE loss and max-margin loss for the task of question answering. Further, the researchers empirically find that the Margin-MSE loss is more effective than the other options [89, 92], e.g., pointwise MSE loss.', 'Soft-label distillation. Instead of using hard labels, we can also approximate the outputs of the teacher network by tuning the student network. Formally, let r (t) q,d and r (s) q,d denote the relevance scores of textd w.r.t. to query q assigned by the teacher network and the student network, respec- tively. Next, we introduce several distillation functions. — MSE loss. This function directly minimizes the difference between the relevance scores be- tween the teacher and student using mean-squared error loss: MSE = 1 r (t) −r (s) LKD q,d q,d 2 q∈Q d∈D 2 , (7) where Q and D denote the sets of queries and texts, respectively. — KL-divergence loss. This function first normalizes the relevance scores of candidate docu- ments into probability distributions by queries, denoted by ˜r (t) q,d and ˜r (s) q,d, respectively, and then reduces their KL-divergence loss:', 'Model BM25 Technique MRR@10 18.7 (0 BM25 RocketQAv2 (4a) soft-label distillation (bs = 96) 36.5 (4b) soft-label distillation + joint retriever-reranker training (7 hard negs) (bs = 96) 36.5 (4c) soft-label distillation + joint retriever-reranker training (31 hard negs) (bs = 96) 37.3 (4d) soft-label distillation + joint retriever-reranker training (63 hard negs) (bs = 96) 38.1 (4e) soft-label distillation + joint retriever-reranker training (127 hard negs) (bs = 96) 38.3', 'namic listwise distillation mechanism: both the retriever (student) and the reranker (teacher) are mutually updated and improved. Based on the KL-divergence loss (Equation (8)), the teacher model is also able to be adjusted according to the student model, yielding a better distillation performance.', 'Distillation for the student network. After training the teacher network, we utilize it to im- prove the student network. The basic idea is to run the well-trained teacher network on the unla- beled (or even labeled) data to produce pseudo relevance labels for training the student network. According to the types of the derived labels, we can categorize the distillation approaches into two major categories, namely, hard-label and soft-label distillation.', 'teacher for an additional term in the loss (knowledge distillation). In this setting, there are thus two successive steps of distillation, one during the pre-training phase and one during the adaptation phase. In this case, we were able to reach interesting performances given the size of the model: 79.8 F1 and 70.4 EM, i.e. within 3 points of the full model.', 'The ﬁnal training objective is a linear combination of the distillation loss Lce with the supervised training loss, in our case the masked language modeling loss Lmlm [Devlin et al., 2018]. We found it beneﬁcial to add a cosine embedding loss (Lcos) which will tend to align the directions of the student and teacher hidden states vectors.', '4.2 Ablation study In this section, we investigate the inﬂuence of various components of the triple loss and the student initialization on the performances of the distilled model. We report the macro-score on GLUE. Table 4 presents the deltas with the full triple loss: removing the Masked Language Modeling loss has little impact while the two distillation losses account for a large portion of the performance.']",The objective of the KL-divergence loss in soft-label distillation is to reduce the difference between the probability distributions of relevance scores assigned by the teacher and student networks. This is achieved by normalizing the relevance scores into probability distributions and then minimizing their KL-divergence loss.,The KL-divergence loss aims to reduce the difference between the probability distributions of relevance scores generated by the teacher and student networks.,1.0,0.6923076923076923,0.5
What two groups of variables form the bipartite graph in the GANsformer?,"['The section is structured as follows: we ﬁrst present a for- mulation of the Bipartite Transformer, a general-purpose generalization of the Transformer (section 3.1). Then, we provide an overview of how the transformer is incorporated into the generator and discriminator framework (section 3.2). We conclude by discussing the merits and distinctive proper- ties of the GANsformer, that set it apart from the traditional GAN and transformer networks (section 3.3). 3.1. The Bipartite Transformer', 'Figure 2. We introduce the GANsformer network, that leverages a bipartite structure to allow long-range interactions, while evading the quadratic complexity standard transformers suffer from. We present two novel attention operations over the bipartite graph: simplex and duplex, the former permits communication in one direction, in the generative context – from the latents to the image features, while the latter enables both top-down and bottom up connections between these two variable groups.', 'Generative Adversarial Transformers 3. The Generative Adversarial Transformer The Generative Adversarial Transformer is a type of Gen- erative Adversarial Network, which involves a generator network (G) that maps a sample from the latent space to the output space (e.g. an image), and a discriminator net- work (D) which seeks to discern between real and fake samples (Goodfellow et al., 2014). The two networks com- pete with each other through a minimax game until reaching an equilibrium. Typically, each of these networks consists of multiple layers of convolution, but in the GANsformer case, we instead construct them using a novel architecture, called Bipartite Transformer, formally deﬁned below.', 'The standard transformer network consists of alternating multi-head self-attention and feed-forward layers. We refer to each pair of self-attention and feed-forward layers as a transformer layer, such that a Transformer is considered to be a stack composed of several such layers. The Self- Attention operator considers all pairwise relations among the input elements, so to update each single element by attending to all the others. The Bipartite Transformer gener- alizes this formulation, featuring instead a bipartite graph between two groups of variables (in the GAN case, latents and image features). In the following, we consider two forms of attention that could be computed over the bipartite graph – Simplex attention, and Duplex attention, depending on the direction in which information propagates2 – either in one way only, or both in top-down and bottom-up ways. While for clarity', 'We have introduced the GANsformer, a novel and efﬁcient bipartite transformer that combines top-down and bottom- up interactions, and explored it for the task of generative modeling, achieving strong quantitative and qualitative re- sults that attest for the model robustness and efﬁcacy. The GANsformer ﬁts within the general philosophy that aims to incorporate stronger inductive biases into neural networks to encourage desirable properties such as transparency, data- efﬁciency and compositionality – properties which are at the core of human intelligence, and serve as the basis for our capacity to reason, plan, learn, and imagine. While our work focuses on visual synthesis, we note that the bipartite transformer is a general-purpose model, and expect it may be found useful for other tasks in both vision and language. Overall, we hope that our work will help taking us a little closer in', 'Object Area GAN 0.038 StyleGAN 0.035 GANsformers 0.045 GANsformerd 0.068 Object Number Co-occurrence Shape 2.378 13.532 1.334 1.622 9.177 0.643 2.142 9.506 1.856 2.825 13.020 2.815 Size Material Color 0.256 0.108 1.011 0.066 0.322 1.402 0.393 1.573 1.519 0.427 2.887 3.189 Class 6.435 4.571 5.315 16.742', 'Compared to these prior works, the GANsformer stands out as it manages to avoid the high costs ensued by self at- tention, employing instead bipartite attention between the image features and a small collection of latent variables. Its design ﬁts naturally with the generative goal of transforming source latents into an image, facilitating long-range inter- action without sacriﬁcing computational efﬁciency. Rather, Generative Adversarial Transformers Standard Transformer The Bipartite Transformer Self-Attention Simplex-Attention Duplex-Attention', 'GAN StyleGAN GANsformers GANsformerd Disentanglement Modularity Completeness 0.126 0.631 0.071 0.208 0.703 0.124 0.556 0.891 0.195 0.768 0.952 0.270 Informativeness Informativeness’ 0.583 0.434 0.685 0.332 0.899 0.848 0.972 0.963']","The two groups of variables that form the bipartite graph in the GANsformer are:

1. Latents
2. Image features",The bipartite graph is formed between latents and image features.,1.0,1.0,0.8
What two types of information does G-RAG combine to create a context-informed ranker?,"['2.1 RAG Approaches and Systems RAG generally refers to any system where a user query is used to retrieve relevant information from external data sources, whereupon this information is incorporated into the generation of a response to the query by an LLM (or other generative AI model, such as a multi-media model). The query and retrieved records populate a prompt template, which is then passed to the LLM (Ram et al., 2023). RAG is ideal when the total number of records in a data source is too large to include in a single prompt to the LLM, i.e. the amount of text in the data source exceeds the LLM’s context window.', '7 different GNN models. Please refer to Appendix B for details. G-RAG: The initial node features are based on document text and AMR information as described in (2). The rest of the setting is the same as GCN. G-RAG-RL: Using the ranking loss function and keep the other setting the same as G-RAG.', '5.1 Best Practices for Implementing RAG According to our experimental findings, we suggest two distinct recipes or practices for implementing RAG systems, each customized to address specific requirements: one focusing on maximizing perfor- mance, and the other on striking a balance between efficiency and efficacy. Best Performance Practice: To achieve the high- est performance, it is recommended to incorporate query classification module, use the “Hybrid with HyDE” method for retrieval, employ monoT5 for reranking, opt for Reverse for repacking, and lever- age Recomp for summarization. This configuration yielded the highest average score of 0.483, albeit with a computationally-intensive process.', 'Our proposed model, G-RAG, addresses limitations in existing ODQA methods by leveraging implicit connections between documents and strategically integrating AMR information. Our method identifies documents with valuable information significantly better even when this information is only weakly connected to the question context. This happens because documents connected by the document graph share information that is relevant for the final answer. We integrate key AMR information to improve performance without increasing computational cost. We also proposed two metrics to fairly evaluate the performance of a wide range of ranking scenarios including tied ranking scores. Furthermore, our investigation into the performance of PaLM 2 as a reranker emphasizes the significance of reranker model design in RAG, as even an advanced pre-trained LLM might face challenges in the reranking task.', 'G-RAG outperforms state-of-the-art approaches while having smaller computational footprint. Additionally, we assess the performance of PaLM 2 as a reranker and find it to significantly underperform G-RAG. This result emphasizes the importance of reranking for RAG even when using Large Language Models.', 'ighlight the advantages of the proposed G-RAG over state-of-the-art benchmarks, we conducted experiments across various embedding models with fine-tuning parameter in the next section.', 'Table 3: G-RAG with changing the embedding model. 4.4 Investigating PaLM 2 Scores To evaluate the performance of large language models on the reranking task, we conduct zero-short experiments on the dev & test sets of the NQ and TQA datasets. An example of LLM-generated relevance score is illustrated in Figure 5 in the Appendix. In general, we observe that scores generated by PaLM 2 are integers between 0 and 100 that are divisible by 5. This often leads to ties in documents rankings. To address the ties in the ranking score, we use the proposed metrics MTRR (Eq. 11) and TMHits@10 (Eq. 12) to evaluate the performance of reranker based on PaLM 2 [9]. For the convenience of comparison, we copy w/o rerank, BART, and G-RAG results from Section 4.2. Since there is no tied ranking provided by w/o rerank and BART, the MRR and MHits@10 have the same values as MTRR and TMhits@10, respectively.', 'to more effective marginalization over documents. Furthermore, RAG can generate correct answers even when the correct answer is not in any retrieved document, achieving 11.8% accuracy in such cases for NQ, where an extractive model would score 0%.']","G-RAG combines two types of information to create a context-informed ranker: 

1. Document text
2. AMR (Abstract Meaning Representation) information.",G-RAG combines the structural connections between retrieved documents and the semantic information obtained through Abstract Meaning Representation (AMR) graphs.,1.0,0.6666666666666666,0.33
"What neural network architecture forms the basis of the BERT model, and what versions of it were initially trained?","['4 Training Procedure Analysis This section explores and quantiﬁes which choices are important for successfully pretraining BERT models. We keep the model architecture ﬁxed.7 Speciﬁcally, we begin by training BERT models with the same conﬁguration as BERTBASE (L = 12, H = 768, A = 12, 110M params).', 'The BERT architecture is based on the multilayer bidirectional transformer described in 2017 by A. Washwani in [80]. The authors trained two versions of the neural network - a standard one with 12 layers and 768 coordinates in the view (110 million trained parameters in total) and a large one with 24 layers and 1024 coordinates (340 million parameters). BERT uses text embeddings described in 2016 to represent an input sequence [85]. A sequence is an arbitrary set of contiguous text tokens. For example, the model uses the same representations for one sentence and for a pair, which allows BERT to be used for a wide range of tasks.', 'RQ 2. What type of hyperparameters were mostly considered to be properly arranged in training the BERT-based models? BERT is a recent modification of a series of neural models that makes extensive use of pre-training and has shown useful in a wide range of NLP tasks, including text classifica- tion and question-answering from datasets. To learn word representations, BERT uses the Transformer architecture, that comprise of several encoder layers. It analyzes sequential input, like words in text, using an attention mechanism. The attention mechanism helps the model better understand the text’s context by allowing it to capture the relationship between far-off words [26]. During the training process, numerous parameter variables are applied to setting the process, resulting in many variances in the outcomes.', 'Retraining Strategies: There are many ways to use BERT for a target. For example, you can use the representation provided by BERT as additional or basic characteristics in the classification model, you can use the inner layers of BERT to get information about the text. Different layers of the neural network can display different levels of syntactic and semantic information of the text [24]. Intuitively, the earlier layers contain more general information. Accordingly, the problem arises of choosing the required layer for inclusion in a specific model.', 'The basic BERT model contains an encoder with 12 transformer blocks, 12 attention areas, and a textual representation dimension of 768. The model receives a text sequence of no more than 512 tokens as input and outputs its vector representation. The sequence can contain one or two segments, separated by a special token [SEP], each of which necessarily begins with the token [CLS], with a special classification representation. When adapting BERT to specific word processing tasks, a special retraining technique is required. Such techniques can be of three types:', 'For text classification tasks, the BERT model is also used, which allows additional training of the basic model for a specific task using just one additional layer of neurons. The use of BERT makes it possible to obtain models with the currently best performance in text classification problems after additional training according to a certain methodology [74].', 'BERT tries to get around this limitation by using learning according to the so-called “masked language models”, that is, the target function of learning a given representation formalizes the task of predicting a randomly selected and masked word in a text, taking into account only the surrounding context. Thus, a deep bi-directional transformer is trained. The BERT model training process includes two stages: pre-training on unlabeled data, and additional training on labeled data for a specific application problem. Depending on the task, the retraining process and the architectures used may differ, although they are all based on the same model with the same set of parameters.', 'For MS MARCO, we initialize the BERT components of the Col- BERT query and document encoders using Google’s official pre- trained BERTbase model and train all models for 200k iterations. For TREC CAR, we follow related work [2, 25] and use a different pre-trained model to the official ones. To explain, the official BERT models were pre-trained on Wikipedia, which is the source of TREC CAR’s training and test sets. To avoid leaking test data into train, Nogueira and Cho [25] pre-train a BERT model on the Wiki pages corresponding to training subset of TREC CAR. They release their BERTlarge pre-trained model, which we fine-tune for ColBERT’s ex- periments on TREC CAR. As BERTlarge embeddings are larger, we set𝑚 to 200, and since fine-tuning this model is significantly slower than BERTbase, we train on TREC CAR for only 125k iterations.']","The BERT architecture is based on the multilayer bidirectional transformer described in 2017 by A. Washwani. Initially, two versions of the neural network were trained: a standard one with 12 layers and 768 coordinates (110 million parameters in total), and a large one with 24 layers and 1024 coordinates (340 million parameters).",BERT is based on the multilayer bidirectional transformer. The authors originally trained a standard version with 12 layers and a large version with 24 layers.,1.0,1.0,0.44
What measure is used to evaluate the robustness of the hybrid approach?,"['Figure 4, for 50% of the queries there is an improvement when using the hybrid approach, for 40% there is no change in performance, and for 20% there is a degradation in performance. Yet, while the average percentage of improvement for the good performing queries is around 18%, the performance of the bad performing ones decreases in about 4% only.', '4.2.3 Robustness analysis. In this section, we analyze the robust- ness of the hybrid approach with respect to the different queries. First, we divide the queries in the evaluation set such that the queries in each group have a similar level of increase (or decrease) in recall when using the hybrid retrieval approach, compared to the lexical retrieval baseline; the increase/decrease is measured in percentage; we focus on a result list of 1000 documents. The queries in each group are counted and presented in a histogram in Figure 4. According to the results, it is clear that the hybrid approach is very robust. Specifically, the hybrid approach either improves or does not degrade the performance of the baseline in the majority of cases. According to the results in Figure 4, for 50% of the queries there is an improvement when using the hybrid approach, for 40% there is no change in', '4.2.2 Hybrid approach performance. The performance of the hy- brid approach is reported in Table 3. The results demonstrate the effectiveness of the hybrid method even when a simple approach is used for the merging stage. Specifically, for all levels of 𝑐, the hybrid approach improves over the baseline lexical approach in terms of recall by about 3%. Focusing on the RI measure, we can see that the hybrid approach is also highly robust with respect to the different queries in terms of the recall improvements.', 'Figure 4: The number of queries in different groups that were divided based on similar level of decrease/increase in performance in the hybrid approach as compared to the lex- ical retrieval model (in percentage).', '4.1.4 Evaluation measures. Since our focus is on improving the re- callofretrieval,wereportthefollowingevaluationmeasures:𝑟𝑒𝑐𝑎𝑙𝑙, Mean Average Precision (𝑀𝐴𝑃), and the total number of relevant documents retrieved for all queries (#𝑟𝑒𝑙). Unless stated otherwise, those measures are calculated using the full size of the result list, 𝑐 (∈ {500,1000,1500,2000}). To measure the robustness of the hy- brid approach, we also report the Reliability of Improvement (𝑅𝐼). 𝑅𝐼 = |𝑄+|−|𝑄−| , where |𝑄+| and |𝑄−| are the number of queries for |𝑄| whichthehybridapproachperformsbetterorworsethanthelexical baseline, respectively; |𝑄| is the total number of queries. The two- tailed paired t-test was used to determine statistically significant differences between different methods (𝑝𝑣𝑎𝑙 < 0.05). 4.2 Experimental Results', 'Looking at the top part of Table 1, we can see that our DE-BERT model already outperforms or is competitive with prior systems. The multi- vector model brings larger improvement on the dataset containing longer documents (MS MARCO document), and the sparse-dense hybrid models bring improvements over dense-only models on both datasets. According to a Wilcoxon signed rank test for statistical significance, all differences between DE-BERT, ME-BERT, DE-HYBRID-E, and ME- HYBRID-E are statistically significant on both development sets with p-value < .0001. When a large number of candidates can be reranked, the impact of the first-stage system decreases. In the bottom part of the 7https://microsoft.github.io/msmarco/.', 'Method Q1 Q2 Q3 Q4 Lexical .167 .423 .663 .887 Hybrid .191∗ .446∗ .674∗ .891 % Improvement +14% +5.5% +1.7% +0.5%', '50 Hybrid s 40 e i r e u Q 30 f o r e b m 20 u N 10 0 <-20% [-20%, -10%) [-10%, 0%) 0% (0%, 10%] (10%, 20%] >20% Percentage of Improvement']","The Reliability of Improvement (RI) measure is used to evaluate the robustness of the hybrid approach. It is defined as RI = |Q+| - |Q-|, where |Q+| and |Q-| are the number of queries for which the hybrid approach performs better or worse than the lexical baseline, respectively.",The Reliability of Improvement (RI) is reported to measure the robustness of the hybrid approach.,1.0,0.8,0.4
What are the multiple intervening processing steps typically contained in a RAG workflow?,"['3 RAG Workflow In this section, we detail the components of the RAG workflow. For each module, we review com- monly used approaches and select the default and alternative methods for our final pipeline. Section 4 will discuss best practices. Figure 1 presents the workflow and methods for each module. Detailed experimental setups, including datasets, hyperpa- rameters, and results are provided in Appendix A.', 'both the effectiveness and efficiency of RAG systems. To the best of our knowledge, there has been no systematic effort to pursue the optimal implementation of RAG, partic- ularly for the entire RAG workflow.', '2.1 RAG Approaches and Systems RAG generally refers to any system where a user query is used to retrieve relevant information from external data sources, whereupon this information is incorporated into the generation of a response to the query by an LLM (or other generative AI model, such as a multi-media model). The query and retrieved records populate a prompt template, which is then passed to the LLM (Ram et al., 2023). RAG is ideal when the total number of records in a data source is too large to include in a single prompt to the LLM, i.e. the amount of text in the data source exceeds the LLM’s context window.', 'In this study, we aim to identify the best practices for RAG through extensive experimentation. Given the infeasibility of testing all possible combinations of these methods, we adopt a three-step approach to identify optimal RAG practices. First, we compare representative methods for each RAG step (or mod- ule) and select up to three of the best-performing methods. Next, we evaluate the impact of each method on the overall RAG performance by testing one method at a time for an individual step, while keeping the other RAG modules unchanged. This allows us to determine the most effective method for each step based on its contribution and interac- tion with other modules during response generation. Once the best method is chosen for a module, it is used in subsequent experiments. Finally, we empirically explore a few promising combinations suitable for different application scenarios where', 'on a per-output basis (assuming the same document is responsible for all tokens) or a per-token basis (where different documents are responsible for different tokens). Like T5 [51] or BART, RAG can be ﬁne-tuned on any seq2seq task, whereby both the generator and retriever are jointly learned.', 'Many RAG approaches have been proposed to enhance large language models (LLMs) through query-dependent retrievals (Cai et al., 2022; Gao et al., 2023; Li et al., 2022). A typical RAG workflow usually contains multiple intervening pro- cessing steps: query classification (determining whether retrieval is necessary for a given input query), retrieval (efficiently obtaining relevant doc- uments for the query), reranking (refining the order of retrieved documents based on their relevance to the query), repacking (organizing the retrieved doc- uments into a structured one for better generation), summarization (extracting key information for re- sponse generation from the repacked document and eliminating redundancies) modules. Implementing RAG also requires decisions on the ways to prop- erly split documents into chunks, the types of em- beddings to use for semantically representing these', 'Several surveys have extensively discussed cur- rent RAG systems, covering aspects like text gener- ation (Cai et al., 2022; Li et al., 2022), integration with LLMs (Gao et al., 2023; Huang and Huang, 2024), multimodal (Zhao et al., 2023a), and AI- generated content (Zhao et al., 2024). While these surveys provide comprehensive overviews of ex- isting RAG methodologies, selecting the appropri- ate algorithm for practical implementation remains challenging. In this paper, we focus on best prac- tices for applying RAG methods, advancing the understanding and application of RAG in LLMs.', '5.1 Best Practices for Implementing RAG According to our experimental findings, we suggest two distinct recipes or practices for implementing RAG systems, each customized to address specific requirements: one focusing on maximizing perfor- mance, and the other on striking a balance between efficiency and efficacy. Best Performance Practice: To achieve the high- est performance, it is recommended to incorporate query classification module, use the “Hybrid with HyDE” method for retrieval, employ monoT5 for reranking, opt for Reverse for repacking, and lever- age Recomp for summarization. This configuration yielded the highest average score of 0.483, albeit with a computationally-intensive process.']","The multiple intervening processing steps typically contained in a RAG workflow are:

1. Query classification (determining whether retrieval is necessary for a given input query)
2. Retrieval (efficiently obtaining relevant documents for the query)
3. Reranking (refining the order of retrieved documents based on their relevance to the query)
4. Repacking (organizing the retrieved documents into a structured one for better generation)
5. Summarization (extracting key information for response generation from the repacked document and eliminating redundancies)","A standard RAG workflow generally includes query classification, retrieval, reranking, repacking, and summarization modules.",1.0,1.0,0.71
What was the lowest bits/dim score achieved by the 12-layer Reformer model on the enwik8 test set?,"['Large Reformer models. To verify that the Reformer can indeed ﬁt large models on a single core and train fast on long sequences, we train up to 20-layer big Reformers on enwik8 and imagenet64. As can be seen in Figure 5, these models ﬁt into memory and train. We were not able to train Trans- former baselines in this case as they are too slow and memory-hungry, but we see clear improvement with the number of layers. A 12-layer model on enwik8 trained for 20K steps with a dropout rate of 0.1 achieves 1.19 bits/dim on the test set. We also trained a 12-layer Reformer model for longer with further tuning and improvements and we reached 1.05 bits/dim on the enwiki8 test set. 9', 'PRE-TRAINED MODEL DIM. 4G 256 4G 1G 2G 4G 12G 512 768 1024 1024 LAYERS 2 4 6 8 6 5% SAMPLES PEMSO03 0.188 0.174 0.168 0.160 0.146 0.138 0.133 0.130 0.128 0.128 0.125 PEMS04 0.223 0.208 0.200 0.190 0.166 0.154 0.145 0.145 0.142 0.143 0.135 PEMSO07 0.147 0.131 0.123 0.120 0.106 0.097 0.092 0.092 0.090 0.090 0.087 PEMSO08 0.367 0.339 0.322 0.319 0.289 0.256 0.239 0.228 0.221 0.216 0.204 20% SAMPLES | PEMSO03 0.154 0.141 0.137 0.134 0.127 0.124 0.123 0.121 0.120 0.117 0.114 PEMS04 0.182 0.162 0.155 0.150 0.140 0.132 0.124 0.124 0.123 0.122 0.115 PEMS07 0.115 0.104 0.098 0.095 0.086 0.082 0.080 0.079 0.079 0.078 0.076 PEMSO08 0.326 0.277 0.247 0.238 0.206 0.193 0.194 0.193 0.185 0.185 0.187', '7.2 Sharing Query-Key Space - enwik8 7.2 Reversibility - enwik8 separate q k regular 5.8 —— shared q k 5.8 —— reversible 4.3 4.3 29 29 1.4 14 .. 10K 20K 30K 40K 50K 60K 10K 20K 30K 40K 50K 60K Sharing Query-Key Space - imagenet64 Reversibility - imagenet64 4.3 4.3 4.2 separate q k 4.2 —— reversible regular —— shared g k 4.0 4.0 5 39 3.9 Q37 3.7 ~ 3.6 3.6 35 35 33 50K 100K 10 2 OO 33 50K 1 5K K steps steps Figure 3: Effect of shared query-key space (left) and reversibility (right) on performance on enwik8 and imagenet64 training. The curves show bits per dim on held-out data. Table 4: BLEU scores on newstest2014 for WMT English-German (EnDe). We additionally report detokenized BLEU scores as computed by sacreBLEU (Post, 2018).', 'Figure 5: Left: LSH attention performance as a function of number of layers on enwik8. Right: Speed of attention evaluation as a function of input length for full- and LSH- attention. see that the resulting model performs comparably to Vaswani et al. (2017) when trained for 100K steps. We also evaluate training for a greater number of steps and with a larger model. Reformer models are very memory-efﬁcient, so for the latter two experiments we do not need to save mem- ory by sharing embedding and output projection weight matrices throughout the model. Results are shown in Table 4. We do not apply LSH attention in this setting because examples are single sentences, and sentences tend to be relatively short. Our typical LSH attention conﬁguration uses chunks of 128 tokens after hashing and sorting, whereas the examples in the WMT14 test set are all shorter than 128 tokens.', 'Model BLU Training OPs) EN-DE EN-FR EN-DE EN-FR ByteNet [15] 23.75 Deep-Att + PosUnk [32] 39.2 1.0 1020 GNMT + RL [31] 24.6 39.92 2.3- 10 14 10% ConvS2S [8] 25.16 40.46 9.6 - 10 1.5 1020 MOoE [26] 26.03 40.56 2.0- 10"" 1.2 10% Deep-Att + PosUnk Ensemble [32] 40.4 8.0 GNMT + RL Ensemble [31] 26.30 41.16 1.8- 11 1 ConvS2S Ensemble [8] 26.36 41.29 7.7- 1019 1.2 1 Transformer (base model) 27 38.1 3.3.10%8 Transformer (big) 28.4 41.0 2.3-10%°', 'Model Resolution Params (M) FLOPs (B) Top-1 Top-5 CNN-based ResNet-50 [12] 224x224 25.6 4.1 76.2 92.9 ResNet-152 [12] 224x224 60.2 11.5 78.3 94.1 RegNetY-8GF [25] 224x224 39.2 8.0 79.9 RegNetY-16GF [25] 224x224 83.6 15.9 80.4 EfficientNet-B3 [28] 300x300 12.0 1.8 81.6 . EfficientNet-B4 [28] 380x380 19.0 42 82.9 96.4 Transformer-based DeiT-Ti [31] 224x224 57 1.3 72.2 1. DeiT-S [31] PVT-Small [36] T2T-ViT_t-14 [40] 224x224 224x224 224x224 22.1 245 215 4.6 38 52 79.8 79.8 80.7 TNT-S 224x224 23.8 52 81.5 95.7 ViT-B/16 [9] 384x384 86.4 55.5 77.9 DeiT-B [31] 224x224 86.4 17.6 81.8 T2T-ViT_t-24 [40] 224x224 63.9 13 822 TNT-B 224x224 65.6 14.1 82.9 9.3', 'Fine-tune on 5% Samples Fine-tune on 20% Samples 0.23 -0:231 M i 0.19 094 M 0.22 0.18 MSE 0.21 0.213 M 0.17 0.171 2M \\ 5 0.20 ~ 0:197 4M 0.16 0.154 e 4 6 4 6 Layer Number Layer Number Fine-tune 5% Fine-tune 20% -0:203 on mpls 0.160 0:159 S on R Samples — 0.20 M — M 0.19 0.155 0.150 0.18 0.177 13M £ P » 0.145 10.140 0.17 0.140 — 13M I 0.16 0:152] O 0.135 0.130 2V SOM 0.15 R R 256 512 768 2 Model Dimension 256 52 768 1024 Model Dimension', '• Memory in a model with N layers is N-times larger than in a single-layer model due to the fact that activations need to be stored for back-propagation. • Since the depth dff of intermediate feed-forward layers is often much larger than the depth dmodel of attention activations, it accounts for a large fraction of memory use. • Attention on sequences of length L is O(L2) in both computational and memory complex- ity, so even for a single sequence of 64K tokens can exhaust accelerator memory. ∗Equal Contribution 1https://hackingsemantics.xyz/2019/leaderboards/ 1 Published as a conference paper at ICLR 2020 We introduce the Reformer model which solves these problems using the following techniques:']",The lowest bits/dim score achieved by the 12-layer Reformer model on the enwik8 test set was 1.05 bits/dim.,"With further tuning and improvements, the 12-layer Reformer model reached 1.05 bits/dim.",1.0,1.0,0.67
"How do the parameters of BioGPT compare with those of its backbone, GPT-2 medium?","['Scaling to Larger Size We also scaled our model to larger size. We built BioGPT- Large, based on the GPT-2 XL architecture (the largest version of GPT-2), with 1.5B model parameters. We ﬁne-tune and evaluate its performance on the downstream tasks, as shown in Table 11. Table 11. Performance of BioGPT-Large ﬁne-tuned on downstream tasks', 'results with single scale testing are shown in Table 11. With similar parameters, Trans2Seg with TNT-S backbone achieves 43.6% mIoU, which is 1.0% higher than that of PVT-small backbone and 2.8% higher than that of DeiT-S backbone. 4 Conclusion', 'Model Accuracy PubMedBERT [9] 55.8 BioELECTRa [28] 64.2 BioLinkBERTbase [29] 70.2 BioLinkBERTlarge [29] 72.2 BioGPT 78.2', 'We can see from the results in Table 6 that BioGPT achieves 85.12% accuracy with 3.28% improvement over general domain GPT-2, and surpasses BioBERT, PubMedBERT and BioLinkBERT with 3.58%, 2.8%, 0.77% improvements respectively.', 'For this task, no objective evaluation metric is reported here. Instead, we provide a few examples here demonstration. for From the results in Table 7, we can see that: (1) Given relatively common names as input, for example in the ﬁrst two cases (i.e., Bicalutamide and JAK-3), GPT-2 can generate meaningful and ﬂuent text that is related to the word and biomedicine, while BioGPT generates more speciﬁc and professional descriptions. (2) When given some uncommon names (e.g., in the Apricitabine and Xylazine cases), GPT- 2 cannot generate meaningful descriptions while BioGPT still', 'The results are shown in Table 4 from which we can see that BioGPT achieves 40.76% with 16.08% and 12.49% improvement against GPT-2medium and REBEL. It also surpasses REBELpt which uses additional large relation extraction dataset for two- stage pre-training.', 'Model F1 BioBERT [10] 81.54 PubMedBERT [9] 82.32 PubMedBERTlarge 82.70 BioLinkBERTbase 84.35 GPT-2medium 81.84 BioGPT 85.12', 'providing a comprehensive survey on GPT. Therefore, there is a need for a comprehensive review that focuses on GPT’s architecture, enabling technologies, potential appli- cations, emerging challenges, interesting projects and future directions. These limitations motivated us to conduct this review. Hence, this review will not only help researchers and practitioners in this field to gain a better understanding of GPT but also provide valuable insights into its potential applications and major limitations when conducting the research. B. RELATED SURVEYS AND CONTRIBUTIONS']","The retrieved context does not contain enough information to answer this question about the parameters of BioGPT's backbone, GPT-2 medium.","BioGPT has 347 million parameters, slightly less than the 355 million parameters of GPT-2 medium, due to differences in the vocabulary size which affects the embedding and output projection dimensions.",1.0,0.3333333333333333,0.22
Which specific performance metrics do the authors focus on to evaluate ranking tasks?,"['Toevaluatetheretrievalcapacityofaninformation-retrievalsystem,anumberoffactorsneedto be considered [81, 81, 267]: effectiveness, efficiency, diversity, novelty, and so on. Existing studies mainly focus on the effectiveness for the retrieval system, and they widely adopt Top-K Accuracy, Recall, Precision, Mean Average Precision (MAP), Mean Reciprocal Rank (MRR), and Nor- malized Discounted Cumulative Gain (NDCG) as evaluation metrics. Note that these metrics can be used in both first-stage retrieval and reranking. However, we only describe the evaluation metrics from a general ranking perspective without considering specific task scenarios. In particu- lar, top-ranked texts are more important for retrieval tasks, and therefore cut-off metrics are often adopted to examine the quality of texts at top positions.', 'The above metrics work well for most cases, however, they may fail to fairly characterize the ranking performance when there are ties in ranking scores, which is common in relevant scores generated by LLMs such as ChatGPT [31], PaLM 2 [9], LLaMA [38], and GPT4 [32]. Please refer to Fig 5 in the Appendix for the detailed prompt and results of relevant scores between questions and documents. To address ties in the ranking scores, we propose variants of MRR and MHits@10. Denote r(t) p as the rank of the document p with t ties. In other words, the relevant score between the question and the document p is the same as other t − 1 documents. The variant of MRR for tied ranking is named Mean Tied Reciprocal Ranking (MTRR), represented as', 'certain hyperparameters arrangement. In addition, we also identified and located any description and explanation about evaluation metrics for particular NLP tasks. A total of 41 papers that met these quality assesment criteria were finally chosen.', 'Table 3: G-RAG with changing the embedding model. 4.4 Investigating PaLM 2 Scores To evaluate the performance of large language models on the reranking task, we conduct zero-short experiments on the dev & test sets of the NQ and TQA datasets. An example of LLM-generated relevance score is illustrated in Figure 5 in the Appendix. In general, we observe that scores generated by PaLM 2 are integers between 0 and 100 that are divisible by 5. This often leads to ties in documents rankings. To address the ties in the ranking score, we use the proposed metrics MTRR (Eq. 11) and TMHits@10 (Eq. 12) to evaluate the performance of reranker based on PaLM 2 [9]. For the convenience of comparison, we copy w/o rerank, BART, and G-RAG results from Section 4.2. Since there is no tied ranking provided by w/o rerank and BART, the MRR and MHits@10 have the same values as MTRR and TMhits@10, respectively.', 'in learning the relevance between texts, DPR scores may lose their advantage and fairness. To address this issue, other metrics such as Mean Reciprocal Rank (MRR) and Mean Hits@ 10 (MHits@10) are used for measuring the reranking performance [42]. To be specific, The Mean Reciprocal Rank (MRR) score of positive document is given by MRR = 15; eal & pep+ ), where Q is the question set from the evaluating dataset, P is the set of positive documents, and r,, is the rank of document p estimated by the reranker. The MHits @10 indicates the rcentage of positive documents that are ranked in the Top 10, given by MHits@10 = ; > eol P] > pep+ L(rp <= 10)), where the indication I(A) = 0 if the event A is true, otherwise 0', 'JURNAL INFOTEL, VOL. 16, NO. 4, NOVEMBER 2024, PP. 713–728. 724 FATWANTO et al. Table 5: The applied evaluation metrics excerpted from the reviewed papers', '5.2 Generalization of Best Practices While the above best practices demonstrate strong performance in our experiments, we acknowledge that they may not be universally optimal across all tasks and contexts. Therefore, we emphasize the importance of the comprehensive evaluation framework, which assesses system performance across general, domain-specific, and task-specific capabilities, and the three-step strategy to identify the most effective practices: • Empirical Comparison of Candidate Imple- mentations: For each module, we compare mul- tiple candidate methods to determine the best- performing options. • Module Integration: After selecting the optimal method for each module, we evaluate how they interact when integrated into the full workflow.', 'Furthermore, MRR [270] averages the reciprocal of the rank of the first retrieved positive text over a set of queries Q: 1Q| 1 (18) MRR rank,’ where rankq is the position of the first retrieved positive text w.r.t. query q. For first-stage retrieval, Recall@k and Accuracy@k are the most commonly used metrics, since itsmainfocusistorecallasmanyrelevanttextsoranswersaspossibleatatruncationlength;while for ranking, MRR, NDCG, and MAP are more commonly used in practice. For a comprehensive discussion about IR evaluation, the readers are suggested to read more focused references [81, 176, 234, 267].']","The authors focus on the following specific performance metrics to evaluate ranking tasks:

1. Mean Reciprocal Rank (MRR)
2. Mean Hits@10 (MHits@10)
3. Mean Tied Reciprocal Ranking (MTRR)
4. Normalized Discounted Cumulative Gain (NDCG)
5. Mean Average Precision (MAP)

These metrics are used to evaluate the performance of rerankers based on large language models, such as PaLM 2, and are particularly useful when there are ties in ranking scores.",The authors primarily use Mean Tied Reciprocal Ranking (MTRR) and Tied Mean Hits@10 (TMHits@10).,1.0,0.4,0.62
How much compute time and hardware was required to train DistilBERT?,"['Distillation We applied best practices for training BERT model recently proposed in Liu et al. [2019]. As such, DistilBERT is distilled on very large batches leveraging gradient accumulation (up to 4K examples per batch) using dynamic masking and without the next sentence prediction objective. Data and compute power We train DistilBERT on the same corpus as the original BERT model: a concatenation of English Wikipedia and Toronto Book Corpus [Zhu et al., 2015]. DistilBERT was trained on 8 16GB V100 GPUs for approximately 90 hours. For the sake of comparison, the RoBERTa model [Liu et al., 2019] required 1 day of training on 1024 32GB V100.', 'Table 3: DistilBERT is signiﬁcantly smaller while being constantly faster. Inference time of a full pass of GLUE task STS-B (sen- timent analysis) on CPU with a batch size of 1.', 'Table 2: DistilBERT yields to comparable performance on downstream tasks. Com- parison on downstream tasks: IMDb (test ac- curacy) and SQuAD 1.1 (EM/F1 on dev set). D: with a second step of distillation during ﬁne-tuning.', 'The results on each of the 9 tasks are showed on Table 1 along with the macro-score (average of individual scores). Among the 9 tasks, DistilBERT is always on par or improving over the ELMo baseline (up to 19 points of accuracy on STS-B). DistilBERT also compares surprisingly well to BERT, retaining 97% of the performance with 40% fewer parameters.', '5.2 Hardware and Schedule We trained our models on one machine with 8 NVIDIA P100 GPUs. For our base models using the hyperparameters described throughout the paper, each training step took about 0.4 seconds. We trained the base models for a total of 100,000 steps or 12 hours. For our big models,(described on the bottom line of ), step time was 1.0 seconds. The big models were trained for 300,000 steps (3.5 days). 5.3 Optimizer We used the Adam optimizer [17] with 3; = 0.9, B, = 0.98 and € = 10 We varied the learning rate over the course of training, according to the formula: lrate = d−0.5 model · min(step_num−0.5,step_num · warmup_steps−1.5) (3) This corresponds to increasing the learning rate linearly for the ﬁrst warmup_steps training steps, and decreasing it thereafter proportionally to the inverse square root of the step number. We used warmup_steps = 4000.', 'enough to execute on huge models without issues. As a bonus, using a well-optimized Cholesky kernel also yields further speedup. We detail all small changes necessary for the Cholesky version of the algorithm next.', 'We pretrain with sequences of at most T = 512 tokens. Unlike Devlin et al. (2019), we do not ran- domly inject short sequences, and we do not train with a reduced sequence length for the ﬁrst 90% of updates. We train only with full-length sequences. We train with mixed precision ﬂoating point arithmetic on DGX-1 machines, each with 8 × 32GB Nvidia V100 GPUs interconnected by In- ﬁniband (Micikevicius et al., 2018).', 'Model # param. (Millions) Inf. time (seconds) ELMo BERT-base DistilBERT 180 110 66 895 668 410']","To train DistilBERT, approximately 90 hours of compute time was required on 8 16GB V100 GPUs.",It took approximately 90 hours to train DistilBERT using 8 16GB V100 GPUs.,1.0,1.0,1.0
On what specific datasets does G2PT demonstrate the effectiveness of its learned representations for classification tasks?,"['Figure 3. Model and data scaling effects. as 3D information or chirality, G2PT is trained exclusively on 2D graph structural information. Overall, these results indicate that G2PT not only excels in generation but also learns effective graph representations. 5.7. Scaling Effects We analyze how scaling the model size and data size will affect the model performance using the three molecular datasets. We use the validity score to quantify the model performance. Results are provided in Figure 3. For model scaling, we additionally train G2PTs with 1M, 707M, and 1.5B parameters. We notice that as model size increases, validity score generally increases and saturates at some point, depending on the task complexity. For in- stance, QM9 saturates at the beginning (1M parameters) while MOSES and GuacaMol require more than 85M (base) parameters to achieve satisfying performance.', 'We evaluate G2PT on a series of graph generation tasks: generic graph generation, molecule generation, and goal- oriented molecular generation. Without excessive architec- tural engineering or training tricks, G2PT performs better than or on par with previous state-of-the-art (SOTA) base- lines over seven datasets. By fine-tuning G2PT towards generating molecules with target properties, we showcase that G2PT can be easily adapted to various generative tasks that require additional alignment. We also fine-tune G2PT for molecular property prediction on MoleculeNet datasets. The results demonstrate the effectiveness of G2PT’s learned representations for classification tasks. Finally, we analyze the G2PT model and show its performance with data aug- mentation.', '5.6. Predictive Performance on Downstream Tasks We conduct experiments on eight graph classification bench- mark datasets from MoleculeNet (Wu et al., 2018a), strictly following the data splitting protocol used in GraphMAE (Hou et al., 2022a) for fair comparison. A detailed descrip- tion of these datasets is provided in Appendix B.4. For downstream fine-tuning, we initialize G2PT with param- eters pre-trained on the GuacaMol dataset, which contains molecules with up to 89 heavy atoms. We also provide results where models are not pre-trained. As summarized in Table 5, G2PT’s graph embeddings demonstrate consistently strong (best or second-best) per- formance on seven out of eight downstream tasks, achieving an overall performance comparable to GraphMAE, a lead- ing self-supervised learning (SSL) method. Notably, while previous SSL approaches leverage additional features such', 'node and edge tokens. A more recent work, Gao et al. (2024), which focuses on molecule representation learning, uses a vocabulary to store all atom types and all possible bond types (same bonds with different atoms as endpoints are considered as different type in their case). In contrast, by introducing node index into the vocabulary, G2PT easily implements the edge tokenizations and node identifications.', 'generation and graph prop- erty prediction. Comprehensive experiments on multiple datasets demonstrate G2PT’s superior performance in both generic graph generation and molecular generation. Additionally, the good ex- periment results also show that G2PT can be ef- fectively applied to goal-oriented molecular de- sign and graph representation learning. The code of G2PT is released at https://github.com/tufts- ml/G2PT.', 'Impact Statement This paper introduces a framework that models graphs in a similar vein to GPT (Generative Pre-trained Transformer). The G2PT framework allows seamless plantation of training techniques that have developed in other domains based on GPT. Besides performing generative tasks such as drug dis- covery, G2PT also can be easily extended for discriminative tasks such as graph property prediction. We hope this work will advance the field of graph learning. As a powerful tool, G2PT may also be used as one step in a complex system to create molecule structures harmful to humans or the en- vironment, but we don’t see immediate hazards from our study. Acknowledgment We thank all reviewers for their insightful feedback. Chen and Liu’s work was supported by NSF 2239869. He and Xu’s work was support by NSF 2239672.', 'B.4. Fine-tuning G2PT for Graph Property Prediction Datasets. We use eight classification tasks in MoleculeNet (Wu et al., 2018a) following Zhu et al. (2024) to validate the predictive capability of our learned representations. The datasets cover two types of molecular properties: biophysical and physiological properties. • Biophysical properties include (1) the HIV dataset for HIV replication inhibition, (2) the Maximum Unbiased Validation (MUV) dataset for virtual screening with nearst neighbor search, (3) the BACE dataset for inhibition of human β- secretase 1 (BACE-1), and (4) the Side Effect Resource (SIDER) dataset for grouping the side effects of marketed drugs into 27 system organ classes.', '• Physiological properties include (1) the Blood-brain barrier penetration (BBBP) dataset for predicting barrier perme- ability of molecules targeting central nervous system, (2) the Tox21, (3) the ClinTox, and (4) the ToxCast datasets that are all associated with certain type of toxicity of the chemical compounds. We adopt the scaffold split that divides train, validation and test set by different scaffolds, introduced by Wu et al. (2018b). Fine-tuning details. We fine-tune G2PTsmall and G2PTbase pre-trained on GuacaMol dataset for the downstream tasks. We setup the dropout rate to 0.5 and use a learning rate of 1e-4 for training the linear layer. For the half transformer blocks, we use a learning rate of 1e-6. We use a batch size of 256 and train the models for 100 epochs. Test result with best validation performance is reported.']","G2PT demonstrates the effectiveness of its learned representations for classification tasks on eight graph classification benchmark datasets from MoleculeNet, specifically:

1. HIV dataset for HIV replication inhibition
2. Maximum Unbiased Validation (MUV) dataset for virtual screening with nearest neighbor search
3. BACE dataset for inhibition of human β-secretase 1 (BACE-1)
4. Side Effect Resource (SIDER) dataset for grouping the side effects of marketed drugs into 27 system organ classes
5. Blood-brain barrier penetration (BBBP) dataset for predicting barrier permeability of molecules targeting central nervous system
6. Tox21 dataset for certain type of toxicity of the chemical compounds
7. ClinTox dataset for certain type of toxicity of the chemical compounds
8. ToxCast dataset for certain type of toxicity of the chemical compounds",G2PT was fine-tuned for molecular property prediction on the MoleculeNet datasets.,1.0,1.0,0.32
Where can the code to reproduce all the experiments be found?,"['• The authors should provide instructions on data access and preparation, including how to access the raw data, preprocessed data, intermediate data, and generated data, etc. • The authors should provide scripts to reproduce all experimental results for the new proposed method and baselines. If only a subset of experiments are reproducible, they should state which ones are omitted from the script and why. • At submission time, to preserve anonymity, the authors should release anonymized versions (if applicable). • Providing as much information as possible in supplemental material (appended to the paper) is recommended, but including URLs to data and code is permitted.', '(d) We recognize that reproducibility may be tricky in some cases, in which case authors are welcome to describe the particular way they provide for reproducibility. In the case of closed-source models, it may be that access to the model is limited in some way (e.g., to registered users), but it should be possible for other researchers to have some path to reproducing or verifying the results. 5. Open access to data and code Question: Does the paper provide open access to the data and code, with sufﬁcient instruc- tions to faithfully reproduce the main experimental results, as described in supplemental material? 23 Answer: [Yes] Justiﬁcation: We include implementation details in the paper and will release the code and data after publication.', '• If the paper includes experiments, a No answer to this question will not be perceived well by the reviewers: Making the paper reproducible is important, regardless of whether the code and data are provided or not. • If the contribution is a dataset and/or model, the authors should describe the steps taken to make their results reproducible or veriﬁable.', '• Inversely, any informal proof provided in the core of the paper should be complemented by formal proofs provided in appendix or supplemental material. • Theorems and Lemmas that the proof relies upon should be properly referenced. 4. Experimental result reproducibility Question: Does the paper fully disclose all the information needed to reproduce the main ex- perimental results of the paper to the extent that it affects the main claims and/or conclusions of the paper (regardless of whether the code and data are provided or not)? Answer: [Yes] Justiﬁcation: Implementation details are provided in Section A. Guidelines: • The answer NA means that the paper does not include experiments.', '8. Experiments compute resources Question: For each experiment, does the paper provide sufﬁcient information on the com- puter resources (type of compute workers, memory, time of execution) needed to reproduce the experiments? Answer: [Yes] Justiﬁcation: We provide details on compute resources in Section A. Guidelines: • The answer NA means that the paper does not include experiments. • The paper should indicate the type of compute workers CPU or GPU, internal cluster, or cloud provider, including relevant memory and storage. • The paper should provide the amount of compute required for each of the individual experimental runs as well as estimate the total compute. • The paper should disclose whether the full research project required more compute than the experiments reported in the paper (e.g., preliminary or failed experiments that didn’t make it into the paper).', 'Guidelines: • The answer NA means that paper does not include experiments requiring code. • Please see the NeurIPS code and data submission guidelines (https://nips.cc/ public/guides/CodeSubmissionPolicy) for more details. • While we encourage the release of code and data, we understand that this might not be possible, so “No” is an acceptable answer. Papers cannot be rejected simply for not including code, unless this is central to the contribution (e.g., for a new open-source benchmark). • The instructions should contain the exact command and environment needed to run to reproduce the results. See the NeurIPS code and data submission guidelines (https: //nips.cc/public/guides/CodeSubmissionPolicy) for more details.', '8 REPRODUCIBILITY STATEMENT In the Supplementary Materials, we provide code to reproduce all experiments in this paper. More speciﬁcally, this includes: • Compressing all models from the OPT and BLOOM model families to 2/3/4 bits. • Evaluating perplexity of the quantized models. • Our 3-bit CUDA kernel together with compressed inference benchmarking features. • Code for the ZeroShot experiments. • A README ﬁle providing sample commands and information on how to run all scripts.', '6. Experimental setting/details Question: Does the paper specify all the training and test details (e.g., data splits, hyper- parameters, how they were chosen, type of optimizer, etc.) necessary to understand the results? Answer: [Yes] Justiﬁcation: See Section 4.1 and A. Guidelines: • The answer NA means that the paper does not include experiments. • The experimental setting should be presented in the core of the paper to a level of detail that is necessary to appreciate the results and make sense of them. • The full details can be provided either with the code, in appendix, or as supplemental material.']","The code to reproduce all the experiments can be found in the Supplementary Materials, specifically in the README file, which provides sample commands and information on how to run all scripts.",The code is provided in the Supplementary Materials.,1.0,1.0,0.4
What was the result of evaluating DistilBERT on the IMDb sentiment classification benchmark compared to BERT?,"['The results on each of the 9 tasks are showed on Table 1 along with the macro-score (average of individual scores). Among the 9 tasks, DistilBERT is always on par or improving over the ELMo baseline (up to 19 points of accuracy on STS-B). DistilBERT also compares surprisingly well to BERT, retaining 97% of the performance with 40% fewer parameters.', 'Table 1: DistilBERT retains 97% of BERT performance. Comparison on the dev sets of the GLUE benchmark. ELMo results as reported by the authors. BERT and DistilBERT results are the medians of 5 runs with different seeds.', '4.1 Downstream task benchmark Downstream tasks We further study the performances of DistilBERT on several downstream tasks under efﬁcient inference constraints: a classiﬁcation task (IMDb sentiment classiﬁcation - Maas et al. [2011]) and a question answering task (SQuAD v1.1 - Rajpurkar et al. [2016]). As shown in Table 2, DistilBERT is only 0.6% point behind BERT in test accuracy on the IMDb benchmark while being 40% smaller. On SQuAD, DistilBERT is within 3.9 points of the full BERT. We also studied whether we could add another step of distillation during the adaptation phase by ﬁne-tuning DistilBERT on SQuAD using a BERT model previously ﬁne-tuned on SQuAD as a 4We use jiant [Wang et al., 2019] to compute the baseline. 3 Table 4: Ablation study. Variations are relative to the model trained with triple loss and teacher weights initialization.', 'Distillation We applied best practices for training BERT model recently proposed in Liu et al. [2019]. As such, DistilBERT is distilled on very large batches leveraging gradient accumulation (up to 4K examples per batch) using dynamic masking and without the next sentence prediction objective. Data and compute power We train DistilBERT on the same corpus as the original BERT model: a concatenation of English Wikipedia and Toronto Book Corpus [Zhu et al., 2015]. DistilBERT was trained on 8 16GB V100 GPUs for approximately 90 hours. For the sake of comparison, the RoBERTa model [Liu et al., 2019] required 1 day of training on 1024 32GB V100.', 'Model IMDb (acc.) SQuAD (EM/F1) BERT-base DistilBERT DistilBERT (D) 93.46 92.82 - 81.2/88.5 77.7/85.8 79.1/86.9', 'Task Metric Avg. lang-speciﬁc BERT Avg. mBERT Diff. Named Entity Recognition F1 85.26 80.87 Natural Language Inference Accuracy 78.35 74.60 Paraphrase Identiﬁcation Accuracy 88.44 87.74 Part of Speech Tagging Accuracy 97.06 95.87 Part of Speech Tagging UPOS 98.28 97.33 Sentiment Analysis Accuracy 90.17 83.80 Text Classiﬁcation Accuracy 88.96 85.22 4.39 3.75 0.70 1.19 0.95 6.37 3.75', '6 Conclusion and future work We introduced DistilBERT, a general-purpose pre-trained version of BERT, 40% smaller, 60% faster, that retains 97% of the language understanding capabilities. We showed that a general-purpose language model can be successfully trained with distillation and analyzed the various components with an ablation study. We further demonstrated that DistilBERT is a compelling option for edge applications.', 'A number of evaluation metrics to evaluate the BERT-based models for NLP tasks have been mentioned in our reviewed papers. The metrics, as described in Table 5, comprise of F1-Score, Accuracy, Precision, Recall, Receiver Operating Characteristic (ROC)/Area Un- der the ROC Curve (AUC), Exact Match, and ROUGE. The F1 Score was used in the major- ity of the studies, in which it is commonly combined with Accuracy, Precision, and Recall. It is due to the fact that most of our reviewed papers were reporting on studies regard- ing text classification. For the type of binary, multi-class or multi-label text classifications, these types of metrics that were calculated based on the result of confusion matrix have be- come a de facto standard to evaluate the models’ performance. If the previous metrics are normally used for evaluating “discriminative” AI-type of tasks, Exact Match and ROUGE are']","According to the results in Table 2, DistilBERT was only 0.6% point behind BERT in test accuracy on the IMDb benchmark, while being 40% smaller.",DistilBERT is 40% smaller and trails BERT by only 0.6 percentage points in test accuracy.,1.0,0.75,0.5
What do the DCI metrics evaluate in the context of the GANsformer's latent representations?,"['Table 3. Disentanglement metrics (DCI), which asses the Disen- tanglement, Completeness and Informativeness of latent repre- sentations, computed over 1k CLEVR images. The GANsformer achieves the strongest results compared to competing approaches.', 'We consider the DCI metrics commonly used in the disentan- glement literature (Eastwood & Williams, 2018), to provide more evidence for the beneﬁcial impact our architecture has on the model’s internal representations. These metrics asses the Disentanglement, Completeness and Informativeness of a given representation, essentially evaluating the degree to which there is 1-to-1 correspondence between latent factors and global image attributes. To obtain the attributes, we consider the area size of each semantic class (bed, carpet, pillows) obtained through a pre-trained segmentor and use them as the output response features for measuring the latent space disentanglement, computed over 1k images. We fol- low the protocol proposed by (Wu et al., 2020) and present the results in . This analysis conﬁrms that the GANS- former latent representations enjoy higher disentanglement when', 'esults in . This analysis conﬁrms that the GANS- former latent representations enjoy higher disentanglement when compared to the baseline StyleGAN approach.', 'To evaluate all models under comparable conditions of train- ing scheme, model size, and optimization details, we im- plement them all within the codebase introduced by the StyleGAN authors. The only exception to that is the re- cent VQGAN model for which we use the ofﬁcial imple- mentation. All models have been trained with images of 256 × 256 resolution and for the same number of training steps, roughly spanning a week on 2 NVIDIA V100 GPUs per model (or equivalently 3-4 days using 4 GPUs). For the GANsformer, we select k – the number of latent variables, from the range of 8–32. Note that increasing the value of k does not translate to increased overall latent dimension, and we rather kept the overall latent equal across models. See supplementary material A for further implementation details, hyperparameter settings and training conﬁguration.', 'an efﬁcient setup that still scales linearly with the input size on the other. As such, the GANsformer can sidestep the computational costs and applicability constraints incurred by prior work, due to their dense and potentially excessive pairwise connectivity of the standard transformer (Zhang et al., 2019; Brock et al., 2019), and successfully advance generative modeling of images and scenes.', 'GAN StyleGAN GANsformers GANsformerd Disentanglement Modularity Completeness 0.126 0.631 0.071 0.208 0.703 0.124 0.556 0.891 0.195 0.768 0.952 0.270 Informativeness Informativeness’ 0.583 0.434 0.685 0.332 0.899 0.848 0.972 0.963', ""Figure 3. Model Structure. Left: The GANsformer layer, com- posed of a bipartite attention to propagate information from the latents to the evolving features grid, followed by a standard con- volution and upsampling. These layers are stacked multiple times starting from a 4×4 grid, until a ﬁnal high-resolution image is produced. Right: The latents and image features attend to each other to capture the scene compositionality. The GANsformer’s compositional latent space contrasts with the StyleGAN mono- lithic one, where a single latent modulates uniformly the whole scene. these two groups of elements. Speciﬁcally, we then deﬁne: T Q Attention(Q, K, V') = softmax Vd )v ap(X,Y) = Attention (¢(X), k(Y),v(Y))"", '3.3. Summary To recapitulate the discussion above, the GANsformer suc- cessfully uniﬁes the GANs and Transformer for the task of scene generation. Compared to the traditional GANs and transformers, it introduces multiple key innovations: • Bipartite Structure that balances between expressive- ness and efﬁciency, modeling long-range dependencies while maintaining linear computational costs. • Compositional Latent Space with multiple variables that coordinate through attention to produce the image cooperatively, in a manner that matches the inherent compositionality of natural scenes. • Bidirectional Interaction between the latents and the visual features, which allows the reﬁnement and inter- pretation of each in light of the other.']","The DCI metrics, which assess Disentanglement, Completeness, and Informativeness, evaluate the degree to which there is a 1-to-1 correspondence between latent factors and global image attributes.","They evaluate Disentanglement, Completeness, and Informativeness to measure the one-to-one correspondence between latent factors and global image attributes.",1.0,1.0,1.0
How is the Marian neural machine translation framework described in the subtitle of its 2018 paper?,"['The dominant sequence transduction models are based on complex recurrent or convolutional neural networks that include an encoder and a decoder. The best performing models also connect the encoder and decoder through an attention mechanism. We propose a new simple network architecture, the Transformer, based solely on attention mechanisms, dispensing with recurrence and convolutions entirely. Experiments on two machine translation tasks show these models to be superior in quality while being more parallelizable and requiring signiﬁcantly less time to train. Our model achieves 28.4 BLEU on the WMT 2014 English- to-German translation task, improving over the existing best results, including ensembles, by over 2 BLEU. On the WMT 2014 English-to-French translation task, our model establishes a new single-model state-of-the-art BLEU score of 41.0 after training for 3.5 days on eight GPUs, a', 'Marcin Junczys-Dowmunt, Roman Grundkiewicz, Tomasz Dwojak, Hieu Hoang, Kenneth Heaﬁeld, Tom Neckermann, Frank Seide, Ulrich Germann, Al- ham Fikri Aji, Nikolay Bogoychev, Andr´e F T Mar- tins, and Alexandra Birch. 2018. Marian: Fast neu- ral machine translation in c++. Douwe Kiela, Suvrat Bhooshan, Hamed Firooz, and Davide Testuggine. 2019. Supervised multimodal bitransformers for classifying images and text. Nikita Kitaev, Łukasz Kaiser, and Anselm Levskaya. 2020. Reformer: The efﬁcient transformer. Guillaume Klein, Yoon Kim, Yuntian Deng, Jean Senel- lart, and Alexander Rush. 2017. OpenNMT: Open- source toolkit for neural machine translation. In Proceedings of ACL 2017, System Demonstrations, pages 67–72, Vancouver, Canada. Association for Computational Linguistics.', '7 Conclusion In this work, we presented the Transformer, the ﬁrst sequence transduction model based entirely on attention, replacing the recurrent layers most commonly used in encoder-decoder architectures with multi-headed self-attention. For translation tasks, the Transformer can be trained signiﬁcantly faster than architectures based on recurrent or convolutional layers. On both WMT 2014 English-to-German and WMT 2014 English-to-French translation tasks, we achieve a new state of the art. In the former task our best model outperforms even all previously reported ensembles.', 'At the end of 2018, a group of scientists from the Google AI Language laboratory under the leadership of J. Devlin presented a new linguistic model called BERT [16]. This model is intended for deep preliminary learning of bidirectional text representation for subsequent use in machine learning models. The advantage of this model is its ease of use, which involves adding just one output layer to the existing neural architecture to obtain text models that surpass the inaccuracy of all existing ones in several natural text processing problems.', 'Finally, the ROUGE metric is commonly applied to a number of other “generative” AI NLP tasks including text summarization, text synthesis, and machine translation. ROUGE measures the difference of the text produced by the model to a reference text that is re- garded as valid, taking into account n-grams, word order, and lexical similarity. A number of studies on text summarization as reported in [47], [23], [48], [25], [43], [19], [18], [44], and [27], used this evaluation instrument due to its fitness for the particular task. 5 Conclusion', 'Alec Radford, Jeffrey Wu, Rewon Child, David Luan, Dario Amodei, and Ilya Sutskever. Language models are unsupervised multitask learners. OpenAI blog, 1(8):9, 2019. Colin Raffel, Noam Shazeer, Adam Roberts, Katherine Lee, Sharan Narang, Michael Matena, Yanqi Zhou, Wei Li, and Peter Liu. Exploring the limits of transfer learning with a uniﬁed text-to-text transformer. Journal of Machine Learning Research, 21(140):1–67, 2020. Pranav Rajpurkar, Jian Zhang, Konstantin Lopyrev, and Percy Liang. SQuAD: 100,000+ questions for machine comprehension of text. In Conference on Empirical Methods in Natural Language Processing (EMNLP), 2016. Sidak Pal Singh and Dan Alistarh. WoodFisher: Efﬁcient second-order approximation for neural network compression. In Conference on Neural Information Processing Systems (NeurIPS), 2020.', 'Christopher D Manning, Mihai Surdeanu, John Bauer, Jenny Rose Finkel, Steven Bethard, and David Mc- Closky. 2014. The stanford CoreNLP natural lan- guage processing toolkit. In Proceedings of 52nd annual meeting of the association for computational linguistics: system demonstrations, pages 55-60. aclweb.org. Bryan McCann, James Bradbury, Caiming Xiong, and Richard Socher. 2017. Learned in translation: Con- textualized word vectors. In I Guyon, U V Luxburg, S Bengio, H Wallach, R Fergus, S Vishwanathan, and R Garnett, editors, Advances in Neural Informa- tion Processing Systems 30, pages 6294–6305. Cur- ran Associates, Inc. Margaret Mitchell, Simone Wu, Andrew Zaldivar, Parker Barnes, Lucy Vasserman, Ben Hutchinson, Elena Spitzer, Inioluwa Deborah Raji, and Timnit Gebru. 2018. Model cards for model reporting.', 'e translation modules for question translation and answer translation. Since the multi-step machine translations (e.g., query translation and answer translation) in previous ap- proachesmayleadtoerrorpropagation,Asaietal.[7]furtherproposeamultilingualdensepassage retriever that extends DPR to retrieve candidate passages from multilingual document collections in a cross-lingual way. It adopts an iterative training approach to fine-tuning a multilingual PLM (e.g., mBERT [201]), and achieves performance improvement in a number of languages.']","The Marian neural machine translation framework is described in the subtitle of its 2018 paper as ""Fast neural machine translation in C++"".",The Marian framework is described as providing 'Fast neural machine translation in c++'.,1.0,0.0,0.5
What is the purpose of the Asyncval tool in the context of dense retrievers?,"['4.6 Empirical Performance Analysis with RocketQA Previous sections have discussed various optimization techniques to improve the training of dense retrievers. In this section, we take RocketQA [207] as the studied model and examine how different optimization techniques improve its retrieval performance on benchmark datasets.', '2.3 Retriever and Generator Fine-tuning Fine-tuning within the RAG framework is crucial for optimizing both retrievers and generators. Some research focuses on fine-tuning the generator to bet- ter utilize retriever context (Liu et al., 2024b; Luo et al., 2023; Zhang et al., 2024b), ensuring faith- ful and robust generated content. Others fine-tune the retriever to learn to retrieve beneficial passages for the generator (Izacard et al., 2022; Shi et al., 2023; Zhang et al., 2024a). Holistic approaches treat RAG as an integrated system, fine-tuning both retriever and generator together to enhance overall performance (Guu et al., 2020; Lin et al., 2023; Zamani and Bendersky, 2024), despite increased complexity and integration challenges.', 'Effect of Retrieving more documents Models are trained with either 5 or 10 retrieved latent documents, and we do not observe signiﬁcant differences in performance between them. We have the ﬂexibility to adjust the number of retrieved documents at test time, which can affect performance and runtime. Figure 3 (left) shows that retrieving more documents at test time monotonically improves Open-domain QA results for RAG-Sequence, but performance peaks for RAG-Token at 10 retrieved documents. Figure 3 (right) shows that retrieving more documents leads to higher Rouge-L for RAG-Token at the expense of Bleu-1, but the effect is less pronounced for RAG-Sequence.', 'Besides, Zhan et al. [310] examine how dense retrievers generalize to out-of-domain test queries, called extrapolation capacity in their paper. They find that cross-encoder can extrapolate well, but notbi-encoderandsparseretriever. Thispartcanbeextendedtoamoregeneraltopiclow-resourced dense retrieval, and readers can find a comprehensive discussion in a recent survey [241].', 'Another possible approach to understanding the behavior of dense retrievers is axiomatic anal- ysis from classic IR literature [58–60]. Specifically, IR axioms are formalized as a set of relevance constraints that reasonable IR models are desired to satisfy or at least partially satisfy [59, 228], e.g., a document containing more occurrences of a query term should receive a higher score, which can provide both interpretable evidence and learning guidance for traditional IR models. However, 3https://europe.naverlabs.com/research/machine-learning-for-robotics/splade-models/ ACM Transactions on Information Systems, Vol. 42, No. 4, Article 89. Publication date: February 2024.', 'des, the selected hard negatives might contain noisy data (e.g., false negatives), and thus denoised hard negatives are also used to train dense retrievers [207]. Next, we present the detailed discussions for each kind of hard negatives.', 'pacities in different settings based on NQ dataset, including training set over- lap, compositional generalization, and novel-entity generalization. They find that dense retrievers perform worse in the latter two settings than the first setting.', '5.2 Robustness and Generalization Different Retrievers We further investigate the inﬂuence of various text retrievers at test time. Instead of using the E5-large dense retriever, we substitute it with two weaker alternatives in a plug-and-play fashion: E5-base and BM25. Across all datasets, we observe consistent performance gains when investing more test-time compute, although stronger retrievers continue to outperform in terms of absolute performance. Improvements to text retriever quality represent an orthogonal dimension that can further amplify CoRAG’s performance gains.']",The retrieved context does not contain enough information to answer this question.,"Asyncval is designed to simplify and speed up the checkpoint validation process, allowing it to be decoupled from the actual training process.",0.0,0.5,0.0
How much is the size of the BERT model reduced by using the proposed knowledge distillation method?,"['Distillation We applied best practices for training BERT model recently proposed in Liu et al. [2019]. As such, DistilBERT is distilled on very large batches leveraging gradient accumulation (up to 4K examples per batch) using dynamic masking and without the next sentence prediction objective. Data and compute power We train DistilBERT on the same corpus as the original BERT model: a concatenation of English Wikipedia and Toronto Book Corpus [Zhu et al., 2015]. DistilBERT was trained on 8 16GB V100 GPUs for approximately 90 hours. For the sake of comparison, the RoBERTa model [Liu et al., 2019] required 1 day of training on 1024 32GB V100.', '2.4 Optimization BERT is optimized with Adam (Kingma and Ba, 2015) using the following parameters: β1 = 0.9, β2 = 0.999, ǫ = 1e-6 and L2 weight de- cay of 0.01. The learning rate is warmed up over the ﬁrst 10,000 steps to a peak value of 1e-4, and then linearly decayed. BERT trains with a dropout of 0.1 on all layers and at- tention weights, and a GELU activation func- tion (Hendrycks and Gimpel, 2016). Models are pretrained for S = 1,000,000 updates, with mini- batches containing B = 256 sequences of maxi- mum length T = 512 tokens. 2.5 Data BERT is trained on a combination of BOOKCOR- PUS (Zhu et al., 2015) plus English WIKIPEDIA, which totals 16GB of uncompressed text.3 3 Experimental Setup In this section, we describe the experimental setup for our replication study of BERT.', '3.1 Implementation We reimplement BERT in FAIRSEQ (Ott et al., 2019). We primarily follow the original BERT 3Yang et al. (2019) use the same dataset but report having only 13GB of text after data cleaning. This is most likely due to subtle differences in cleaning of the Wikipedia data. optimization hyperparameters, given in Section 2, except for the peak learning rate and number of warmup steps, which are tuned separately for each setting. We additionally found training to be very sensitive to the Adam epsilon term, and in some cases we obtained better performance or improved stability after tuning it. Similarly, we found setting β2 = 0.98 to improve stability when training with large batch sizes.', 'This model was trained on a random sample of more than 1 million scientific articles from the SemanticScholar database [1]. SciBERT also reconfigures the tokenization tool underlying BERT to account for the different vocabulary of the selected corpus. In the process of building the tokenizer, it turned out that the intersection of general-purpose dictionaries and the scientific corpus was 42%, which indicates a significant difference in the distribution of the token between these corpora. Along with an intuitive understanding, this fact gives reason to believe that the use of specific models can give increase productivity. The model was trained following the original BERT training method, but on a different, more compact body of texts and using a specialized vocabulary for tokenization. The training took 7 days on an 8-core TPU (by', '4 Training Procedure Analysis This section explores and quantiﬁes which choices are important for successfully pretraining BERT models. We keep the model architecture ﬁxed.7 Speciﬁcally, we begin by training BERT models with the same conﬁguration as BERTBASE (L = 12, H = 768, A = 12, 110M params).', 'Figure 4 (left) shows test set results on reranking, where models need to select one of 200 passages (top 100 BM25-bi and 100 random candidates). It is interesting to see how strong the sparse models are relative to even a 768- dimensional DE-BERT. As the document length increases, the performance of both the sparse and dense dual encoders worsens; the accuracy of the DE-BERT models falls most rapidly, widening the gap to BM25. Full cross-attention is nearly perfect and does not degrade with document length. DE-BERT-768, whichuses8vectorsofdimension768torepresent documents, strongly outperforms the best DE-BERT model. Even DE-BERT-64, which uses 8 vectors of size only 64 instead (thus requiring the same document collection size as DE-BERT-512 and being faster at inference time), outperforms the DE-BERT models by a large margin.', 'teacher for an additional term in the loss (knowledge distillation). In this setting, there are thus two successive steps of distillation, one during the pre-training phase and one during the adaptation phase. In this case, we were able to reach interesting performances given the size of the model: 79.8 F1 and 70.4 EM, i.e. within 3 points of the full model.', 'As Transfer Learning from large-scale pre-trained models becomes more prevalent in Natural Language Processing (NLP), operating these large models in on-the- edge and/or under constrained computational training or inference budgets remains challenging. In this work, we propose a method to pre-train a smaller general- purpose language representation model, called DistilBERT, which can then be ﬁne- tuned with good performances on a wide range of tasks like its larger counterparts. While most prior work investigated the use of distillation for building task-speciﬁc models, we leverage knowledge distillation during the pre-training phase and show that it is possible to reduce the size of a BERT model by 40%, while retaining 97% of its language understanding capabilities and being 60% faster. To leverage the inductive biases learned by larger models during pre-training, we introduce a triple']","The size of the BERT model is reduced by 40% using the proposed knowledge distillation method, while retaining 97% of its language understanding capabilities.",The size is reduced by 40% while retaining 97% of the original model's performance.,1.0,0.6666666666666666,0.4
How do specific queries differ from abstract queries in LightRAG's dual-level retrieval paradigm?,"['3.2 Dual-level Retrieval Paradigm To retrieve relevant information from both spe- cific document chunks and their complex inter- dependencies, our LightRAG proposes generating query keys at both detailed and abstract levels. • Specific Queries. These queries are detail- oriented and typically reference specific entities within the graph, requiring precise retrieval of information associated with particular nodes or edges. For example, a specific query might be, “Who wrote ’Pride and Prejudice’?” • Abstract Queries. In contrast, abstract queries are more conceptual, encompassing broader top- ics, summaries, or overarching themes that are not directly tied to specific entities. An exam- ple of an abstract query is, “How does artificial intelligence influence modern education?”', 'Effect of query variations on retrieval. There are increasing concerns on the robustness of dense retrieval models to query variations. These studies typically create different types of query variations and examine the performance of dense retrieval models under different query varia- tions. Zhuang et al. [333] present a study on the impact of query typos based on character op- erations (insertion, deletion, substitution, and swap), showing a significant performance drop for BERT-based retriever and reranker. Penha et al. [196] aim to examine how different types of query variations negatively affect the robustness of the retrieval pipeline. To generate query variations, theyconsiderfoursyntax-changingtypes(misspelling,naturality,ordering,andparaphrasing)and two semantics-changing types (gen./specialization, aspect change) for query transformations. Ex- perimental results show that', 'To accommodate diverse query types, the Ligh- tRAG employs two distinct retrieval strategies within the dual-level retrieval paradigm. This en- sures that both specific and abstract inquiries are addressed effectively, allowing the system to de- liver relevant responses tailored to user needs. • Low-Level Retrieval. This level is primar- ily focused on retrieving specific entities along with their associated attributes or relationships. Queries at this level are detail-oriented and aim to extract precise information about particular nodes or edges within the graph. • High-Level Retrieval. This level addresses broader topics and overarching themes. Queries at this level aggregate information across mul- tiple related entities and relationships, provid- ing insights into higher-level concepts and sum- maries rather than specific details.', 'tailed insights. Consequently, this high-level- only retrieval method may struggle with tasks that require precise, detailed answers. • Hybrid Mode: The hybrid mode, or the full- version LightRAG, combines the strengths of both low- and high-level methods. It retrieves a broader set of relationships while simultaneously conducting an in-depth exploration of specific entities. This dual-level approach ensures both breadth in the retrieval process and depth in the analysis, providing a comprehensive view of the data. As a result, LightRAG achieves balanced performance across multiple dimensions.', '3.1 Query Classification Not all queries require to be retrieval-augmented due to the inherent capabilities of LLMs. While RAG can enhance information accuracy and re- duce hallucinations, frequent retrieval costs longer response time. Therefore, we begin by classifying queries to determine retrieval necessity. Queries requiring retrieval proceed through the RAG mod- ules; others are handled directly by LLMs. Retrieval is generally recommended when knowledge beyond the model’s parameters is needed. However, the need for retrieval varies by task. For instance, an LLM trained up to 2023 can handle a translation request for ""Sora was devel- oped by OpenAI"" without retrieval. Conversely, an introduction request for the same topic would require retrieval to provide relevant information.', 'Figure 4: The number of queries in different groups that were divided based on similar level of decrease/increase in performance in the hybrid approach as compared to the lex- ical retrieval model (in percentage).', '• High-level-only Retrieval: The -Low variant pri- oritizes capturing a broader range of content by leveraging entity-wise relationships rather than focusing on specific entities. This approach of- fers a significant advantage in comprehensive- ness, allowing it to gather more extensive and varied information. However, the trade-off is a reduced depth in examining specific entities, which can limit its ability to provide highly de- 10751 Table 2: Performance of ablated versions of LightRAG, using NaiveRAG as reference.', 'in Section 7.1). Considering different relevance characteristics captured by both approaches, there are increas- ing studies that develop a hybrid of sparse and dense retrieval models. A straightforward approach istoaggregatetheretrievalscoresofthetwoapproaches[111,161].Further,aclassifierisemployed to select among sparse, dense, or hybrid retrieval strategies specially for each individual query[5], which aims to balance the cost and utility of retrievers.']","In LightRAG's dual-level retrieval paradigm, specific queries differ from abstract queries in their level of detail and focus. 

Specific queries are detail-oriented, typically referencing specific entities within the graph, and require precise retrieval of information associated with particular nodes or edges. For example, a specific query might be, “Who wrote ’Pride and Prejudice’?”

Abstract queries, on the other hand, are more conceptual, encompassing broader topics, summaries, or overarching themes that are not directly tied to specific entities. An example of an abstract query is, “How does artificial intelligence influence modern education?”","Specific queries are detail-oriented and target precise information associated with particular nodes or edges, whereas abstract queries are conceptual and cover broader topics or themes not tied to specific entities.",1.0,1.0,0.83
How much faster does the GANsformer produce high-quality images on the CLEVR dataset compared to the second-best approach?,"['4.1. Data and Learning Efﬁciency We examine the learning curves of our and competing mod- els (ﬁgure 6, middle) and inspect samples of generated image at different stages of the training (ﬁgure 11 in the supplementary). These results both reveal that our model learns signiﬁcantly faster than competing approaches, in the case of CLEVR producing high-quality images in ap- proximately 3-times less training steps than the second-best approach. To explore the GANsformer learning aptitude further, we have performed experiments where we reduced the size of the dataset that each model (and speciﬁcally, its discriminator) is exposed to during the training (ﬁgure 6, rightmost) to varied degrees. These results similarly validate the model superior data-efﬁciency, especially when as little as 1k images are given to the model.', 'an efﬁcient setup that still scales linearly with the input size on the other. As such, the GANsformer can sidestep the computational costs and applicability constraints incurred by prior work, due to their dense and potentially excessive pairwise connectivity of the standard transformer (Zhang et al., 2019; Brock et al., 2019), and successfully advance generative modeling of images and scenes.', 'We investigate the GANsformer through a suite of experi- ments to study its quantitative performance and qualitative behavior. As we will see below, the GANsformer achieves state-of-the-art results, successfully producing high-quality images for a varied assortment of datasets: FFHQ for hu- man faces (Karras et al., 2019), CLEVR for multi-object scenes (Johnson et al., 2017), and the LSUN-Bedroom (Yu et al., 2015) and Cityscapes (Cordts et al., 2016) datasets for challenging indoor and outdoor scenes. The use of these datasets and their reproduced images are only for the pur- pose of scientiﬁc communication. Further analysis we then conduct in section 4.1, 4.2 and 4.3 provides evidence for sev- eral favorable properties the GANsformer posses, including better data-efﬁciency, enhanced transparency, and stronger disentanglement compared to prior approaches. Section 4.4 then quantitatively', 'ency, enhanced transparency, and stronger disentanglement compared to prior approaches. Section 4.4 then quantitatively assesses the network semantic coverage of the natural image distribution for the CLEVR dataset, while ablation studies in the supplementary empirically val- idate the relative importance of each of the model’s design choices. Taken altogether, our evaluation offers solid ev- idence for the GANsformer effectiveness and efﬁcacy in modeling compsitional images and scenes.', 'Figure 6. (1-2) Performance as a function of initial and ﬁnal layers the attention is applied to. The more layers attention is applied to, the better the model’s performance get and the faster it learns, verifying the effectiveness of the GANsformer approach. (3) Learning curve for the GANsformer and competing approaches. (4): Data-efﬁciency for CLEVR. that the model coherently attend to semantic concepts such as windows, pillows, sidewalks and cars, as well as coherent background regions like carpets, ceiling, and walls. 4.3. Disentanglement', 'To evaluate all models under comparable conditions of train- ing scheme, model size, and optimization details, we im- plement them all within the codebase introduced by the StyleGAN authors. The only exception to that is the re- cent VQGAN model for which we use the ofﬁcial imple- mentation. All models have been trained with images of 256 × 256 resolution and for the same number of training steps, roughly spanning a week on 2 NVIDIA V100 GPUs per model (or equivalently 3-4 days using 4 GPUs). For the GANsformer, we select k – the number of latent variables, from the range of 8–32. Note that increasing the value of k does not translate to increased overall latent dimension, and we rather kept the overall latent equal across models. See supplementary material A for further implementation details, hyperparameter settings and training conﬁguration.', 'est that the GANsformer is particularly adept in modeling scenes of high composition- ality (CLEVR) or layout diversity (Bedroom). Comparing', 'g 3 Attention First Layer 70 Attention Last Layer CLEVR 180 Data Efficiency 8 8 —GAN —k-GAN 160 ~GAN =StyleGAN2 3 ~SAGAN —StyleGAN2 140 -~ =Simplex (Ours) Duplex (Ours) 50 8 ~—Simplex (Ours) ~Duplex (Ours) 120 8 40 o Score Score Score FID 70 FID 8 o o FID 8 40 40 8 —3 —4 —5 3 20 10 —6—7—8 5] —4-5-6—7-8 5 1250k Step Step 1250k Step 1250k 100 1000 10000 Dataset size (Logaritmic) 100000']","According to the retrieved context, the GANsformer produces high-quality images on the CLEVR dataset approximately 3 times less training steps than the second-best approach.",It produces high-quality images in approximately three times fewer training steps.,1.0,1.0,
How are the aggregator variables initialized in the discriminator of the GANsformer?,"['The section is structured as follows: we ﬁrst present a for- mulation of the Bipartite Transformer, a general-purpose generalization of the Transformer (section 3.1). Then, we provide an overview of how the transformer is incorporated into the generator and discriminator framework (section 3.2). We conclude by discussing the merits and distinctive proper- ties of the GANsformer, that set it apart from the traditional GAN and transformer networks (section 3.3). 3.1. The Bipartite Transformer', 'an efﬁcient setup that still scales linearly with the input size on the other. As such, the GANsformer can sidestep the computational costs and applicability constraints incurred by prior work, due to their dense and potentially excessive pairwise connectivity of the standard transformer (Zhang et al., 2019; Brock et al., 2019), and successfully advance generative modeling of images and scenes.', 'GAN StyleGAN GANsformers GANsformerd Disentanglement Modularity Completeness 0.126 0.631 0.071 0.208 0.703 0.124 0.556 0.891 0.195 0.768 0.952 0.270 Informativeness Informativeness’ 0.583 0.434 0.685 0.332 0.899 0.848 0.972 0.963', '4.2. Transparency & Compositionality To gain more insight into the model’s internal representa- tion and its underlying generative process, we visualize the attention distributions produced by the GANsformer as it synthesizes new images. Recall that at each layer of the generator, it casts attention between the k latent variables and the evolving spatial features of the generated image.', 'ery convolution, in this case using trained embeddings to initialize the aggregator variables Y , which may intuitively represent background knowledge the model learns about the scenes. At the last layer, we concatenate these variables to the ﬁnal feature map to make a prediction about the identity of the image source. We note that this construction holds some resemblance to the PatchGAN discriminator intro- duced by (Isola et al., 2017), but whereas PatchGAN pools features according to a ﬁxed predetermined scheme, the GANsformer can gather the information in a more adaptive and selective manner. Overall, using this structure endows the discriminator with the capacity to likewise model long- range dependencies, which can aid the discriminator in its assessment of the image ﬁdelity, allowing it to acquire a more holistic understanding of the visual modality.', '3.3. Summary To recapitulate the discussion above, the GANsformer suc- cessfully uniﬁes the GANs and Transformer for the task of scene generation. Compared to the traditional GANs and transformers, it introduces multiple key innovations: • Bipartite Structure that balances between expressive- ness and efﬁciency, modeling long-range dependencies while maintaining linear computational costs. • Compositional Latent Space with multiple variables that coordinate through attention to produce the image cooperatively, in a manner that matches the inherent compositionality of natural scenes. • Bidirectional Interaction between the latents and the visual features, which allows the reﬁnement and inter- pretation of each in light of the other.', 'Generative Adversarial Transformers 3. The Generative Adversarial Transformer The Generative Adversarial Transformer is a type of Gen- erative Adversarial Network, which involves a generator network (G) that maps a sample from the latent space to the output space (e.g. an image), and a discriminator net- work (D) which seeks to discern between real and fake samples (Goodfellow et al., 2014). The two networks com- pete with each other through a minimax game until reaching an equilibrium. Typically, each of these networks consists of multiple layers of convolution, but in the GANsformer case, we instead construct them using a novel architecture, called Bipartite Transformer, formally deﬁned below.', ""Figure 3. Model Structure. Left: The GANsformer layer, com- posed of a bipartite attention to propagate information from the latents to the evolving features grid, followed by a standard con- volution and upsampling. These layers are stacked multiple times starting from a 4×4 grid, until a ﬁnal high-resolution image is produced. Right: The latents and image features attend to each other to capture the scene compositionality. The GANsformer’s compositional latent space contrasts with the StyleGAN mono- lithic one, where a single latent modulates uniformly the whole scene. these two groups of elements. Speciﬁcally, we then deﬁne: T Q Attention(Q, K, V') = softmax Vd )v ap(X,Y) = Attention (¢(X), k(Y),v(Y))""]",The aggregator variables Y in the discriminator of the GANsformer are initialized using trained embeddings.,They are initialized using trained embeddings that may represent the model's background knowledge about the scenes.,1.0,1.0,0.33
